ticker,issuer_name
IEZ,BlackRock Institutional Trust Company N.A. (IEZ)
IF,Aberdeen Indonesia Fund Inc (IF)
IFEU,BlackRock Institutional Trust Company N.A. (IFEU)
IFF,International Flavors & Fragrances Inc. (IFF)
IFFT,International Flavors & Fragrances Inc. (IFFT)
IFGL,BlackRock Institutional Trust Company N.A. (IFGL)
IFIX,DBX ETF Trust (IFIX)
IFIX_1,Internal Fixation Systems Inc (IFIX)
IFK,International Finance Corporation (IFK)
IFMK,iFresh Inc (IFMK)
IFN,India Fund Inc (IFN)
IFRA,BlackRock Institutional Trust Company N.A. (IFRA)
IFRX,InflaRx N.V. (IFRX)
IFS,Intercorp Financial Services Inc (IFS)
IFSIA,Interface Inc. (IFSIA)
IFV,First Trust Exchange-Traded Fund III (IFV)
IG,Principal Exchange-Traded Funds (IG)
IG_2,Teligent Inc (IG)
IGA,Voya Global Advantage and Premium Opportunity Fund (IGA)
IGACU,IG Acquisition Corp (IGACU)
IGBH,BlackRock Institutional Trust Company N.A. (IGBH)
IGC,India Globalization Capital Inc (IGC)
IGC_U,India Globalization Capital Inc (IGC.U)
IGC_WS,India Globalization Capital Inc (IGC.WS)
IGD,Voya Global Equity Dividend and Premium Opportunity Fund (IGD)
IGE,BlackRock Institutional Trust Company N.A. (IGE)
IGEB,BlackRock Institutional Trust Company N.A. (IGEB)
IGEM,VanEck Vectors ETF Trust (IGEM)
IGF,BlackRock Institutional Trust Company N.A. (IGF)
IGF_1,"India Growth Fund, Inc. (IGF)"
IGHG,ProShares Trust (IGHG)
IGI,Western Asset Investment Grade Defined Opportunity Trust Inc (IGI)
IGI_1,Imagistics International Inc (IGI)
IGIB,BlackRock Institutional Trust Company N.A. (IGIB)
IGIC,International General Insurance Holdings Ltd (IGIC)
IGICW,International General Insurance Holdings Ltd (IGICW)
IGIH,DBX ETF Trust (IGIH)
IGLB,BlackRock Institutional Trust Company N.A. (IGLB)
IGLD,Internet Gold - Golden Lines Ltd (IGLD)
IGM,BlackRock Institutional Trust Company N.A. (IGM)
IGMS,IGM Biosciences Inc (IGMS)
IGN,BlackRock Institutional Trust Company N.A. (IGN)
IGOV,BlackRock Institutional Trust Company N.A. (IGOV)
IGR,CBRE Clarion Global Real Estate Income Fund (IGR)
IGR_1,Integra Inc. (IGR)
IGRO,BlackRock Institutional Trust Company N.A. (IGRO)
IGSB,BlackRock Institutional Trust Company N.A. (IGSB)
IGT,International Game Technology PLC (IGT)
IGTE,IGate Corp. (IGTE)
IGV,BlackRock Institutional Trust Company N.A. (IGV)
IGVT,DBX ETF Trust (IGVT)
IGZ,(IGZ)
IGZ_1,Listing Market Nyse Arca Network BF (IGZ)
IH,iHuman Inc (IH)
IHAK,iShares Trust (IHAK)
IHC,Independence Holding Co. (IHC)
IHD,Voya Emerging Markets High Dividend Equity Fund (IHD)
IHDG,WisdomTree Trust (IHDG)
IHE,BlackRock Institutional Trust Company N.A. (IHE)
IHF,BlackRock Institutional Trust Company N.A. (IHF)
IHG,Intercontinental Hotels Group (IHG)
IHI,BlackRock Institutional Trust Company N.A. (IHI)
IHI_1,"Information Holdings, Inc. (IHI)"
IHIT,Invesco High Income 2023 Target Term Fund (IHIT)
IHM,(IHM)
IHM_1,(IHM)
IHO,Invitel Holdings AS (IHO)
IHRT,iHeartMedia Inc (IHRT)
IHT,Innsuites Hospitality Trust (IHT)
IHTA,Invesco High Income 2024 Target Term Fund (IHTA)
IHY,VanEck Vectors ETF Trust (IHY)
II,IVIVI Technologies Inc (II)
IIA,(IIA)
IIA_1,(IIA)
IID,Voya International High Dividend Equity Income Fund (IID)
IIF,Morgan Stanley India Investment Fund Inc (IIF)
IIGD,Invesco Exchange-Traded Self-Indexed Fund Trust (IIGD)
IIGV,Invesco Exchange-Traded Self-Indexed Fund Trust (IIGV)
IIH,"Merrill Lynch & Co., Inc (IIH)"
III,Information Services Group Inc. (III)
IIIN,"Insteel Industries, Inc. (IIIN)"
III_U,(III.U)
IIIV,i3 Verticals Inc (IIIV)
III_WS,Information Services Group Inc. (III.WS)
IIJI,Internet Initiative Japan Inc (IIJI)
IIL,Morgan Stanley (IIL)
IIM,Invesco Value Municipal Income Trust (IIM)
IIN,IntriCon Corporation (IIN)
IIPR,Innovative Industrial Properties Inc (IIPR)
IIPR_P_A,Innovative Industrial Properties Inc (IIPRpA)
IIPR_P_RA,Innovative Industrial Properties Inc (IIPRpRA)
IIVI,Ii-Vi Inc. (IIVI)
IIVIP,Ii-Vi Inc. (IIVIP)
IJAN,Innovator ETFs Trust (IJAN)
IJH,BlackRock Institutional Trust Company N.A. (IJH)
IJJ,BlackRock Institutional Trust Company N.A. (IJJ)
IJK,BlackRock Institutional Trust Company N.A. (IJK)
IJR,BlackRock Institutional Trust Company N.A. (IJR)
IJS,BlackRock Institutional Trust Company N.A. (IJS)
IJT,BlackRock Institutional Trust Company N.A. (IJT)
IJUL,Innovator ETFs Trust (IJUL)
IKNX,Ikonics Corporation (IKNX)
ILB,(ILB)
ILB_1,Pimco Exchange Traded Fund (ILB)
ILB_2,(ILB)
ILC,"Ilinc Communications, Inc (ILC)"
ILE,Isolagen Inc. (ILE)
ILF,BlackRock Institutional Trust Company N.A. (ILF)
ILG,ILG Inc (ILG)
ILI,"Interleukin Genetics, Inc. (ILI)"
ILMN,Illumina Inc (ILMN)
ILPT,Industrial Logistics Properties Trust (ILPT)
ILTB,BlackRock Institutional Trust Company N.A. (ILTB)
ILX,ILX Resorts Inc. (ILX)
ILY,(ILY)
ILY_1,(ILY)
IMAB,I-Mab (IMAB)
IMAC,IMAC Holdings Inc (IMAC)
IMACW,IMAC Holdings Inc (IMACW)
IMAX,Imax Corp (IMAX)
IMBI,iMedia Brands Inc (IMBI)
IMCL,Imclone Systems Inc. (IMCL)
IMDZ,Immune Design Corp (IMDZ)
IMED,ETF Managers Group LLC (IMED)
IMGN,"Immunogen, Inc. (IMGN)"
IMH,"Impac Mortgage Holdings, Inc. (IMH)"
IMI,Intermolecular Inc (IMI)
IMI_1,Sanpaolo IMI (IMI)
IMKTA,"Ingles Markets, Inc. (IMKTA)"
IMLP,Barclays Bank PLC (IMLP)
IMM,Immtech Pharmaceuticals Inc (IMM)
IMMP,Immutep Limited (IMMP)
IMMR,Immersion Corp (IMMR)
IMMU,"Immunomedics, Inc. (IMMU)"
IMNM,Immunome Inc (IMNM)
IMNP,Immune Pharmaceuticals Inc (IMNP)
IMO,Imperial Oil Ltd. (IMO)
IMOM,Alpha Architect Etf Trust (IMOM)
IMOS,Chipmos Technologies Inc (IMOS)
IMOS_1,Chipmos Technologies Ltd (IMOS)
IMPV,Imperva Inc (IMPV)
IMPV_1,Improvenet Inc (IMPV)
IMPX_U,AEA-Bridges Impact Corp (IMPX.U)
IMRA,Imara Inc (IMRA)
IMRN,Immuron Limited (IMRN)
IMRNW,Immuron Limited (IMRNW)
IMTB,BlackRock Institutional Trust Company N.A. (IMTB)
IMTE,Integrated Media Technology Limited (IMTE)
IMTM,BlackRock Institutional Trust Company N.A. (IMTM)
IMTM_1,Investment Management Holdings plc (IMTM)
IMTX,Immatics N.V (IMTX)
IMTXW,Immatics N.V (IMTXW)
IMUC,Immunocellular Therapeutics Ltd (IMUC)
IMUCWS,Immunocellular Therapeutics Ltd (IMUCWS)
IMUC_WS,Immunocellular Therapeutics Ltd (IMUC.WS)
IMUX,Immunic Inc (IMUX)
IMV,IMV Inc (IMV)
IMVT,Immunovant Inc (IMVT)
IMVTU,Immunovant Inc (IMVTU)
IMVTW,Immunovant Inc (IMVTW)
IMW,"Merrill Lynch & Co., Inc (IMW)"
IMX,Implant Sciences Corp (IMX)
IMXI,International Money Express Inc. (IMXI)
IMXIW,International Money Express Inc. (IMXIW)
INAP,Internap Corp (INAP)
INAP_1,BAB Holdings Inc. (INAP)
INAQU,INSU Acquisition Corp II (INAQU)
INB,Cohen & Steers Global Income Builder Inc. (INB)
INB_1,"Integrated BioPharma, Inc. (INB)"
INBK,First Internet Bancorp (INBK)
INBKL,First Internet Bancorp (INBKL)
INBX,Inhibrx Inc (INBX)
INCO,Columbia ETF Trust II (INCO)
INCR,INC Research Holdings Inc (INCR)
INCY,Incyte Corp. (INCY)
INDA,BlackRock Institutional Trust Company N.A. (INDA)
INDB,Independent Bank Corp. (INDB)
INDF,BlackRock Institutional Trust Company N.A. (INDF)
INDL,Direxion Shares ETF Trust (INDL)
INDO,Indonesia Energy Corp Ltd (INDO)
INDS,Pacer Funds Trust (INDS)
INDUU,Industrea Acquisition Corp (INDUU)
INDY,BlackRock Institutional Trust Company N.A. (INDY)
INF,Brookfield Global Listed Infrastructure Income Fund Inc (INF)
INF_1,Infinity Broadcasting Corp (INF)
INFA,Informatica Corp. (INFA)
INFI,Infinity Pharmaceuticals Inc. (INFI)
INFN,Infinera Corp. (INFN)
INFO,IHS Markit Ltd (INFO)
INFR,Legg Mason ETF Investment Trust (INFR)
INFU,InfuSystem Holdings Inc (INFU)
INFY,Infosys Ltd (INFY)
ING,ING Groep N.V. (ING)
INGN,Inogen Inc (INGN)
INGR,Ingredion Inc (INGR)
INGR_1,Indo Gulf Fertilizers Ltd. (INGR)
INGR_2,Intergraph Corp. (INGR)
INHX,Inhibitex Inc (INHX)
INKM,SSgA Active Trust (INKM)
INMB,INmune Bio Inc (INMB)
INMD,Inmode Ltd (INMD)
INN,Summit Hotel Properties Inc (INN)
INN_P_B,Summit Hotel Properties Inc (INNpB)
INN_P_B_CL,Summit Hotel Properties Inc (INNpB.CL)
INN_P_C,Summit Hotel Properties Inc (INNpC)
INN_P_C_CL,Summit Hotel Properties Inc (INNpC.CL)
INN_P_D,Summit Hotel Properties Inc (INNpD)
INN_P_E,Summit Hotel Properties Inc (INNpE)
INN_P_RBCL,Summit Hotel Properties Inc (INNpRBCL)
INN_P_RC,Summit Hotel Properties Inc (INNpRC)
INN_P_RCCL,Summit Hotel Properties Inc (INNpRCCL)
INN_P_RD,Summit Hotel Properties Inc (INNpRD)
INN_P_RE,Summit Hotel Properties Inc (INNpRE)
INNTW,Innovate Biopharmaceuticals Inc (INNTW)
INO,Inovio Pharmaceuticals Inc (INO)
INOD,Innodata Inc (INOD)
INOV,Inovalon Holdings Inc (INOV)
INP,Barclays Bank PLC (INP)
INPX,Inpixon (INPX)
INR,Morgan Stanley (INR)
INS,Intelligent Systems Corp. (INS)
INSE,Inspired Entertainment Inc (INSE)
INSG,Inseego Corp (INSG)
INSI,Insight Select Income Fund (INSI)
INSM,Insmed Inc (INSM)
INSP,Inspire Medical Systems Inc (INSP)
INST_1,Instructure Inc (INST)
INSUU,Insurance Acquisition Corp (INSUU)
INSUW,Shift Technologies Inc (INSUW)
INSUW_1,Shift Technologies Inc (INSUW)
INSW,International Seaways Inc (INSW)
INSW_1,International Seaways Inc (INSW)
INSW_P_A,International Seaways Inc (INSWpA)
INSW_P_A_1,(INSWpA)
INSY,"Insys Therapeutics, Inc (INSY)"
INT,World Fuel Services Corp. (INT)
INTC,Intel Corp. (INTC)
INTF,BlackRock Institutional Trust Company N.A. (INTF)
INTG,Intergroup Corp. (INTG)
INTT,Intest Corp. (INTT)
INTU,Intuit Inc (INTU)
INTX,Intersections Inc (INTX)
INTZ,Intrusion Inc (INTZ)
INUV,Inuvo Inc (INUV)
INV,Innovaro Inc (INV)
INVA,Innoviva Inc (INVA)
INVA_1,Inova Technology Inc (INVA)
INVE,Identiv Inc (INVE)
INVH,Invitation Homes Inc (INVH)
INWK,Innerworkings Inc (INWK)
INXN,InterXion Holding NV (INXN)
INXN_1,Interxion Holding NV (INXN)
INXX,Columbia ETF Trust II (INXX)
INY,SSgA Active Trust (INY)
INZY,Inozyme Pharma Inc (INZY)
IO,ION Geophysical Corp (IO)
IOC,Interoil Corp. (IOC)
IOIL,IndexIQ ETF Trust (IOIL)
ION,ION Media Networks Inc (ION)
IONS,Ionis Pharmaceuticals Inc (IONS)
IOO,BlackRock Institutional Trust Company N.A. (IOO)
IOR,"Income Opportunity Realty Investors, Inc. (IOR)"
IOSP,Innospec Inc (IOSP)
IOTS,Adesto Technologies Corp (IOTS)
IOVA,Iovance Biotherapeutics Inc (IOVA)
IOX,"Iomed, Inc. (IOX)"
IP,International Paper Co. (IP)
IPA,Interpharm Holdings Inc (IPA)
IPAC,BlackRock Institutional Trust Company N.A. (IPAC)
IPAR,"Inter Parfums, Inc. (IPAR)"
IPAS,Ipass Inc (IPAS)
IPAY,ETF Managers Group LLC (IPAY)
IPB,"Merrill Lynch Depositor, Inc. (IPB)"
IPCC,Infinity Property & Casualty Corp (IPCC)
IPCI,Intellipharmaceutics International Inc (IPCI)
IPD,SSgA Active Trust (IPD)
IPDN,Professional Diversity Network Inc (IPDN)
IPF,SSgA Active Trust (IPF)
IPFF,BlackRock Institutional Trust Company N.A. (IPFF)
IPG,"Interpublic Group Of Cos., Inc. (IPG)"
IPGP,IPG Photonics Corp (IPGP)
IPHA,Innate Pharma (IPHA)
IPHI,Inphi Corp (IPHI)
IPHS,Innophos Holdings Inc (IPHS)
IPI,Intrepid Potash Inc (IPI)
IPI_1,Retail Pro Inc (IPI)
IPIC,iPic Entertainment Inc (IPIC)
IPJ_A,(IPJ.A)
IPJ_B,(IPJ.B)
IPK,SSgA Active Trust (IPK)
IPKW,Invesco Capital Management LLC (IPKW)
IPLDP,Interstate Power and Light Co (IPLDP)
IPL_P_D,Interstate Power and Light Company (IPLpD)
IPL_P_RD,Interstate Power and Light Co (IPLpRD)
IPN,SSgA Active Trust (IPN)
IPO,Renaissance Capital Greenwich Funds (IPO)
IPOAU,Social Capital Hedosophia Holdings Corp (IPOAU)
IPOA_U,(IPOA.U)
IPOAWS,Social Capital Hedosophia Holdings Corp (IPOAWS)
IPOB,Social Capital Hedosophia Holdings Corp II (IPOB)
IPOB_U,Social Capital Hedosophia Holdings Corp II (IPOB.U)
IPOB_WS,Social Capital Hedosophia Holdings Corp II (IPOB.WS)
IPOC,Social Capital Hedosophia Holdings Corp III (IPOC)
IPOC_U,Social Capital Hedosophia Holdings Corp III (IPOC.U)
IPOC_WS,Social Capital Hedosophia Holdings Corp III (IPOC.WS)
IPOD_U,Social Capital Hedosophia Holdings Corp IV (IPOD.U)
IPOE_U,Social Capital Hedosophia Holdings Corp V (IPOE.U)
IPOF_U,Social Capital Hedosophia Holdings Corp VI (IPOF.U)
IPOS,Renaissance Capital Greenwich Funds (IPOS)
IPS,SSgA Active Trust (IPS)
IPT,Iparty Corp. (IPT)
IPU,SSgA Active Trust (IPU)
IPV,InterPrivate Acquisition Corp (IPV)
IPV_U,InterPrivate Acquisition Corp (IPV.U)
IPV_WS,InterPrivate Acquisition Corp (IPV.WS)
IPW,SSgA Active Trust (IPW)
IPWR,Ideal Power Inc (IPWR)
IPXL,"Impax Laboratories, Inc. (IPXL)"
IQ,iQIYI Inc (IQ)
IQDE,FlexShares Trust (IQDE)
IQDF,FlexShares Trust (IQDF)
IQDG,WisdomTree Trust (IQDG)
IQDY,FlexShares Trust (IQDY)
IQI,Invesco Quality Municipal Income Trust (IQI)
IQLT,BlackRock Institutional Trust Company N.A. (IQLT)
IQV,IQVIA Holdings Inc (IQV)
IR,Ingersoll-Rand Inc (IR)
IRBO,BlackRock Institutional Trust Company N.A. (IRBO)
IRBT,Irobot Corp (IRBT)
IRCP,Irsa Propiedades Comerciales S.A. (IRCP)
IRDM,Iridium Communications Inc (IRDM)
IRDMB,Iridium Communications Inc (IRDMB)
IRET,Investors Real Estate Trust (IRET)
IRET_P_B_CL,Investors Real Estate Trust (IRETpB.CL)
IRET_P_C,Investors Real Estate Trust (IRETpC)
IRET_P_RC,Investors Real Estate Trust (IRETpRC)
IRIX,IRIDEX Corp. (IRIX)
IRL,New Ireland Fund Inc (IRL)
IRLR,New Ireland Fund Inc (IRLr)
IRLRW,New Ireland Fund Inc (IRLrw)
IRM,Iron Mountain Inc. (IRM)
IRMD,Iradimed Corp (IRMD)
IRN,Rewards Network Inc (IRN)
IRO,Guggenheim Funds Investment Advisors LLC (IRO)
IROQ,IF Bancorp Inc (IROQ)
IRR,Voya Natural Resources Equity Income Fund (IRR)
IRS,IRSA (IRS)
IRT,Independence Realty Trust Inc (IRT)
IRT_1,IRT Property Co. (IRT)
IRTC,iRhythm Technologies Inc (IRTC)
IRV,SSgA Active Trust (IRV)
IRW,IBT Bancorp Inc. (PA) (IRW)
IRWD,Ironwood Pharmaceuticals Inc (IRWD)
IRY,SSgA Active Trust (IRY)
ISBC,Investors Bancorp Inc (ISBC)
ISCA,International Speedway Corp. (ISCA)
ISCF,BlackRock Institutional Trust Company N.A. (ISCF)
ISD,PGIM High Yield Bond Fund Inc (ISD)
ISDR,Issuer Direct Corp (ISDR)
ISDX,Invesco Exchange-Traded Self-Indexed Fund Trust (ISDX)
ISEE,IVERIC bio Inc (ISEE)
ISEM,Invesco Exchange-Traded Self-Indexed Fund Trust (ISEM)
ISF_CL,ING Groep N.V. (ISF.CL)
ISG,ING Groep NV (ISG)
ISG_1,ING Groep N.V. (ISG)
ISG_2,International Steel Group Inc (ISG)
ISG_CL,ING Groep NV (ISG.CL)
ISHG,BlackRock Institutional Trust Company N.A. (ISHG)
ISIG,"Insignia Systems, Inc. (ISIG)"
ISIL,Intersil Corporation (ISIL)
ISL,Aberdeen Israel Fund Inc (ISL)
ISLE,Isle Of Capri Casinos Inc (ISLE)
ISLN,Isilon System Inc (ISLN)
ISM,Navient Corp (ISM)
ISMD,Northern Lights Fund Trust IV (ISMD)
ISNS,"Image Sensing Systems, Inc. (ISNS)"
ISO,ISCO International Inc. (ISO)
ISP_CL,Ing Groep Nv Cva (ISP.CL)
ISP_CL_1,Ing Groep NV (ISP.CL)
ISPH,Inspire Pharmaceuticals Inc (ISPH)
ISR,"Isoray, Inc. (ISR)"
ISR_1,INX Inc (ISR)
ISRA,VanEck Vectors ETF Trust (ISRA)
ISRG,Intuitive Surgical Inc (ISRG)
ISRL,"Isramco, Inc. (ISRL)"
ISSC,Innovative Solutions And Support Inc (ISSC)
ISSI,"Integrated Silicon Solution, Inc. (ISSI)"
IST,SSgA Active Trust (IST)
ISTB,BlackRock Institutional Trust Company N.A. (ISTB)
ISTR,Investar Holding Corp (ISTR)
ISTR_1,Internationalstores.Com Inc (ISTR)
ISV,Insite Vision Inc. (ISV)
ISZE,BlackRock Institutional Trust Company N.A. (ISZE)
IT,"Gartner, Inc. (IT)"
ITA,BlackRock Institutional Trust Company N.A. (ITA)
ITACU,Industrial Tech Acquisitions Inc (ITACU)
ITB,BlackRock Institutional Trust Company N.A. (ITB)
ITCB,Itau Corpbanca (ITCB)
ITCI,Intra-Cellular Therapies Inc (ITCI)
ITEQ,ETF Managers Group LLC (ITEQ)
ITG,Investment Technology Group Inc. (ITG)
ITGR,Integer Holdings Corp (ITGR)
ITGR_1,"Integrity Media, Inc. (ITGR)"
ITI,Iteris Inc. (ITI)
ITIC,Investors Title Co. (ITIC)
ITL,Northern Trust Global Investments (ITL)
ITL_CL,(ITL.CL)
ITM,VanEck Vectors ETF Trust (ITM)
ITM_A,(ITM.A)
ITM_A_1,Morgan Stanley (ITM.A)
ITML,Van Eck Associates Corporation (ITML)
ITMN,"Intermune, Inc. (ITMN)"
ITMR,Itamar Medical Ltd (ITMR)
ITMS,Van Eck Associates Corporation (ITMS)
ITOS,ITeos Therapeutics Inc (ITOS)
ITOT,BlackRock Institutional Trust Company N.A. (ITOT)
ITP,IT Tech Packaging Inc (ITP)
ITRG,Integra Resources Corp (ITRG)
ITRI,Itron Inc. (ITRI)
ITRM,Iterum Therapeutics Plc (ITRM)
ITRN,Ituran Location And Control Ltd. (ITRN)
ITT,ITT Inc (ITT)
ITT_1,ITT Corporation (ITT)
ITUB,Itau Unibanco Holding S.A. (ITUB)
ITUS,Anixa Biosciences Inc (ITUS)
ITUS_1,ITUS Corp (ITUS)
ITW,"Illinois Tool Works, Inc. (ITW)"
IUS,Invesco Exchange-Traded Self-Indexed Fund Trust (IUS)
IUSB,BlackRock Institutional Trust Company N.A. (IUSB)
IUSG,BlackRock Institutional Trust Company N.A. (IUSG)
IUSS,Invesco Exchange-Traded Self-Indexed Fund Trust (IUSS)
IUSV,BlackRock Institutional Trust Company N.A. (IUSV)
IVA,Inventiva (IVA)
IVA_1,ValueRich Inc (IVA)
IVAC,"Intevac, Inc. (IVAC)"
IVAL,Alpha Architect Etf Trust (IVAL)
IVAN,Ivanhoe Energy Inc. (IVAN)
IVC,Invacare Corp. (IVC)
IVE,BlackRock Institutional Trust Company N.A. (IVE)
IVES,ETF Managers Group LLC (IVES)
IVH,Ivy High Income Opportunities Fund (IVH)
IVLU,BlackRock Institutional Trust Company N.A. (IVLU)
IVOG,"Vanguard Group, Inc. (IVOG)"
IVOL,Krane Shares Trust (IVOL)
IVOO,"Vanguard Group, Inc. (IVOO)"
IVOP,Barclays Bank PLC (IVOP)
IVOV,"Vanguard Group, Inc. (IVOV)"
IVR,Invesco Mortgage Capital Inc (IVR)
IVR_P_A,Invesco Mortgage Capital Inc (IVRpA)
IVR_P_B,Invesco Mortgage Capital Inc (IVRpB)
IVR_P_C,Invesco Mortgage Capital Inc (IVRpC)
IVR_P_RA,Invesco Mortgage Capital Inc (IVRpRA)
IVR_P_RC,Invesco Mortgage Capital Inc (IVRpRC)
IVTY,Invuity Inc (IVTY)
IVV,BlackRock Institutional Trust Company N.A. (IVV)
IVW,BlackRock Institutional Trust Company N.A. (IVW)
IVZ,Invesco Ltd (IVZ)
IW,"Imageware Systems, Inc. (IW)"
IWB,BlackRock Institutional Trust Company N.A. (IWB)
IWC,BlackRock Institutional Trust Company N.A. (IWC)
IWD,BlackRock Institutional Trust Company N.A. (IWD)
IWF,BlackRock Institutional Trust Company N.A. (IWF)
IWK,AB Svensk Exportkredit (IWK)
IWL,BlackRock Institutional Trust Company N.A. (IWL)
IWM,BlackRock Institutional Trust Company N.A. (IWM)
IWN,BlackRock Institutional Trust Company N.A. (IWN)
IWO,BlackRock Institutional Trust Company N.A. (IWO)
IWP,BlackRock Institutional Trust Company N.A. (IWP)
IWR,BlackRock Institutional Trust Company N.A. (IWR)
IWS,BlackRock Institutional Trust Company N.A. (IWS)
IWV,BlackRock Institutional Trust Company N.A. (IWV)
IWX,BlackRock Institutional Trust Company N.A. (IWX)
IWY,BlackRock Institutional Trust Company N.A. (IWY)
IX,Orix Corporation (IX)
IXC,BlackRock Institutional Trust Company N.A. (IXC)
IXG,BlackRock Institutional Trust Company N.A. (IXG)
IXJ,BlackRock Institutional Trust Company N.A. (IXJ)
IXN,BlackRock Institutional Trust Company N.A. (IXN)
IXP,BlackRock Institutional Trust Company N.A. (IXP)
IXSE,WisdomTree Trust (IXSE)
IXUS,BlackRock Institutional Trust Company N.A. (IXUS)
IXYS,IXYS Corp. (IXYS)
IYC,BlackRock Institutional Trust Company N.A. (IYC)
IYE,BlackRock Institutional Trust Company N.A. (IYE)
IYF,BlackRock Institutional Trust Company N.A. (IYF)
IYG,BlackRock Institutional Trust Company N.A. (IYG)
IYH,BlackRock Institutional Trust Company N.A. (IYH)
IYJ,BlackRock Institutional Trust Company N.A. (IYJ)
IYK,BlackRock Institutional Trust Company N.A. (IYK)
IYLD,BlackRock Institutional Trust Company N.A. (IYLD)
IYM,BlackRock Institutional Trust Company N.A. (IYM)
IYR,BlackRock Institutional Trust Company N.A. (IYR)
IYT,BlackRock Institutional Trust Company N.A. (IYT)
IYW,BlackRock Institutional Trust Company N.A. (IYW)
IYY,BlackRock Institutional Trust Company N.A. (IYY)
IYZ,BlackRock Institutional Trust Company N.A. (IYZ)
IZEA,IZEA Worldwide Inc (IZEA)
IZRL,ARK Investment Management LLC (IZRL)
J,"Jacobs Engineering Group, Inc. (J)"
JACK,"Jack In The Box, Inc. (JACK)"
JADE,LJ International Inc (JADE)
JAG_1,Jagged Peak Energy Inc (JAG)
JAG_2,Jaguar Mining Inc (JAG)
JAGG,J.P. Morgan Exchange-Traded Fund Trust (JAGG)
JAGX,Jaguar Health Inc (JAGX)
JAKK,Jakks Pacific Inc. (JAKK)
JAMF,Jamf Holding Corp (JAMF)
JAMF_1,WisdomTree Trust (DDJP)
JAN,JanOne Inc (JAN)
JASN,Jason Industries Inc (JASN)
JASNW,Jason Industries Inc (JASNW)
JASO,JA Solar (JASO)
JAV,"Javelin Pharmaceuticals, Inc. (JAV)"
JAX,J. Alexanders Holdings Inc (JAX)
JAX_1,J. Alexander`s Corp (JAX)
JAZ,Jazz Technologies Inc (JAZ)
JAZ_U,(JAZ.U)
JAZ_WS,Jazz Technologies Inc (JAZ.WS)
JAZZ,Jazz Pharmaceuticals plc (JAZZ)
JBGS,JBG SMITH Properties (JBGS)
JBHT,"J.B. Hunt Transport Services, Inc. (JBHT)"
JBK,Lehman ABS Corp (JBK)
JBL,Jabil Inc (JBL)
JBLU,Jetblue Airways Corp (JBLU)
JBN,Select Asset Inc. (JBN)
JBR,Select Asset Inc. (JBR)
JBRI,James Purpose Based Investment ETF (JBRI)
JBRI_1,Exchange Traded Concepts Trust (JBRI)
JBSS,"Sanfilippo (John B.) & Son, Inc (JBSS)"
JBT,John Bean Technologies Corp (JBT)
JCAP,Jernigan Capital Inc (JCAP)
JCAP_P_B,Jernigan Capital Inc (JCAPpB)
JCAP_P_RB,Jernigan Capital Inc (JCAPpRB)
JCE,Nuveen Core Equity Alpha Fund (JCE)
JCI,Johnson Controls International plc (JCI)
JCI_1,Johnson Controls Inc (JCI)
JCO,Nuveen Credit Opportunities 2022 Target Term Fund (JCO)
JCO_1,"Javelin Investment Management, LLC (JCO)"
JCOM,J2 Global Inc. (JCOM)
JCP,J.C. Penny Inc (Holding Co.) (JCP)
JCPB,J.P. Morgan Exchange-Traded Fund Trust (JCPB)
JCS,"Communications Systems, Inc. (JCS)"
JCTCF,Jewett-Cameron Trading Co. Ltd. (JCTCF)
JD,JD.com Inc (JD)
JDAS,JDA Software Group Inc. (JDAS)
JDD,Nuveen Diversified Dividend and Income Fund (JDD)
JDIV,J.P. Morgan Exchange-Traded Fund Trust (JDIV)
JDO,Jed Oil Inc (JDO)
JDST,Direxion Shares ETF Trust (JDST)
JE,Just Energy Group Inc (JE)
JEF,Jefferies Financial Group Inc (JEF)
JELD,JELD-WEN Holding Inc. (JELD)
JEM,Barclays Bank PLC (JEM)
JEM_1,(JEM)
JEM_2,(JEM)
JEMD,Nuveen Emerging Markets Debt 2022 Target Term Fund (JEMD)
JEN,"Jennifer Convertibles, Inc. (JEN)"
JE_P_A,Just Energy Group Inc (JEpA)
JEPI,J.P. Morgan Exchange-Traded Fund Trust (JEPI)
JE_P_RA,Just Energy Group Inc (JEpRA)
JEQ,Aberdeen Japan Equity Fund Inc (JEQ)
JETS,ETF Series Solutions Trust (JETS)
JFE_TEST,(JFE.TEST)
JFH_TEST,(JFH.TEST)
JFIN,Jiayin Group Inc (JFIN)
JFKKR,8i Enterprises Acquisition Corp (JFKKR)
JFKKU,8i Enterprises Acquisition Corp (JFKKU)
JFKKW,Diginex Ltd (JFKKW)
JFKKW_1,8i Enterprises Acquisition Corp (JFKKW)
JFP,Nuveen Tax-Advantaged Floating Rate Fund (JFP)
JFR,Nuveen Floating Rate Income Fund (JFR)
JFT,JPMorgan Chase & Co. (JFT)
JFU,9F Inc (JFU)
JFW_TEST,(JFW.TEST)
JG,Aurora Mobile Ltd (JG)
JGH,Nuveen Global High Income Fund (JGH)
JHA,Nuveen High Income December 2018 Target Term Fund (JHA)
JHAA,Nuveen Corporate Income 2023 Target Term Fund (JHAA)
JHB,Nuveen Corporate Income November 2021 Target Term Fund (JHB)
JHD,Nuveen High Income December 2019 Target Term Fund (JHD)
JHDG,WisdomTree Trust (JHDG)
JHEM,John Hancock Investment Management LLC (JHEM)
JHG,Janus Henderson Group plc (JHG)
JHI,John Hancock Investors Trust (JHI)
JHMA,John Hancock Investment Management LLC (JHMA)
JHMC,John Hancock Investment Management LLC (JHMC)
JHMD,John Hancock Investment Management LLC (JHMD)
JHME,John Hancock Investment Management LLC (JHME)
JHMF,John Hancock Investment Management LLC (JHMF)
JHMH,John Hancock Investment Management LLC (JHMH)
JHMI,John Hancock Investment Management LLC (JHMI)
JHML,John Hancock Investment Management LLC (JHML)
JHMM,John Hancock Investment Management LLC (JHMM)
JHMS,John Hancock Investment Management LLC (JHMS)
JHMT,John Hancock Investment Management LLC (JHMT)
JHMU,John Hancock Investment Management LLC (JHMU)
JHS,John Hancock Income Securities Trust (JHS)
JHSC,John Hancock Investment Management LLC (JHSC)
JHX,James Hardie Industries plc (JHX)
JHY,Nuveen High Income 2020 Target Term Fund (JHY)
JIH,Juniper Industrial Holdings Inc (JIH)
JIH_U,Juniper Industrial Holdings Inc (JIH.U)
JIH_WS,Juniper Industrial Holdings Inc (JIH.WS)
JILL,J.Jill Inc (JILL)
JILL_1,"J Jill Group, Inc (JILL)"
JJA,Barclays Bank PLC (JJA)
JJA_1,Barclays Bank PLC (JJA)
JJAB,iPath Series B Bloomberg Agriculture Subindex TR ETN (JJAB)
JJAB_1,Barclays Bank PLC (JJAB)
JJC,Barclays Bank PLC (JJC)
JJC_1,Barclays Bank PLC (JJC)
JJCB,iPath Series B Bloomberg Copper Subindex TR ETN (JJCB)
JJCB_1,Barclays Bank PLC (JJCB)
JJE,Barclays Bank PLC (JJE)
JJEB,iPath Series B Bloomberg Energy Subindex TR ETN (JJEB)
JJEB_1,Barclays Bank PLC (JJEB)
JJG,Barclays Bank PLC (JJG)
JJG_1,Barclays Bank PLC (JJG)
JJGB,iPath Series B Bloomberg Grains Subindex Total Return ETN (JJGB)
JJGB_1,Barclays Bank PLC (JJGB)
JJM,Barclays Bank PLC (JJM)
JJMB,iPath Series B Bloomberg Industrial Metals Subindex RT ETN (JJMB)
JJMB_1,Barclays Bank PLC (JJMB)
JJN,Barclays Bank PLC (JJN)
JJP,Barclays Bank PLC (JJP)
JJPB,iPath Series B Bloomberg Precious Metals Subindex TR ETN (JJPB)
JJPB_1,Barclays Bank PLC (JJPB)
JJS,Barclays Bank PLC (JJS)
JJS_1,Barclays Bank PLC (JJS)
JJSB,iPath Series B Bloomberg Softs Subindex TR ETN (JJSB)
JJSB_1,Barclays Bank PLC (JJSB)
JJSF,J&J Snack Foods Corp. (JJSF)
JJT,Barclays Bank PLC (JJT)
JJT_1,Barclays Bank PLC (JJT)
JJTB,iPath Series B Bloomberg Tin Subindex Total Return ETN (JJTB)
JJTB_1,Barclays Bank PLC (JJTB)
JJU,Barclays Bank PLC (JJU)
JJUB,iiPath Series B Bloomberg Aluminum Subindex TR ETN (JJUB)
JJUB_1,Barclays Bank PLC (JJUB)
JKA,Golden Gate Partners Inc (JKA)
JKA_U,(JKA.U)
JKA_WS,Golden Gate Partners Inc (JKA.WS)
JKD,BlackRock Institutional Trust Company N.A. (JKD)
JKE,BlackRock Institutional Trust Company N.A. (JKE)
JKF,BlackRock Institutional Trust Company N.A. (JKF)
JKG,BlackRock Institutional Trust Company N.A. (JKG)
JKH,BlackRock Institutional Trust Company N.A. (JKH)
JKH_1,John Keells PLC (JKH)
JKHY,"Jack Henry & Associates, Inc. (JKHY)"
JKI,BlackRock Institutional Trust Company N.A. (JKI)
JKJ,BlackRock Institutional Trust Company N.A. (JKJ)
JKK,BlackRock Institutional Trust Company N.A. (JKK)
JKL,BlackRock Institutional Trust Company N.A. (JKL)
JKS,JinkoSolar Holding Co. Ltd (JKS)
JLI,Jesup & Lamont Inc (JLI)
JLL,Jones Lang Lasalle Inc. (JLL)
JLN,"Jaclyn, Inc. (JLN)"
JLS,Nuveen Mortgage and Income Fund (JLS)
JMBA,Jamba Inc (JMBA)
JMBS,Janus Capital Management LLC (JMBS)
JMEI,Jumei International Holding Ltd (JMEI)
JMF,Nuveen Energy MLP Total Return Fund (JMF)
JMIA,Jumia Technologies Ag (JMIA)
JMIN,J.P. Morgan Exchange-Traded Fund Trust (JMIN)
JMLP,Nuveen All Cap Energy MLP Opportunities Fund (JMLP)
JMM,Nuveen Multi-Market Income Fund (JMM)
JMOM,J.P. Morgan Exchange-Traded Fund Trust (JMOM)
JMP,JMP Group LLC (JMP)
JMPB,JMP Group Inc (JMPB)
JMPB_1,JMP Group Inc (JMPB)
JMPB_CL,JMP Group Inc (JMPB.CL)
JMPC,JMP Group Inc (JMPC)
