ticker,issuer_name
DDSS,Labopharm Inc. (DDSS)
DDT,Dillards Cap Tr I (DDT)
DDWM,WisdomTree Trust (DDWM)
DE,Deere & Co. (DE)
DEA,Easterly Government Properties Inc (DEA)
DEACU,Diamond Eagle Acquisition Corp (DEACU)
DEAR,"Dearborn Bancorp, Inc. (DEAR)"
DECK,Deckers Outdoor Corp. (DECK)
DEE,Deutsche Bank AG London (DEE)
DEED,First Trust Exchange-Traded Fund VIII (DEED)
DEEF,DBX ETF Trust (DEEF)
DEEP,ETF Series Solutions Trust (DEEP)
DEF,Invesco Capital Management LLC (DEF)
DEF_1,Claymore Exchange-Traded Fund Trust (DEF)
DEFA,BlackRock Institutional Trust Company N.A. (DEFA)
DEH_U,D8 Holdings Corp (DEH.U)
DEH_WS,D8 Holdings Corp (DEH.WS)
DEI,Douglas Emmett Inc (DEI)
DEK,Dekania Corp. (DEK)
DEK_U,(DEK.U)
DEK_WS,Dekania Corp. (DEK.WS)
DEL,Deltic Timber Corp. (DEL)
DELL,Dell Technologies Inc (DELL)
DELL_1,Dell Inc. (DELL)
DELT,Urban Tea Inc (DELT)
DELT_1,Urban Tea Inc (DELT)
DELTW,Delta Technology Holdings Ltd. (DELTW)
DEM,WisdomTree Trust (DEM)
DEMG,DBX ETF Trust (DEMG)
DEMS,Active Weighting Funds ETF Trust (DEMS)
DEN,Denbury Inc. (DEN)
DENN,Denny`s Corp. (DENN)
DEO,Diageo plc (DEO)
DEP,Duncan Energy Partners LP (DEP)
DERM,Dermira Inc (DERM)
DES,WisdomTree Trust (DES)
DES_1,Grupo Kuo Sab De CV (DES)
DESC,DBX ETF Trust (DESC)
DESP,Despegar.com Corp (DESP)
DEST,Destination Maternity Corp (DEST)
DEUR,Citigroup Global Markets Holdings Inc (DEUR)
DEUS,DBX ETF Trust (DEUS)
DEV,"Merrill Lynch & Co., Inc (DEV)"
DEV_CL,(DEV.CL)
DEW,WisdomTree Trust (DEW)
DEWJ,BlackRock Institutional Trust Company N.A. (DEWJ)
DEX,Delaware Enhanced Global Dividend & Income Fund (DEX)
DEX_1,Dex Media Inc. (DEX)
DEZ,Desert Sun Mining Corp. (DEZ)
DEZU,BlackRock Institutional Trust Company N.A. (DEZU)
DF,Dean Foods Co. (DF)
DFB,Morgan Stanley (DFB)
DFBH,DFB Healthcare Acquisitions Corp (DFBH)
DFBHU,DFB Healthcare Acquisitions Corp (DFBHU)
DFBHW,AdaptHealth Corporation (DFBHW)
DFC,Delta Financial Corp. (DFC)
DFE,WisdomTree Trust (DFE)
DFEB,First Trust Exchange-Traded Fund VIII (DFEB)
DFEN,Direxion Shares ETF Trust (DFEN)
DFFN,Diffusion Pharmaceuticals Inc (DFFN)
DFG,"Delphi Financial Group, Inc. (DFG)"
DFHT,Deerfield Healthcare Technology Acquisitions Corp (DFHT)
DFHTU,Deerfield Healthcare Technology Acquisitions Corp (DFHTU)
DFIN,Donnelley Financial Solutions Inc (DFIN)
DFJ,WisdomTree Trust (DFJ)
DFND,Reality Shares Advisors LLC (DFND)
DFNL,Davis Selected Advisers L.P (DFNL)
DFNS,LGL Systems Acquisition Corp (DFNS)
DFNS_U,LGL Systems Acquisition Corp (DFNS.U)
DFNS_WS,LGL Systems Acquisition Corp (DFNS.WS)
DFP,Flaherty & Crumrine Dynamic Preferred and Income Fund Inc (DFP)
DFPH,DFP Healthcare Acquisitions Corp (DFPH)
DFPHU,DFP Healthcare Acquisitions Corp (DFPHU)
DFR,CIFC Corp (DFR)
DFRG,Del Friscos Restaurant Group Inc (DFRG)
DFS,Discover Financial Services (DFS)
DFS_P_B,Discover Financial Services (DFSpB)
DFS_P_B_CL,Discover Financial Services (DFSpB.CL)
DFS_P_RBCL,Discover Financial Services (DFSpRBCL)
DFT_1,Dupont Fabros Technology Inc (DFT)
DFT_P_C_1,Dupont Fabros Technology Inc (DFTpC)
DFVL,Barclays Bank PLC (DFVL)
DFVS,Barclays Bank PLC (DFVS)
DFZ,R.G. Barry Corp. (DFZ)
DG,Dollar General Corp. (DG)
DG_1,Dollar General Corp. (DG)
DGAS,"Delta Natural Gas Co., Inc. (DGAS)"
DGAZ,Credit Suisse Nassau Branch (DGAZ)
DGBP,Citigroup Global Markets Holdings Inc (DGBP)
DGD,(DGD)
DGI_1,DigitalGlobe Inc (DGI)
DGICA,Donegal Group Inc. (DGICA)
DGICB,Donegal Group Inc. (DGICB)
DGII,"Digi International, Inc. (DGII)"
DGK,"Merrill Lynch & Co., Inc (DGK)"
DGL,Invesco DB Multi-Sector Commodity Trust (DGL)
DGLD,Credit Suisse Nassau Branch (DGLD)
DGLT,Digiliti Money Group Inc (DGLT)
DGLY,Digital Ally Inc. (DGLY)
DGNR_U,Dragoneer Growth Opportunities Corp (DGNR.U)
DGP,Deutsche Bank AG London (DGP)
DGRE,WisdomTree Trust (DGRE)
DGRO,BlackRock Institutional Trust Company N.A. (DGRO)
DGRS,WisdomTree Trust (DGRS)
DGRW,WisdomTree Trust (DGRW)
DGS,WisdomTree Trust (DGS)
DGT,SPDR Series Trust (DGT)
DGX,"Quest Diagnostics, Inc. (DGX)"
DGZ,Deutsche Bank AG London (DGZ)
DHC,Diversified Healthcare Trust (DHC)
DHCNL,Diversified Healthcare Trust (DHCNL)
DHCP,Ditech Holding Corp (DHCP)
DHCP_WS_A,Ditech Holding Corp (DHCP.WS.A)
DHCP_WS_B,Ditech Holding Corp (DHCP.WS.B)
DHF,BNY Mellon High Yield Strategies Fund (DHF)
DHG,Deutsche High Income Opportunities Fund Inc (DHG)
DHI,D.R. Horton Inc. (DHI)
DHIL,"Diamond Hill Investment Group, Inc. (DHIL)"
DHR,Danaher Corp. (DHR)
DHR_P_A,Danaher Corp. (DHRpA)
DHR_P_B,Danaher Corp. (DHRpB)
DHS,WisdomTree Trust (DHS)
DHT,DHT Holdings Inc (DHT)
DHVW,Diamond Hill Capital Management Inc (DHVW)
DHX,DHI Group Inc (DHX)
DHXM,WildBrain Ltd (DHXM)
DHXM_1,DHX Media Ltd (DHXM)
DHY,Credit Suisse High Yield Bond Fund (DHY)
DHYR_,Credit Suisse High Yield Bond Fund (DHYr_)
DIA,SSgA Active Trust (DIA)
DIAL,Columbia ETF Trust I (DIAL)
DIAL_1,Westwood One Inc (DIAL)
DIAX,Nuveen Dow 30SM Dynamic Overwrite Fund (DIAX)
DIG,ProShares Trust (DIG)
DII,"Decorator Industries, Inc. (DII)"
DIL,"Dyadic International Inc., DE (DIL)"
DIM,WisdomTree Trust (DIM)
DIN,Dine Brands Global Inc (DIN)
DINT,Davis Selected Advisers L.P (DINT)
DIO,"Diomed Holdings, Inc. (DIO)"
DIOD,"Diodes, Inc. (DIOD)"
DIRT,Barclays Bank PLC (DIRT)
DIS,Walt Disney Co (The) (DIS)
DIS_1,TWDC Enterprises 18 Corp (DIS)
DISCA,Discovery Inc (DISCA)
DISCB,Discovery Inc (DISCB)
DISCK,Discovery Inc (DISCK)
DISH,Dish Network Corp (DISH)
DISH_1,DISH Network Corporation (DISH)
DISHR,Dish Network Corp (DISHR)
DIT,Amcon Distributing Company (DIT)
DIV,Global X Funds (DIV)
DIVA,AGF Investments Trust (DIVA)
DIVB,BlackRock Institutional Trust Company N.A. (DIVB)
DIVC,Citigroup Inc (DIVC)
DIVO,Amplify ETF Trust (DIVO)
DIVY,Reality Shares Advisors LLC (DIVY)
DJCI,UBS AG (DJCI)
DJCI_1,UBS AG Jersey (DJCI)
DJCO,Daily Journal Corporation (DJCO)
DJD,Invesco Capital Management LLC (DJD)
DJD_1,Claymore Exchange-Traded Fund Trust (DJD)
DJE,(DJE)
DJE_1,(DJE)
DJL,"Merrill Lynch & Co., Inc (DJL)"
DJP,Barclays Bank PLC (DJP)
DJPY,Citigroup Global Markets Holdings Inc (DJPY)
DJQ,(DJQ)
DJQ_1,(DJQ)
DK,Delek US Holdings Inc (DK)
DKF,MS Structured Asset Corp (DKF)
DKL,Delek Logistics Partners LP (DKL)
DKNG,DraftKings Inc (DKNG)
DKNGW,DraftKings Inc (DKNGW)
DKNGW_1,DraftKings Inc (DKNGW)
DKP,MS Structured Asset Corp (DKP)
DKQ,MS Structured Asset Corp (DKQ)
DKS,"Dicks Sporting Goods, Inc. (DKS)"
DKT_CL,Deutsche Bank Contingent Capital Trust V (DKT.CL)
DL,China Distance Education Holdings Ltd. (DL)
DL_1,Dial Corp. (DL)
DLA,Delta Apparel Inc. (DLA)
DLB,Dolby Laboratories Inc (DLB)
DLBL,Barclays Bank PLC (DLBL)
DLBR,Citigroup Global Markets Holdings Inc (DLBR)
DLBS,Barclays Bank PLC (DLBS)
DLHC,DLH Holdings Corp (DLHC)
DLK,Flint Telecom Group Inc (DLK)
DLN,WisdomTree Trust (DLN)
DLNG,Dynagas LNG Partners LP (DLNG)
DLNG_P_A,Dynagas LNG Partners LP (DLNGpA)
DLNG_P_B,Dynagas LNG Partners LP (DLNGpB)
DLNG_P_RA,Dynagas LNG Partners LP (DLNGpRA)
DLPH,Delphi Technologies PLC (DLPH)
DLPHW,Delphi Technologies PLC (DLPHw)
DLPN,Dolphin Entertainment Inc. (DLPN)
DLPNW,Dolphin Entertainment Inc. (DLPNW)
DLR,Digital Realty Trust Inc (DLR)
DLR_P_C,Digital Realty Trust Inc (DLRpC)
DLR_P_G,Digital Realty Trust Inc (DLRpG)
DLR_P_H,Digital Realty Trust Inc (DLRpH)
DLR_P_H_CL,Digital Realty Trust Inc (DLRpH.CL)
DLR_P_I,Digital Realty Trust Inc (DLRpI)
DLR_P_J,Digital Realty Trust Inc (DLRpJ)
DLR_P_K,Digital Realty Trust Inc (DLRpK)
DLR_P_L,Digital Realty Trust Inc (DLRpL)
DLR_P_RC,Digital Realty Trust Inc (DLRpRC)
DLR_P_RG,Digital Realty Trust Inc (DLRpRG)
DLR_P_RH,Digital Realty Trust Inc (DLRpRH)
DLR_P_RI,Digital Realty Trust Inc (DLRpRI)
DLR_P_RJ,Digital Realty Trust Inc (DLRpRJ)
DLS,WisdomTree Trust (DLS)
DLTH,Duluth Holdings Inc (DLTH)
DLTR,Dollar Tree Inc (DLTR)
DLX,Deluxe Corp. (DLX)
DLY,DoubleLine Yield Opportunities Fund (DLY)
DM,Dominion Energy Midstream Partners LP (DM)
DM_1,Dolan Co (DM)
DMAC,DiaMedica Therapeutics Inc (DMAC)
DMAN,DemandTec Inc (DMAN)
DMB,BNY Mellon Municipal Bond Infrastructure Fund Inc (DMB)
DMF,BNY Mellon Municipal Income Inc (DMF)
DMJ,Morgan Stanley (DMJ)
DMLP,Dorchester Minerals LP (DMLP)
DMO,Western Asset Mortgage Opportunity Fund Inc (DMO)
DMP,(DMP)
DMP_1,(DMP)
DMRC,Digimarc Corporation (DMRC)
DMRI,Transamerica ETF Trust (DMRI)
DMRL,Transamerica ETF Trust (DMRL)
DMRM,Transamerica ETF Trust (DMRM)
DMRS,Transamerica ETF Trust (DMRS)
DMS,Digital Media Solutions Inc (DMS)
DMS_1,Digital Media Solutions Inc (DMS)
DMTK,DermTech Inc (DMTK)
DMTKW,DermTech Inc (DMTKW)
DMTX,Dimension Therapeutics Inc (DMTX)
DMU,(DMU)
DMX,I-Trax Inc (DMX)
DMY,"Merrill Lynch & Co., Inc (DMY)"
DMYD_U,dMY Technology Group Inc II (DMYD.U)
DMYD_WS,dMY Technology Group Inc II (DMYD.WS)
DMYT,dMY Technology Group Inc (DMYT)
DMYT_U,dMY Technology Group Inc (DMYT.U)
DMYT_WS,dMY Technology Group Inc (DMYT.WS)
DNB,Dun & Bradstreet Holdings Inc (DNB)
DNBF,DNB Financial Corp. (DNBF)
DNDN,Dendreon Corp (DNDN)
DNE,Dune Energy Inc (DNE)
DNI,Dividend and Income Fund (DNI)
DNK,Phoenix Tree Holdings Ltd (DNK)
DNKN,Dunkin Brands Group Inc (DNKN)
DNL,WisdomTree Trust (DNL)
DNLI,Denali Therapeutics Inc (DNLI)
DNN,Denison Mines Corp (DNN)
DNO,(DNO)
DNO_2,United States Commodity Funds LLC (DNO)
DNOV,First Trust Exchange-Traded Fund VIII (DNOV)
DNOW,NOW Inc (DNOW)
DNP,DNP Select Income Fund Inc. (DNP)
DNR,Denbury Resources Inc (DNR)
DO,"Diamond Offshore Drilling, Inc. (DO)"
DOC,Physicians Realty Trust (DOC)
DOC_1,Domco Tarkett Inc (DOC)
DOC_2,Digital Angel Corp. (DOC)
DOCT,First Trust Exchange-Traded Fund VIII (DOCT)
DOCU,DocuSign Inc (DOCU)
DOD_1,Deutsche Bank AG London (DOD)
DOG,ProShares Trust (DOG)
DOGS,Arrow Investments Trust (DOGS)
DOGZ,Dogness (International) Corp (DOGZ)
DOL,WisdomTree Trust (DOL)
DOL_1,"Dole Food Co., Inc. (DOL)"
DOM,Dominion Resources Black Warrior Trust (DOM)
DOMO,Domo Inc. (DOMO)
DON,WisdomTree Trust (DON)
DOO,WisdomTree Trust (DOO)
DOOO,BRP Inc (DOOO)
DOOR,Masonite International Corp (DOOR)
DORM,Dorman Products Inc (DORM)
DOTA,Reebonz Holding Ltd (DOTA)
DOTA_1,Draper Oakwood Technology Acquisition Inc (DOTA)
DOTAR,Draper Oakwood Technology Acquisition Inc (DOTAR)
DOTAU,Draper Oakwood Technology Acquisition Inc (DOTAU)
DOTAW,Reebonz Holding Ltd (DOTAW)
DOTAW_1,Draper Oakwood Technology Acquisition Inc (DOTAW)
DOV,Dover Corp. (DOV)
DOVA,Dova Pharmaceuticals Inc (DOVA)
DOVW,Dover Corp. (DOVw)
DOW,Dow Inc (DOW)
DOW_1,Dow Chemical Co. (DOW)
DOWW,Dow Inc (DOWw)
DOX,Amdocs Ltd (DOX)
DOY,MacroMarkets LLC (DOY)
DOYU,DouYu International Holdings Ltd (DOYU)
DPG,Duff & Phelps Utility and Infrastructure Fund Inc (DPG)
DPHC,Diamondpeak Holdings Corp (DPHC)
DPHCU,Diamondpeak Holdings Corp (DPHCU)
DPHCW,Diamondpeak Holdings Corp (DPHCW)
DPK,Direxion Daily Developed Markets Bear 3X Shares (DPK)
DPK_1,Direxion Shares ETF Trust (DPK)
DPLO_1,Diplomat Pharmacy Inc (DPLO)
DPO,Dow 30 Enhanced Premium & Income Fund Inc (DPO)
DPP,Morgan Stanley (DPP)
DPST,Direxion Shares ETF Trust (DPST)
DPTR,Delta Petroleum Corp. (DPTR)
DPU,Deutsche Bank AG London (DPU)
DPW,DPW Holdings Inc (DPW)
DPZ,Dominos Pizza Inc (DPZ)
DQ,Daqo New Energy Corp (DQ)
DRA,Diversified Real Asset Income Fund (DRA)
DRA_1,Coinmach Service Corp (DRA)
DRAD,Digirad Corp (DRAD)
DRC,Dresser-Rand Group Inc (DRC)
DRD,DRDGold Ltd. (DRD)
DRD_1,"Duane Reade, Inc. (DRD)"
DRE,Duke Realty Corp (DRE)
DRE_P_L_,Duke Realty Corp (DREpL_)
DRH,Diamondrock Hospitality Co. (DRH)
DRH_1,Driver-Harris Co. (DRH)
DRH_P_A,Diamondrock Hospitality Co. (DRHpA)
DRI,"Darden Restaurants, Inc. (DRI)"
DRIO,DarioHealth Corp (DRIO)
DRIOW,DarioHealth Corp (DRIOW)
DRIP,Direxion Shares ETF Trust (DRIP)
DRIP_1,"Spa Faucet, Inc (DRIP)"
DRIV,Global X Funds (DRIV)
DRIV_1,"Digital River, Inc. (DRIV)"
DRJ,"Dreams, Inc. (DRJ)"
DRL,Doral Financial Corp. (DRL)
DRN,Direxion Shares ETF Trust (DRN)
DRNA,Dicerna Pharmaceuticals Inc (DRNA)
DRQ,"Dril-Quip, Inc. (DRQ)"
DRR,Morgan Stanley (DRR)
DRRX,Durect Corp (DRRX)
DRSK,ETF Series Solutions Trust (DRSK)
DRTT,DIRTT Environmental Solutions Ltd (DRTT)
DRU,Morgan Stanley (DRU)
DRUA,Dominion Energy Inc (DRUA)
DRV,Direxion Shares ETF Trust (DRV)
DRV_1,Debt Resolve Inc (DRV)
DRW,WisdomTree Trust (DRW)
DRWI,Dragonwave Inc (DRWI)
DRY,Coinmach Service Corp (DRY)
DRYS,Dryships Inc. (DRYS)
DS,Drive Shack Inc (DS)
DSA,(DSA)
DSA_1,(DSA)
DSA_CL,(DSA.CL)
DSCM,Drugstore.com Inc. (DSCM)
DSE,Duff & Phelps Select MLP and Midstream Energy Fund Inc (DSE)
DSE_1,(DSE)
DSE_2,(DSE)
DSGX,Descartes Systems Group Inc (DSGX)
DSI,BlackRock Institutional Trust Company N.A. (DSI)
DSK,(DSK)
DSK_1,(DSK)
DSK_CL,(DSK.CL)
DSKE,Daseke Inc (DSKE)
DSKEW,Daseke Inc (DSKEW)
DSL,Doubleline Income Solutions Fund (DSL)
DSLV,Credit Suisse Nassau Branch (DSLV)
DSM,BNY Mellon Strategic Municipal Bond Fund Inc (DSM)
DSO,(DSO)
DSO_1,(DSO)
DSP,SP Acquisition Holdings Inc (DSP)
DS_P_B,Drive Shack Inc (DSpB)
DS_P_C,Drive Shack Inc (DSpC)
DS_P_D,Drive Shack Inc (DSpD)
DSPG,"DSP Group, Inc. (DSPG)"
DS_P_RB,Drive Shack Inc (DSpRB)
DS_P_RC,Drive Shack Inc (DSpRC)
DS_P_RD,Drive Shack Inc (DSpRD)
DSP_U,SP Acquisition Holdings Inc (DSP.U)
DSP_WS,SP Acquisition Holdings Inc (DSP.WS)
DSS,"Document Security Systems, Inc. (DSS)"
DSSI,Diamond S Shipping Inc (DSSI)
DST,DST Systems Inc. (DST)
DSTI,Daystar Technologies Inc (DSTI)
DSTL,ETF Series Solutions Trust (DSTL)
DSU,"BlackRock Debt Strategies Fund, Inc. (DSU)"
DSUM,Invesco Capital Management LLC (DSUM)
DSW,Designer Brands Inc (DSW)
DSWL,"Deswell Industries, Inc. (DSWL)"
DSX,Diana Shipping Inc (DSX)
DSXN,Diana Shipping Inc (DSXN)
DSX_P_B,Diana Shipping Inc (DSXpB)
DSZ,(DSZ)
DSZ_1,(DSZ)
DT,Dynatrace Inc (DT)
DTB,DTE Energy Co. (DTB)
DTD,WisdomTree Trust (DTD)
DTE,DTE Energy Co. (DTE)
DTEA,Davidstea Inc (DTEA)
DTEC,ALPS Advisors Inc (DTEC)
DTE_P_C_,DTE Energy Trust II (DTEpC_)
DTF,DTF Tax-Free Income Inc (DTF)
DTG,"Dollar Thrifty Automotive Group, Inc. (DTG)"
DTH,WisdomTree Trust (DTH)
DTIL,Precision Biosciences Inc (DTIL)
DTJ,DTE Energy Co. (DTJ)
DTK,Deutsche Bank Contingent Capital Trust III (DTK)
DTK_CL,Deutsche Bank Contingent Capital Trust III (DTK.CL)
DTLA_P,Brookfield Dtla Fund Office Trust Investor Inc (DTLAp)
DTLA_P_R,Brookfield Dtla Fund Office Trust Investor Inc (DTLApR)
DTN,WisdomTree Trust (DTN)
DTO,Deutsche Bank AG London (DTO)
DTP,DTE Energy Co. (DTP)
DTQ,DTE Energy Co. (DTQ)
DTRM,Determine Inc (DTRM)
DTSS,Datasea Inc (DTSS)
DTT,Deutsche Bank Capital Funding Trust IX (DTT)
DTUL,Barclays Bank PLC (DTUL)
DTUS,Barclays Bank PLC (DTUS)
DTV,DTE Energy Co. (DTV)
DTV_1,DIRECTV (DTV)
DTW,DTE Energy Co. (DTW)
DTW_1,DTE Energy Company (DTW)
DTW_2,DTE Energy Company (DTW)
DTY,DTE Energy Co. (DTY)
DTY_1,(DTY)
DTY_2,(DTY)
DTYL,Barclays Bank PLC (DTYL)
DTYS,Barclays Bank PLC (DTYS)
DUC,Duff & Phelps Utility & Corporate Bond Trust (DUC)
DUG,ProShares Trust (DUG)
DUK,Duke Energy Corp. (DUK)
DUK_1,Duke Energy Corp. (DUK)
DUKB,Duke Energy Corp. (DUKB)
DUKH,Duke Energy Corp. (DUKH)
DUK_P_A,Duke Energy Corp. (DUKpA)
DULL,Direxion Shares ETF Trust (DULL)
DUO,Fangdd Network Group Ltd (DUO)
DUOT,Duos Technologies Group Inc (DUOT)
DUSA,Davis Selected Advisers L.P (DUSA)
DUSL,Direxion Shares ETF Trust (DUSL)
DUST,Direxion Shares ETF Trust (DUST)
DVA,DaVita Inc (DVA)
DVAX,Dynavax Technologies Corp. (DVAX)
DVCR,Diversicare Healthcare Services Inc (DVCR)
DVD,Dover Motorsports Inc (DVD)
DVF,BlackRock Diversified Income Strategies Portfolio Inc (DVF)
DVHL,UBS AG London Branch (DVHL)
DVK,AB Svensk Exportkredit (DVK)
DVLU,First Trust Exchange-Traded Fund VI (DVLU)
DVM,"Cohen & Steers Dividend Majors Fund, Inc. (DVM)"
DVMT_1,Dell Technologies Inc (DVMT)
DVN,Devon Energy Corp. (DVN)
DVOL,First Trust Exchange-Traded Fund VI (DVOL)
DVP,Roundhill Acquirers Deep Value ETF (DVP)
DVP_1,ETF Series Solutions Trust (DVP)
DVP_2,ETF Series Solutions Trust (DVP)
DVW,Covad Communications Group Inc (DVW)
DVY,BlackRock Institutional Trust Company N.A. (DVY)
DVYA,BlackRock Institutional Trust Company N.A. (DVYA)
DVYE,BlackRock Institutional Trust Company N.A. (DVYE)
DVYL,UBS AG London Branch (DVYL)
DWA,Dreamworks Animation SKG Inc (DWA)
DWAC,Elkhorn Investments LLC (DWAC)
DWAQ,Invesco Capital Management LLC (DWAQ)
DWAS,Invesco Capital Management LLC (DWAS)
DWAT,Arrow Investments Trust (DWAT)
DWCH,Datawatch Corp. (DWCH)
DWCR,Arrow Investments Trust (DWCR)
DWDPW,DowDuPont Inc (DWDPw)
DWFI,SPDR Series Trust (DWFI)
DWIN,Invesco Capital Management LLC (DWIN)
DWLD,Davis Selected Advisers L.P (DWLD)
DWLV,Invesco Capital Management LLC (DWLV)
DWM,WisdomTree Trust (DWM)
DWMC,Advisorshares Trust (DWMC)
DWPP,First Trust Exchange-Traded Fund III (DWPP)
DWSH,Advisorshares Trust (DWSH)
DWSN,Dawson Geophysical Company (DWSN)
DWT,Citigroup Global Markets Holdings Inc (DWT)
DWT_1,Britannia Bulk Holdings Inc (DWT)
DWTI,Credit Suisse Nassau Branch (DWTI)
DWTR,Invesco Capital Management LLC (DWTR)
DWUS,Advisorshares Trust (DWUS)
DWX,SSgA Active Trust (DWX)
DX,"Dynex Capital, Inc. (DX)"
DXB,Deutsche Bank Contingent Capital Trust II (DXB)
DXB_CL,Deutsche Bank Contingent Capital Trust II (DXB.CL)
DXC,DXC Technology Co (DXC)
DXCM,Dexcom Inc (DXCM)
DXCW,DXC Technology Co (DXCw)
DXD,ProShares Trust (DXD)
DXF,Dunxin Financial Holdings Limited. (DXF)
DXGE,WisdomTree Trust (DXGE)
DXI,DXI Energy Inc (DXI)
DXI_1,"Merrill Lynch & Co., Inc (DXI)"
DXJ,WisdomTree Trust (DXJ)
DXJC,WisdomTree Trust (DXJC)
DXJF,WisdomTree Trust (DXJF)
DXJH,WisdomTree Trust (DXJH)
DXJR,WisdomTree Trust (DXJR)
DXJS,WisdomTree Trust (DXJS)
DXLG,Destination XL Group Inc (DXLG)
DXN,ComF5 International Inc (DXN)
DX_P_A,"Dynex Capital, Inc. (DXpA)"
DX_P_B,"Dynex Capital, Inc. (DXpB)"
DX_P_C,"Dynex Capital, Inc. (DXpC)"
DXPE,"DXP Enterprises, Inc. (DXPE)"
DX_P_RA,"Dynex Capital, Inc. (DXpRA)"
DX_P_RB,"Dynex Capital, Inc. (DXpRB)"
DXPS,WisdomTree Trust (DXPS)
DXR,Daxor Corp. (DXR)
DXTR,Dextera Surgical Inc (DXTR)
DXUS,WisdomTree Trust (DXUS)
DXYN,Dixie Group Inc. (DXYN)
DY,"Dycom Industries, Inc. (DY)"
DYAI,"Dyadic International Inc., DE (DYAI)"
DYAX,Dyax Corp (DYAX)
DYB,WisdomTree Trust (DYB)
DYFN,Angel Oak Dynamic Financial Strategies Income Term Trust (DYFN)
DYLS,WisdomTree Trust (DYLS)
DYN,Dyne Therapeutics Inc (DYN)
DYN_1,Dynegy Inc. (DYN)
DYN_2,Dynegy Inc (DYN)
DYNC,Vistra Energy Corp (DYNC)
DYNC_1,Dynegy Inc. (DYNC)
DYNF,BlackRock ETF Trust (DYNF)
DYN_P_A,Dynegy Inc. (DYNpA)
DYNT,Dynatronics Corp. (DYNT)
DYN_WS,Dynegy Inc. (DYN.WS)
DYNWSA,Dynegy Inc. (DYNWSA)
DYN_WS_A,Dynegy Inc. (DYN.WS.A)
DYSL,Dynasil Corp. Of America (DYSL)
DYY_1,Deutsche Bank AG London (DYY)
DZK,Direxion Shares ETF Trust (DZK)
DZSI,DZS Inc (DZSI)
DZZ,Deutsche Bank AG London (DZZ)
E,Eni Spa (E)
EA,"Electronic Arts, Inc. (EA)"
EAB,Entergy Arkansas LLC (EAB)
EACQ,Easterly Acquisition Corp (EACQ)
EACQU,Easterly Acquisition Corp (EACQU)
EACQW,Easterly Acquisition Corp (EACQW)
EAD,Wells Fargo Income Opportunities Fund (EAD)
EAE,Entergy Arkansas LLC (EAE)
EAF,GrafTech International Ltd. (EAF)
EAG,American Defense Systems Inc (EAG)
EAG_1,Eagle Broadband Inc (EAG)
EAGG,iShares Trust (EAGG)
EAGL_1,Silver Eagle Acquisition Corp (EAGL)
EAGL_2,Double Eagle Acquisition Corp (EAGL)
EAGLU,Platinum Eagle Acquisition Corp (EAGLU)
EAGLU_1,Silver Eagle Acquisition Corp (EAGLU)
EAGLU_2,Double Eagle Acquisition Corp (EAGLU)
EAGLW_1,Platinum Eagle Acquisition Corp (EAGLW)
EAI,Entergy Arkansas LLC (EAI)
EAK,(EAK)
EAM,(EAM)
EAN,(EAN)
EAP,Citigroup Inc (EAP)
EAR,Eargo Inc (EAR)
EAR_1,Hear USA Inc (EAR)
EARN,Ellington Residential Mortgage REIT (EARN)
EARS,Auris Medical Holding Ltd (EARS)
EASG,DBX ETF Trust (EASG)
EASI,Amplify ETF Trust (EASI)
EAST,Eastside Distilling Inc (EAST)
EASTW,Eastside Distilling Inc (EASTW)
EAT,"Brinker International, Inc. (EAT)"
EAZ,Citigroup Inc (EAZ)
EB,Eventbrite Inc (EB)
EBA,(EBA)
EBAY,EBay Inc. (EBAY)
EBAYL,EBay Inc. (EBAYL)
EBB,Citigroup Inc (EBB)
EBC,Eastern Bankshares Inc. (EBC)
EBC_1,(EBC)
EBE,(EBE)
EBF,Ennis Inc. (EBF)
EBIX,Ebix Inc. (EBIX)
EBIZ,Global X Funds (EBIZ)
EBK,Morgan Stanley (EBK)
EBLU,Tortoise Index Solutions (EBLU)
EBMT,Eagle Bancorp Montana Inc (EBMT)
EBMT_1,Eagle Bancorp (EBMT)
EBND,SPDR Series Trust (EBND)
EBON,Ebang International Holdings Inc (EBON)
EBR,Centrais Eletricas Brasileiras S.A. (EBR)
EBRB,Centrais Eletricas Brasileiras S.A. (EBRB)
EBR_B,Centrais Eletricas Brasileiras S.A. (EBR.B)
EBS,Emergent Biosolutions Inc (EBS)
EBSB,Meridian Bancorp Inc (EBSB)
EBTC,"Enterprise Bancorp, Inc. (EBTC)"
EBY,Citigroup Inc (EBY)
EC,Ecopetrol SA (EC)
EC_1,Engelhard Corp. (EC)
ECB,Citigroup Inc (ECB)
ECBE,"ECB Bancorp, Inc. (ECBE)"
ECC,Eagle Point Credit Company Inc (ECC)
ECC_1,ECC International Corp. (ECC)
ECCA,Eagle Point Credit Company Inc (ECCA)
ECCA_1,Eclipse Capital Corp. (ECCA)
ECCB,Eagle Point Credit Company Inc (ECCB)
ECCX,Eagle Point Credit Company Inc (ECCX)
ECCY,Eagle Point Credit Company Inc (ECCY)
ECCZ,Eagle Point Credit Company Inc (ECCZ)
ECCZ_CL,Eagle Point Credit Company Inc (ECCZ.CL)
ECF,Ellsworth Growth and Income Fund Ltd (ECF)
ECF_P_A,Ellsworth Growth and Income Fund Ltd (ECFpA)
ECF_P_RA,Ellsworth Growth and Income Fund Ltd (ECFpRA)
ECH,BlackRock Institutional Trust Company N.A. (ECH)
ECHO,Echo Global Logistics Inc (ECHO)
ECI,Encision Inc. (ECI)
ECL,"Ecolab, Inc. (ECL)"
ECLP,Eclipsys Corp. (ECLP)
ECN,(ECN)
ECNS,BlackRock Institutional Trust Company N.A. (ECNS)
ECOL,US Ecology Inc. (ECOL)
ECOL_1,US Ecology Inc (ECOL)
ECOLW,US Ecology Inc. (ECOLW)
ECOM,ChannelAdvisor Corp (ECOM)
ECOM_1,Ecometry Corp. (ECOM)
ECON,Columbia ETF Trust II (ECON)
ECOR,ElectroCore Inc (ECOR)
ECP,Canterbury Park Holding Corp. (ECP)
ECPG,"Encore Capital Group, Inc. (ECPG)"
ECT,ECA Marcellus Trust I (ECT)
ECYT,Endocyte Inc (ECYT)
ED,"Consolidated Edison, Inc. (ED)"
EDA,Citigroup Inc (EDA)
EDAP,EDAP TMS S.A. (EDAP)
EDA_U,(EDA.U)
EDA_U_1,(EDA.U)
EDA_WS,American Apparel Inc (EDA.WS)
EDBI,Legg Mason ETF Investment Trust (EDBI)
EDC,Direxion Shares ETF Trust (EDC)
EDD,Morgan Stanley Emerging Markets Domestic Debt Fund Inc (EDD)
EDEN,BlackRock Institutional Trust Company N.A. (EDEN)
EDEN_1,Eden Bioscience Corp. (EDEN)
EDF,Stone Harbor Emerging Markets Income Fund (EDF)
EDF_1,Citigroup Inc (EDF)
EDGE,PDS Biotechnology Corporation (EDGE)
EDGW,Edgewater Technology Inc (EDGW)
EDI,Stone Harbor Emerging Markets Total Income Fund (EDI)
EDI_1,EDiets.com Inc (EDI)
EDIT,Editas Medicine Inc (EDIT)
EDIV,SSgA Active Trust (EDIV)
EDN,Empresa Distribuidora y Comercial Norte S.A. (EDN)
EDNT,Edison Nation Inc (EDNT)
EDOC,Global X Funds (EDOC)
EDOG,ALPS Fund Services (EDOG)
EDOM,WisdomTree Trust (EDOM)
EDOW,First Trust Exchange-Traded Fund III (EDOW)
ED_P_C_,"Consolidated Edison, Inc. (EDpC_)"
EDR_1,Education Realty Trust Inc (EDR)
EDRY,EuroDry Ltd (EDRY)
EDSA,Edesa Biotech Inc (EDSA)
EDTK,Skillful Craftsman Education Technology Ltd (EDTK)
EDTX,EdtechX Holdings Acquisition Corp (EDTX)
EDTXU,EdtechX Holdings Acquisition Corp (EDTXU)
EDTXW,EdtechX Holdings Acquisition Corp (EDTXW)
EDU,New Oriental Education & Technology (EDU)
EDUC,Educational Development Corp. (EDUC)
EDV,"Vanguard Group, Inc. (EDV)"
EDZ,Direxion Shares ETF Trust (EDZ)
EE,El Paso Electric Company (EE)
EEA,European Equity Fund Inc (EEA)
EEB,Invesco BRIC ETF (EEB)
EEB_1,Invesco Capital Management LLC (EEB)
EEB_2,Claymore Exchange-Traded Fund Trust (EEB)
EEC,Morgan Stanley (EEC)
EEE,Evergreen Energy Inc (EEE)
EEFT,Euronet Worldwide Inc (EEFT)
EEH,AB Svensk Exportkredit (EEH)
EEI,"Ecology And Environment, Inc. (EEI)"
EELV,Invesco Capital Management LLC (EELV)
EEM,BlackRock Institutional Trust Company N.A. (EEM)
EEMA,BlackRock Institutional Trust Company N.A. (EEMA)
EEMD,ETF Series Solutions Trust (EEMD)
EEMO,Invesco Capital Management LLC (EEMO)
EEMS,BlackRock Institutional Trust Company N.A. (EEMS)
EEMV,BlackRock Institutional Trust Company N.A. (EEMV)
EEMX,SSgA Active Trust (EEMX)
EEN,Guggenheim Funds Investment Advisors LLC (EEN)
EEP,Enbridge Energy Partners L.P (EEP)
EEQ,"Enbridge Energy Management, L.L.C... (EEQ)"
EES,WisdomTree Trust (EES)
EET,ProShares Trust (EET)
EEV,ProShares Trust (EEV)
EEW,Guggenheim Funds Investment Advisors LLC (EEW)
EEX,Emerald Holding Inc (EEX)
EEX_1,EEX Corp (EEX)
EEZ,"Wisdomtree Investments, Inc. (EEZ)"
EFA,BlackRock Institutional Trust Company N.A. (EFA)
EFAD,ProShares Trust (EFAD)
EFAS,Global X Funds (EFAS)
EFAV,BlackRock Institutional Trust Company N.A. (EFAV)
EFAX,SSgA Active Trust (EFAX)
EFBI,Eagle Financial Bancorp Inc (EFBI)
EFC,Ellington Financial Inc (EFC)
EFC_1,Ellington Financial Inc (EFC)
EFC_2,Ellington Financial Inc (EFC)
EFC_P_A,Ellington Financial Inc (EFCpA)
EFF,Eaton Vance Floating-Rate Income Plus Fund (EFF)
EFFE,Global X Funds (EFFE)
EFG,BlackRock Institutional Trust Company N.A. (EFG)
EFII,"Electronics For Imaging, Inc. (EFII)"
EFL,Eaton Vance Floating-Rate 2022 Target Term Trust (EFL)
EFNL,BlackRock Institutional Trust Company N.A. (EFNL)
EFO,ProShares Trust (EFO)
EFOI,Energy Focus Inc (EFOI)
EFP,Morgan Stanley (EFP)
EFR,Eaton Vance Senior Floating-Rate Trust (EFR)
EFSC,Enterprise Financial Services Corp. (EFSC)
EFT,Eaton Vance Floating-Rate Income Trust (EFT)
EFU,ProShares Trust (EFU)
EFV,BlackRock Institutional Trust Company N.A. (EFV)
EFX,"Equifax, Inc. (EFX)"
EFZ,ProShares Trust (EFZ)
EGAN,eGain Corp (EGAN)
EGAS_1,Gas Natural Inc (EGAS)
EGBN,Eagle Bancorp Inc (MD) (EGBN)
EGC,Energy XXI Gulf Coast Inc (EGC)
EGF,BlackRock Enhanced Government Fund Inc (EGF)
EGHT,8X8 Inc. (EGHT)
EGI,Entree Resources Ltd (EGI)
EGIF,Eagle Growth and Income Opportunities Fund (EGIF)
EGJ,Citigroup Inc (EGJ)
EGK,Citigroup Inc (EGK)
EGL,Engility Holdings Inc (EGL)
EGL_1,"Eagle Supply Group, Inc. (EGL)"
EGLE,Eagle Bulk Shipping Inc (EGLE)
EGLE_1,"Eagle Food Centers, Inc. (EGLE)"
EGLE_2,Eagle Bulk Shipping Inc (EGLE)
EGLT,Egalet Corp (EGLT)
EGN,Energen Corp. (EGN)
EGO,Eldorado Gold Corp. (EGO)
EGOV,NIC Inc (EGOV)
EGP,"Eastgroup Properties, Inc. (EGP)"
EGPT,VanEck Vectors ETF Trust (EGPT)
EGR,Commerce Energy Group Inc. (EGR)
EGRX,Eagle Pharmaceuticals Inc (EGRX)
EGT,Entertainment Gaming Asia Inc (EGT)
EGX,Engex Inc (EGX)
EGY,"VAALCO Energy, Inc. (EGY)"
EH,EHang Holdings Ltd (EH)
EHC,Encompass Health Corp (EHC)
EHC_1,Citigroup Inc (EHC)
EHD,Citigroup Inc (EHD)
EHI,Western Asset Global High Income Fund Inc (EHI)
EHIC,eHi Car Services Limited (EHIC)
EHJ,(EHJ)
