ticker,issuer_name
DYN_P_A,Dynegy Inc. (DYNpA)
DYNT,Dynatronics Corp. (DYNT)
DYNWS,Dynegy Inc. (DYNWS)
DYN_WS,Dynegy Inc. (DYN.WS)
DYNWSA,Dynegy Inc. (DYNWSA)
DYN_WS_A,Dynegy Inc. (DYN.WS.A)
DYP,Duoyuan Printing Inc (DYP)
DYS,Walmart Chile SA (DYS)
DYSL,Dynasil Corp. Of America (DYSL)
DYY_1,Deutsche Bank AG London (DYY)
DZK,Direxion Shares ETF Trust (DZK)
DZSI,DZS Inc (DZSI)
DZZ,Deutsche Bank AG London (DZZ)
E,Eni Spa (E)
EA,"Electronic Arts, Inc. (EA)"
EAA,Entergy Arkansas Inc.. (EAA)
EAA_CL,Entergy Arkansas Inc (EAA.CL)
EAB,Entergy Arkansas LLC (EAB)
EAB_1,Entergy Arkansas Inc (EAB)
EAB_2,(EAB)
EAB_3,FIRST MORTGAGE BONDS 4.90% SERIES DUE DECEMBER 1 2052 (EAB)
EAB_4,Entergy Arkansas (EAB)
EAB_5,Entergy Arkansas Inc Pfd (EAB)
EAB_6,First Mortgage Bonds 4.90% Series Due December 1 2052 (EAB)
EAC,Encore Acquisition Co. (EAC)
EACQ,Easterly Acquisition Corp (EACQ)
EACQU,Easterly Acquisition Corp (EACQU)
EACQW,Easterly Acquisition Corp (EACQW)
EAD,Wells Fargo Income Opportunities Fund (EAD)
EAE,Entergy Arkansas LLC (EAE)
EAF,GrafTech International Ltd. (EAF)
EAGG,iShares Trust (EAGG)
EAGLU,Platinum Eagle Acquisition Corp (EAGLU)
EAI,Entergy Arkansas LLC (EAI)
EAR,Eargo Inc (EAR)
EARN,Ellington Residential Mortgage REIT (EARN)
EARS,Auris Medical Holding Ltd (EARS)
EAS,Energy East Corp . (EAS)
EASG,DBX ETF Trust (EASG)
EASI,Amplify ETF Trust (EASI)
EAST,Eastside Distilling Inc (EAST)
EASTW,Eastside Distilling Inc (EASTW)
EAT,"Brinker International, Inc. (EAT)"
EB,Eventbrite Inc (EB)
EBAY,EBay Inc. (EBAY)
EBAYL,EBay Inc. (EBAYL)
EBC,Eastern Bankshares Inc. (EBC)
EBF,Ennis Inc. (EBF)
EBI,Evergreen International Balanced Income Fund (EBI)
EBIX,Ebix Inc. (EBIX)
EBIZ,Global X Funds (EBIZ)
EBLU,Tortoise Index Solutions (EBLU)
EBMT,Eagle Bancorp Montana Inc (EBMT)
EBND,SPDR Series Trust (EBND)
EBON,Ebang International Holdings Inc (EBON)
EBR,Centrais Eletricas Brasileiras S.A. (EBR)
EBRB,Centrais Eletricas Brasileiras S.A. (EBRB)
EBR_B,Centrais Eletricas Brasileiras S.A. (EBR.B)
EBS,Emergent Biosolutions Inc (EBS)
EBSB,Meridian Bancorp Inc (EBSB)
EBSW,Emergent Biosolutions Inc (EBSw)
EBTC,"Enterprise Bancorp, Inc. (EBTC)"
EC,Ecopetrol SA (EC)
EC_1,Engelhard Corp. (EC)
ECAW_,(ECAw_)
ECC,Eagle Point Credit Company Inc (ECC)
ECC_1,ECC International Corp. (ECC)
ECCA,Eagle Point Credit Company Inc (ECCA)
ECCA_1,Eclipse Capital Corp. (ECCA)
ECCA_CL,Eagle Point Credit Company Inc (ECCA.CL)
ECCB,Eagle Point Credit Company Inc (ECCB)
ECCX,Eagle Point Credit Company Inc (ECCX)
ECCY,Eagle Point Credit Company Inc (ECCY)
ECCZ,Eagle Point Credit Company Inc (ECCZ)
ECCZ_CL,Eagle Point Credit Company Inc (ECCZ.CL)
ECF,Ellsworth Growth and Income Fund Ltd (ECF)
ECF_P_A,Ellsworth Growth and Income Fund Ltd (ECFpA)
ECH,BlackRock Institutional Trust Company N.A. (ECH)
ECHO,Echo Global Logistics Inc (ECHO)
ECL,"Ecolab, Inc. (ECL)"
ECL_WD,Ecolab Inc (ECL.WD)
ECNS,BlackRock Institutional Trust Company N.A. (ECNS)
ECOL,US Ecology Inc. (ECOL)
ECOL_1,US Ecology Inc (ECOL)
ECOLW,US Ecology Inc. (ECOLW)
ECOM,ChannelAdvisor Corp (ECOM)
ECOM_1,Ecometry Corp. (ECOM)
ECON,Columbia ETF Trust II (ECON)
ECOR,ElectroCore Inc (ECOR)
ECPG,"Encore Capital Group, Inc. (ECPG)"
ECR,ECC Capital Corp (ECR)
ECT,ECA Marcellus Trust I (ECT)
ECTW_,ECA Marcellus Trust I (ECTw_)
ECV,BlackRock Enhanced Equity Yield & Premium Fund Inc (ECV)
ECYT,Endocyte Inc (ECYT)
ED,"Consolidated Edison, Inc. (ED)"
EDAP,EDAP TMS S.A. (EDAP)
EDBI,Legg Mason ETF Investment Trust (EDBI)
EDC,Direxion Shares ETF Trust (EDC)
EDD,Morgan Stanley Emerging Markets Domestic Debt Fund Inc (EDD)
EDE,Empire District Electric Co. (EDE)
EDEN,BlackRock Institutional Trust Company N.A. (EDEN)
EDE_P_D_CL,Empire District Electric Trust I (EDEpD.CL)
EDF,Stone Harbor Emerging Markets Income Fund (EDF)
EDF_1,Citigroup Inc (EDF)
EDG,Edgen Group Inc (EDG)
EDGW,Edgewater Technology Inc (EDGW)
EDI,Stone Harbor Emerging Markets Total Income Fund (EDI)
EDI_1,EDiets.com Inc (EDI)
EDIT,Editas Medicine Inc (EDIT)
EDIV,SSgA Active Trust (EDIV)
EDN,Empresa Distribuidora y Comercial Norte S.A. (EDN)
EDNT,Edison Nation Inc (EDNT)
EDO,EDO Corp. (EDO)
EDOC,Global X Funds (EDOC)
EDOG,ALPS Fund Services (EDOG)
EDOM,WisdomTree Trust (EDOM)
EDOW,First Trust Exchange-Traded Fund III (EDOW)
EDP,EDP-Energias DE Portugal S.A. (EDP)
ED_P_RA_CL,"Consolidated Edison, Inc. (EDpRA.CL)"
ED_P_RC_CL,"Consolidated Edison, Inc. (EDpRC.CL)"
EDR_1,Education Realty Trust Inc (EDR)
EDRY,EuroDry Ltd (EDRY)
EDS,Electronic Data Systems Corp. (EDS)
EDSA,Edesa Biotech Inc (EDSA)
EDT,"Entergy Texas, Inc. (EDT)"
EDT_CL,ENTERGY TEXAS INC (EDT.CL)
EDTK,Skillful Craftsman Education Technology Ltd (EDTK)
EDTX,EdtechX Holdings Acquisition Corp (EDTX)
EDTXU,EdtechX Holdings Acquisition Corp (EDTXU)
EDTXW,EdtechX Holdings Acquisition Corp (EDTXW)
EDU,New Oriental Education & Technology (EDU)
EDUC,Educational Development Corp. (EDUC)
EDUT,Global X Funds (EDUT)
EDV,"Vanguard Group, Inc. (EDV)"
EDZ,Direxion Shares ETF Trust (EDZ)
EE,El Paso Electric Company (EE)
EEA,European Equity Fund Inc (EEA)
EEB,Invesco BRIC ETF (EEB)
EEB_1,Invesco Capital Management LLC (EEB)
EEF,BlackRock Enhanced Equity Yield Fund Inc (EEF)
EEFT,Euronet Worldwide Inc (EEFT)
EEH,AB Svensk Exportkredit (EEH)
EEI,"Ecology And Environment, Inc. (EEI)"
EELV,Invesco Capital Management LLC (EELV)
EEM,BlackRock Institutional Trust Company N.A. (EEM)
EEMA,BlackRock Institutional Trust Company N.A. (EEMA)
EEMD,ETF Series Solutions Trust (EEMD)
EEMO,Invesco Capital Management LLC (EEMO)
EEMS,BlackRock Institutional Trust Company N.A. (EEMS)
EEMV,BlackRock Institutional Trust Company N.A. (EEMV)
EEMX,SSgA Active Trust (EEMX)
EEP,Enbridge Energy Partners L.P (EEP)
EEQ,"Enbridge Energy Management, L.L.C... (EEQ)"
EES,WisdomTree Trust (EES)
EET,ProShares Trust (EET)
EEV,ProShares Trust (EEV)
EEX,Emerald Holding Inc (EEX)
EEX_1,EEX Corp (EEX)
EFA,BlackRock Institutional Trust Company N.A. (EFA)
EFAD,ProShares Trust (EFAD)
EFAS,Global X Funds (EFAS)
EFAV,BlackRock Institutional Trust Company N.A. (EFAV)
EFAX,SSgA Active Trust (EFAX)
EFBI,Eagle Financial Bancorp Inc (EFBI)
EFC,Ellington Financial Inc (EFC)
EFC_1,Ellington Financial Inc (EFC)
EFC_2,Ellington Financial Inc (EFC)
EFC_P_A,Ellington Financial Inc (EFCpA)
EFD,EFunds Corp (EFD)
EFF,Eaton Vance Floating-Rate Income Plus Fund (EFF)
EFFE,Global X Funds (EFFE)
EFG,BlackRock Institutional Trust Company N.A. (EFG)
EFII,"Electronics For Imaging, Inc. (EFII)"
EFL,Eaton Vance Floating-Rate 2022 Target Term Trust (EFL)
EFL_1,Western Asset Emerging Markets Floating Rate Fund Inc (EFL)
EFM,Entergy Miss Inc (EFM)
EFM_CL,Entergy Mississippi Inc (EFM.CL)
EFNL,BlackRock Institutional Trust Company N.A. (EFNL)
EFO,ProShares Trust (EFO)
EFOI,Energy Focus Inc (EFOI)
EFR,Eaton Vance Senior Floating-Rate Trust (EFR)
EFSC,Enterprise Financial Services Corp. (EFSC)
EFT,Eaton Vance Floating-Rate Income Trust (EFT)
EFU,ProShares Trust (EFU)
EFV,BlackRock Institutional Trust Company N.A. (EFV)
EFX,"Equifax, Inc. (EFX)"
EFZ,ProShares Trust (EFZ)
EGAN,eGain Corp (EGAN)
EGBN,Eagle Bancorp Inc (MD) (EGBN)
EGC,Energy XXI Gulf Coast Inc (EGC)
EGF,BlackRock Enhanced Government Fund Inc (EGF)
EGHT,8X8 Inc. (EGHT)
EGI,Entree Resources Ltd (EGI)
EGIF,Eagle Growth and Income Opportunities Fund (EGIF)
EGL,Engility Holdings Inc (EGL)
EGL_1,"Eagle Supply Group, Inc. (EGL)"
EGLE,Eagle Bulk Shipping Inc (EGLE)
EGLT,Egalet Corp (EGLT)
EGLW_,Engility Holdings (EGLw_)
EGLW__1,Engility Holdings Inc (EGLw_)
EGN,Energen Corp. (EGN)
EGO,Eldorado Gold Corp. (EGO)
EGOV,NIC Inc (EGOV)
EGP,"Eastgroup Properties, Inc. (EGP)"
EGP_P_D_,"Eastgroup Properties, Inc. (EGPpD_)"
EGP_P_D_CL,(EGPpD.CL)
EGPT,VanEck Vectors ETF Trust (EGPT)
EGRX,Eagle Pharmaceuticals Inc (EGRX)
EGY,"VAALCO Energy, Inc. (EGY)"
EH,EHang Holdings Ltd (EH)
EHA,ENTERGY ARKANSAS 6.70% SERIES FIRST MOR (EHA)
EHA_1,ENTERGY ARKANSAS INC. (EHA)
EHA_2,ENTERGY ARKANSAS INC 6.70% (EHA)
EHA_4,(EHA)
EHA_5,(EHA)
EHA_CL,ENTERGY ARKANSAS INC 6.70% (EHA.CL)
EHA_CL_1,ENTERGY ARKANSAS 6.70% SERIES FIRST MOR (EHA.CL)
EHB_CL,Entergy Ark Inc (EHB.CL)
EHC,Encompass Health Corp (EHC)
EHI,Western Asset Global High Income Fund Inc (EHI)
EHIC,eHi Car Services Limited (EHIC)
EHL,ENTERGY LOUISIANA LLC (TEXAS) 7.60% SE (EHL)
EHL_1,ENTERGY LOUISIANA INC. (EHL)
EHL_2,ENTERGY LOUISIANA INC. (EHL)
EHL_4,(EHL)
EHL_5,Ehlebracht AG (EHL)
EHL_CL,0 (EHL.CL)
EHL_CL_1,ENTERGY LOUISIANA INC. (EHL.CL)
EHL_CL_2,ENTERGY LOUISIANA LLC (TEXAS) 7.60% SE (EHL.CL)
EHP,"Eagle Hospitality Properties Trust, Inc. (EHP)"
EHP_P_A,"Eagle Hospitality Properties Trust, Inc. (EHPpA)"
EHP_P_A_,(EHPpA_)
EHT,Eaton Vance High Income 2021 Target Term Trust (EHT)
EHTH,eHealth Inc (EHTH)
EIA,Eaton Vance California Municipal Bond Fund II (EIA)
EIC,Eagle Point Income Company Inc (EIC)
EIDO,BlackRock Institutional Trust Company N.A. (EIDO)
EIDX,Eidos Therapeutics Inc (EIDX)
EIG,Employers Holdings Inc (EIG)
EIGI,Endurance International Group Holdings Inc (EIGI)
EIGR,Eiger BioPharmaceuticals Inc (EIGR)
EIM,Eaton Vance Municipal Bond Fund (EIM)
EINC,VanEck Vectors ETF Trust (EINC)
EIO_1,Eaton Vance Ohio Municipal Bond Fund (EIO)
EIP_1,Eaton Vance Pennsylvania Municipal Bond Fund (EIP)
EIRL,BlackRock Institutional Trust Company N.A. (EIRL)
EIS,BlackRock Institutional Trust Company N.A. (EIS)
EIV,Eaton Vance Municipal Bond Fund II (EIV)
EIX,Edison International (EIX)
EJ,E-House China Holdings Ltd (EJ)
EJAN,Innovator ETFs Trust (EJAN)
EJUL,Innovator ETFs Trust (EJUL)
EKAR,Exchange Traded Concepts Trust (EKAR)
EKH,(EKH)
EKH_1,(EKH)
EKH_2,Centurion Electronics (EKH)
EKSO,Ekso Bionics Holdings Inc (EKSO)
EL,"Estee Lauder Cos., Inc. (EL)"
ELA,Envela Corp (ELA)
ELA_1,Entergy Louisiana LLC (ELA)
ELA_CL,Entergy Louisiana LLC New (ELA.CL)
ELAN,Elanco Animal Health Inc (ELAN)
ELANW,Elanco Animal Health Inc (ELANw)
ELAT,Elanco Animal Health Inc (ELAT)
ELB,Entergy Louisiana Holdings Inc (ELB)
ELB_CL,Entergy Louisiana LLC New (ELB.CL)
ELC,Entergy Louisiana LLC (ELC)
ELC_1,Eastern Light Capital Inc (ELC)
ELD,WisdomTree Trust (ELD)
ELE,Endesa S.A. (ELE)
ELEC,Electrum Special Acquisition Corp (ELEC)
ELECU,Electrum Special Acquisition Corp (ELECU)
ELECW,Electrum Special Acquisition Corp (ELECW)
ELF,e.l.f. Beauty Inc (ELF)
ELGX,Endologix Inc (ELGX)
ELJ,Entergy Louisiana LLC (ELJ)
ELJ_1,Citigroup Inc (ELJ)
ELK,Elkcorp (ELK)
ELLI,Ellie Mae Inc. (ELLI)
ELLO,Ellomay Capital Ltd (ELLO)
ELMD,Electromed Inc. (ELMD)
ELN,Elan Corporation Plc (ELN)
ELON,Echelon Corp. (ELON)
ELOX,Eloxx Pharmaceuticals Inc (ELOX)
ELP,Cia Paranaense De Energia Copel (ELP)
ELS,Equity Lifestyle Properties Inc. (ELS)
ELSE,"Electro-Sensors, Inc. (ELSE)"
ELS_P_C_CL,Equity Lifestyle Properties Inc. (ELSpC.CL)
ELS_P_C_CL_1,Equity Lifestyle Properties Inc (ELSpC.CL)
ELS_P_RA_CL,Equity Lifestyle Properties Inc. (ELSpRA.CL)
ELT,Elster Group SE (ELT)
ELTK,Eltek Ltd (ELTK)
ELU,Entergy Louisiana LLC (ELU)
ELU_1,Citigroup Inc (ELU)
ELU_2,"Merrill Lynch & Co., Inc (ELU)"
ELVT,Elevate Credit Inc (ELVT)
ELVT_1,Bloggerwave Inc (ELVT)
ELX,Emulex Corporation (ELX)
ELY,Callaway Golf Co. (ELY)
EM,Emdeon Inc (EM)
EMAG,VanEck Vectors ETF Trust (EMAG)
EMAN,EMagin Corp (EMAN)
EMB,BlackRock Institutional Trust Company N.A. (EMB)
EMBD,Global X Funds (EMBD)
EMBH,BlackRock Institutional Trust Company N.A. (EMBH)
EMBU,Direxion Shares ETF Trust (EMBU)
EMC_1,EMC Corp. (EMC)
EMCB,WisdomTree Trust (EMCB)
EMCF,Emclaire Financial Corp. (EMCF)
EMCG,WisdomTree Trust (EMCG)
EMCI,EMC Insurance Group Inc. (EMCI)
EMD,Western Asset Emerging Markets Debt Fund Inc (EMD)
EMD_1,Western Asset Emerging Markets Income Fund Inc. (EMD)
EMD_2,Western Asset Emerging Markets Income Fund Inc (EMD)
EMDV,ProShares Trust (EMDV)
EME,"Emcor Group, Inc. (EME)"
EMEM,ETFis Series Trust I (EMEM)
EMES,Emerge Energy Services LP (EMES)
EMF,Templeton Emerging Markets Fund (EMF)
EMFM,Global X Funds (EMFM)
EMG,Emergent Capital Inc (EMG)
EMGF,BlackRock Institutional Trust Company N.A. (EMGF)
EMHY,BlackRock Institutional Trust Company N.A. (EMHY)
EMI,Eaton Vance Michigan Municipal Income Trust (EMI)
EMIF,BlackRock Institutional Trust Company N.A. (EMIF)
EMIH,DBX ETF Trust (EMIH)
EMITF,Elbit Imaging Ltd (EMITF)
EMJ_1,Eaton Vance New Jersey Municipal Bond Fund (EMJ)
EMKR,Emcore Corp. (EMKR)
EML,Eastern Co. (EML)
EMLC,VanEck Vectors ETF Trust (EMLC)
EMLP,First Trust Exchange-Traded Fund III (EMLP)
EMMA,Emmaus Life Sciences Incorporation (EMMA)
EMMF,WisdomTree Trust (EMMF)
EMMS,Emmis Communications Corp. (EMMS)
EMN,Eastman Chemical Co (EMN)
EMNT,Pimco Exchange Traded Fund (EMNT)
EMN_WS,Eastman Chemical Company (EMN.WS)
EMO,ClearBridge Energy Midstream Opportunity Fund Inc (EMO)
EMO_CL,ENTERGY MISSISSIPPI INC. 7.25% SERIES F (EMO.CL)
EMO_CL_1,ENTERGY MISSISSIPPI INC. (EMO.CL)
EMP,Entergy Utility Enterprises Inc (EMP)
EMP_1,"Empire Of Carolina, Inc. (EMP)"
EMPW_U,Empower Ltd (EMPW.U)
EMQ,Entergy Miss Inc (EMQ)
EMQ_CL,Entergy Mississippi Inc (EMQ.CL)
EMQQ,Exchange Traded Concepts Trust (EMQQ)
EMR,Emerson Electric Co. (EMR)
EMS,Emergency Medical Services Corporation (EMS)
EMSG,DBX ETF Trust (EMSG)
EMSH,ProShares Trust (EMSH)
EMT,Embratel Participacoes S.A. (EMT)
EMTL,SSgA Active Trust (EMTL)
EMTY,ProShares Trust (EMTY)
EMX,EMX Royalty Corp (EMX)
EMXC,BlackRock Institutional Trust Company N.A. (EMXC)
EMZ,Entergy Miss Inc (EMZ)
EMZ_CL,Entergy Mississippi Inc (EMZ.CL)
EN,Enel Spa (EN)
ENB,Enbridge Inc (ENB)
ENBA,Enbridge Inc (ENBA)
ENBL,Enable Midstream Partners LP (ENBL)
END,Endeavour International Corp (END)
ENDP,Endo International plc (ENDP)
ENFC,Entegra Financial Corp (ENFC)
ENFR,ALPS Fund Services (ENFR)
ENG,Englobal Corporation (ENG)
ENH_1,Endurance Speciality Holdings Ltd. (ENH)
ENH_P_A_CL,Endurance Speciality Holdings (ENHpA.CL)
ENH_P_B_CL,Endurance Speciality Holdings Ltd. (ENHpB.CL)
ENH_P_C,Endurance Speciality Holdings Ltd. (ENHpC)
ENH_P_RC,Endurance Speciality Holdings Ltd. (ENHpRC)
ENI,Enersis Americas SA (ENI)
ENIA,Enel Americas SA (ENIA)
ENIAR,Enel Americas SA (ENIAr)
ENIAW,Enel Americas SA (ENIAw)
ENIAW_1,Enersis Americas SA (ENIAw)
ENIC,Enel Chile S.A. (ENIC)
ENICW,Enersis Chile SA (ENICw)
ENIR_,Enersis S.A. (ENIr_)
ENJ,Entergy New Orleans Inc (ENJ)
ENJ_1,Entergy New Orleans LLC (ENJ)
ENJ_2,Entergy New Orleans Inc (ENJ)
ENJ_3,ENTERGY NEW ORLEANS Inc (ENJ)
ENJ_4,Entergy New Orleans (ENJ)
ENJ_6,Entergy New Orleans Inc Pfd (ENJ)
ENLC,Enlink Midstream LLC (ENLC)
ENLK,EnLink Midstream Partners LP (ENLK)
ENLV,Enlivex Therapeutics Ltd (ENLV)
ENLW,(ENLw)
ENN,Equity Inns Inc. (ENN)
ENN_P_B,Equity Inns Inc. (ENNpB)
ENN_P_B_,(ENNpB_)
ENN_P_C,Equity Inns Inc. (ENNpC)
ENN_P_C_,(ENNpC_)
ENO,Entergy New Orleans Inc (ENO)
ENO_1,Entergy New Orleans LLC (ENO)
ENO_2,Entergy New Orleans Inc (ENO)
ENOB,Enochian Biosciences Inc (ENOB)
ENOR,BlackRock Institutional Trust Company N.A. (ENOR)
ENP,Encore Energy Partners (ENP)
ENPC_U,Executive Network Partnering Corporation (ENPC.U)
ENPH,Enphase Energy Inc (ENPH)
ENR,Energizer Holdings Inc (ENR)
ENR_P_A,Energizer Holdings Inc (ENRpA)
ENRW,Energizer Holdings Inc (ENRw)
ENS,Enersys (ENS)
ENSG,Ensign Group Inc (ENSG)
ENSV,Enservco Corp (ENSV)
ENT,Global Eagle Entertainment Inc (ENT)
ENT_1,Enterra Energy Trust (ENT)
ENTA,Enanta Pharmaceuticals Inc (ENTA)
ENTG,Entegris Inc (ENTG)
ENTR,Entrepreneurshares Series Trust (ENTR)
ENTX,Entera Bio Ltd (ENTX)
ENTXW,Entera Bio Ltd (ENTXW)
ENV,Envestnet Inc. (ENV)
ENV_1,BioMedical Technology Solutions Holdings Inc (ENV)
ENVA,Enova International Inc. (ENVA)
ENVAW_R,Enova International Inc (ENVAw_r)
ENX,Eaton Vance New York Municipal Bond Fund (ENX)
ENY,Invesco Capital Management LLC (ENY)
ENZ,"Enzo Biochem, Inc. (ENZ)"
ENZL,BlackRock Institutional Trust Company N.A. (ENZL)
EOC,Empresa National De Electricidad SA (EOC)
EOCA,Endesa Americas S.A. (EOCA)
EOCAW,Endesa Americas SA (EOCAw)
EOCC,Enel Generacion Chile S.A. (EOCC)
EOCCW,Empresa Nacional de Electricidad Sa (EOCCw)
EOD,Wells Fargo Global Dividend Opportunity Fund (EOD)
EOE,Eaton Vance Credit Opportunities Fund (EOE)
EOG,"EOG Resources, Inc. (EOG)"
EOI,Eaton Vance Enhanced Equity Income Fund (EOI)
EOLS,Evolus Inc (EOLS)
EON,E. On SE (EON)
EOP,Equity Office Properties Trust (EOP)
EOP_P_B,Equity Office Properties Trust (EOPpB)
EOP_P_B_,(EOPpB_)
EOP_P_G,Equity Office Properties Trust (EOPpG)
EOP_P_G_,(EOPpG_)
EOS,Eaton Vance Enhanced Equity Income Fund II (EOS)
EOT,Eaton Vance National Municipal Opportunities Trust (EOT)
EP,El Paso Corporation (EP)
EPAC,Enerpac Tool Group Corp (EPAC)
EPAM,EPAM Systems Inc (EPAM)
EPAY,Bottomline Technologies (Delaware) Inc (EPAY)
EPB,El Paso Pipeline Partners LP (EPB)
EPB_CL,(EPB.CL)
EPC,Edgewell Personal Care Co (EPC)
EPC_1,Citigroup Inc (EPC)
EPCW,Edgewell Personal Care Company (EPCw)
EPD,Enterprise Products Partners L P (EPD)
EPE,Ep Energy Corp. (EPE)
EPE_1,Enterprise GP Holdings LP (EPE)
EPHE,BlackRock Institutional Trust Company N.A. (EPHE)
EPI,WisdomTree Trust (EPI)
EPIX,Essa Pharma Inc (EPIX)
EPL,EPL Oil & Gas Inc (EPL)
EPL_1,EPL Oil & Gas Inc (EPL)
EPL_WD,(EPL.WD)
EPM,Evolution Petroleum Corporation (EPM)
EPM_P_A,Evolution Petroleum Corporation (EPMpA)
EPOL,BlackRock Institutional Trust Company N.A. (EPOL)
EPP,BlackRock Institutional Trust Company N.A. (EPP)
EP_P_C,El Paso Energy Capital Trust I. (EPpC)
EP_P_RC,El Paso Energy Capital Trust I. (EPpRC)
EPR,EPR Properties (EPR)
EPRF,Innovator ETFs Trust II (EPRF)
EPR_P_A,(EPRpA)
EPR_P_A_,(EPRpA_)
EPR_P_A_CL,(EPRpA.CL)
EPR_P_C,EPR Properties (EPRpC)
EPR_P_E,EPR Properties (EPRpE)
EPR_P_F_CL,EPR Properties (EPRpF.CL)
EPR_P_G,EPR Properties (EPRpG)
EPR_P_RB_CL,EPR Properties (EPRpRB.CL)
EPR_P_RC,EPR Properties (EPRpRC)
EPR_P_RD_CL,EPR Properties (EPRpRD.CL)
EPR_P_RE,EPR Properties (EPRpRE)
EPR_P_RF,EPR Properties (EPRpRF)
EPR_P_RFCL,EPR Properties (EPRpRFCL)
EPR_P_RG,EPR Properties (EPRpRG)
EPRT,Essential Properties Realty Trust Inc (EPRT)
EPS,WisdomTree Trust (EPS)
EPSN,Epsilon Energy Ltd (EPSN)
EPU,BlackRock Institutional Trust Company N.A. (EPU)
EPV,ProShares Trust (EPV)
EPZM,Epizyme Inc (EPZM)
EQ,Equillium Inc (EQ)
EQ_1,Embarq Corporation (EQ)
EQAL,Invesco Capital Management LLC (EQAL)
EQBK,Equity Bancshares Inc (EQBK)
EQC,Equity Commonwealth (EQC)
EQCN,Equity Commonwealth (EQCN)
EQCNCL,Equity Commonwealth (EQCNCL)
EQCO,Equity Commonwealth (EQCO)
EQCO_CL,Equity Commonwealth (EQCO.CL)
EQC_P_D,Equity Commonwealth (EQCpD)
EQC_P_E_CL,Equity Commonwealth (EQCpE.CL)
EQC_P_E_CL_1,Equity Commonwealth (EQCpE.CL)
EQC_P_RD,Equity Commonwealth (EQCpRD)
EQD_U,Equity Distribution Acquisition Corp (EQD.U)
EQFN,Equitable Financial Corp. (EQFN)
EQGP,EQGP Holdings LP (EQGP)
EQH,Equitable Holdings Inc (EQH)
EQH_P_A,Equitable Holdings Inc (EQHpA)
EQIX,Equinix Inc (EQIX)
EQL,ALPS Fund Services (EQL)
EQLT,ALPS Fund Services (EQLT)
EQM_1,EQM Midstream Partners LP (EQM)
EQNR,Equinor ASA (EQNR)
EQOS,Diginex Limited (EQOS)
EQOSW,Diginex Limited (EQOSW)
EQR,Equity Residential Properties Trust (EQR)
EQR_P_D_CL,Equity Residential Properties Trust (EQRpD.CL)
EQR_P_E_CL,Equity Residential Properties Trust (EQRpE.CL)
EQR_P_H_CL,Equity Residential Properties Trust (EQRpH.CL)
EQR_P_RN_CL,Equity Residential Properties Trust (EQRpRN.CL)
EQRR,ProShares Trust (EQRR)
EQS,Equus Total Return Inc (EQS)
EQT,EQT Corp (EQT)
EQTW,EQT Corp (EQTw)
EQU,Equal Energy Ltd (EQU)
EQWL,Invesco Capital Management LLC (EQWL)
EQWM,Invesco S&P MidCap Quality ETF (EQWM)
EQWM_1,Invesco Capital Management LLC (EQWM)
EQWS,Invesco Capital Management LLC (EQWS)
EQX,Equinox Gold Corp (EQX)
EQY,"Equity One, Inc. (EQY)"
ERAW_,Era Group Inc (ERAw_)
ERAW__1,ERA Group Inc (ERAw_)
ERC,Wells Fargo Multi-Sector Income Fund (ERC)
ERES,East Resources Acquisition Co (ERES)
ERESU,East Resources Acquisition Co (ERESU)
ERESW,East Resources Acquisition Co (ERESW)
ERF,Enerplus Corporation (ERF)
ERF_1,Enerplus Resources Fund (ERF)
ERF_2,Enerplus Resources Fund (ERF)
ERGF,BlackRock Institutional Trust Company N.A. (ERGF)
ERH,Wells Fargo Utilities and High Income Fund (ERH)
ERIC,Telefonaktiebolaget L M Ericsson (ERIC)
ERIE,Erie Indemnity Co. (ERIE)
ERII,Energy Recovery Inc (ERII)
ERJ,Embraer S.A. (ERJ)
ERM,First Trust Exchange-Traded Fund III (ERM)
ERN,Erin Energy Corp (ERN)
ERO,(ERO)
ERSX,Entrepreneurshares Series Trust (ERSX)
ERUS,BlackRock Institutional Trust Company N.A. (ERUS)
ERX,Direxion Shares ETF Trust (ERX)
ERY,Direxion Shares ETF Trust (ERY)
ERYP,Erytech Pharma (ERYP)
ES,Eversource Energy (ES)
ES_1,EnergySolutions Inc (ES)
ESBA,Empire State Realty OP LP (ESBA)
ESBK,Elmira Savings Bank Elmira NY (ESBK)
ESC,Emeritus Corp. (ESC)
ESCA,"Escalade, Inc. (ESCA)"
ESE,"Esco Technologies, Inc. (ESE)"
ESEA,Euroseas Ltd (ESEA)
ESEB,DBX ETF Trust (ESEB)
ESES,Eco-Stim Energy Solutions Inc (ESES)
ESG,FlexShares Trust (ESG)
ESGC,Eros STX Global Corporation (ESGC)
ESGD,iShares Trust (ESGD)
ESGE,iShares Trust (ESGE)
ESGF,Invesco Exchange-Traded Fund Trust II (ESGF)
ESGF_1,Oppenheimer Revenue Weighted ETF Trust (ESGF)
ESGG,FlexShares Trust (ESGG)
ESGL,Invesco Exchange-Traded Fund Trust II (ESGL)
ESGL_1,Oppenheimer Revenue Weighted ETF Trust (ESGL)
ESGN,Columbia ETF Trust I (ESGN)
ESGR,Enstar Group Limited (ESGR)
ESGRO,Enstar Group Limited (ESGRO)
ESGRP,Enstar Group Limited (ESGRP)
ESGS,Columbia ETF Trust I (ESGS)
ESGU,iShares Trust (ESGU)
ESGV,"Vanguard Group, Inc. (ESGV)"
ESGW,Columbia ETF Trust I (ESGW)
ESHY,DBX ETF Trust (ESHY)
ESI,Element Solutions Inc (ESI)
ESI_1,ITT Educational Services Inc (ESI)
ESI_2,"ITT Educational Services, Inc. (ESI)"
ESIO,"Electro Scientific Industries, Inc. (ESIO)"
ESL,Esterline Technologies Corp (ESL)
ESLT,Elbit Systems Ltd. (ESLT)
ESML,BlackRock Institutional Trust Company N.A. (ESML)
ESNC,EnSync Inc (ESNC)
ESND,Essendant Inc (ESND)
ESNT,Essent Group Ltd (ESNT)
ESP,Espey Manufacturing & Electronics Corp. (ESP)
ESPO,VanEck Vectors ETF Trust (ESPO)
ESPR,Esperion Therapeutics Inc. (ESPR)
ESQ,Esquire Financial Holdings Inc (ESQ)
ESRT,Empire State Realty Trust Inc (ESRT)
ESRX,Express Scripts Holding Co (ESRX)
ESS,"Essex Property Trust, Inc. (ESS)"
ESSA,ESSA Bancorp Inc (ESSA)
ESSC,East Stone Acquisition Corp (ESSC)
ESSCR,East Stone Acquisition Corp (ESSCR)
ESSCU,East Stone Acquisition Corp (ESSCU)
ESSCW,East Stone Acquisition Corp (ESSCW)
ESS_P_H_CL,"Essex Property Trust, Inc. (ESSpH.CL)"
ESS_P_H_CL_1,Essex Property Trust Inc (ESSpH.CL)
ESTA,Establishment Labs Holdings Inc (ESTA)
ESTC,Elastic N.V (ESTC)
ESTE,Earthstone Energy Inc (ESTE)
ESTR,Estre Ambiental Inc (ESTR)
ESTRW,Estre Ambiental Inc (ESTRW)
ESV,Ensco International Inc (ESV)
ESV_1,Ensco International Inc (ESV)
ESXB,Community Bankers Trust Corp (ESXB)
ET,Energy Transfer LP (ET)
ET_1,"ExactTarget, Inc. (ET)"
ETAC,E.Merge Technology Acquisition Corp (ETAC)
ETACU,E.Merge Technology Acquisition Corp (ETACU)
ETACW,E.Merge Technology Acquisition Corp (ETACW)
ETB,Eaton Vance Tax-Managed Buy-Write Income Fund (ETB)
ETCW,Energy Transfer Corp LP (ETCw)
ETFC,E TRADE Financial Corp. (ETFC)
ETG,Eaton Vance Tax-Advantaged Global Dividend Income Fund (ETG)
ETH,"Ethan Allen Interiors, Inc. (ETH)"
ETHO,ETF Managers Group LLC (ETHO)
ETI_P,"Entergy Texas, Inc. (ETIp)"
ETJ,Eaton Vance Risk-Managed Diversified Equity Income Fund (ETJ)
ETM,Entercom Communications Corp (ETM)
ETMW,Entercom Communications Corp (ETMw)
ETM_WI,Entercom Communications Corp (ETM WI)
ETN,Eaton Corporation plc (ETN)
ETNB,89bio Inc (ETNB)
ETO,Eaton Vance Tax-Advantaged Global Dividend Opportunities Fund (ETO)
ETON,Eton Pharmaceuticals Inc (ETON)
ETP,Energy Transfer Partners L.P. (ETP)
ETP_1,Energy Transfer Partners LP New (ETP)
ETP_2,"Energy Transfer Partners, L.P. (ETP)"
ETP_P_C,Energy Transfer Operating L.P (ETPpC)
ETP_P_D,Energy Transfer Operating L.P (ETPpD)
ETP_P_E,Energy Transfer Operating L.P (ETPpE)
ETPW_,Energy Transfer Partners (ETPw_)
ETR,Entergy Corp. (ETR)
ETR_1,Eternit S.A.L. (ETR)
ETRN,Equitrans Midstream Corporation (ETRN)
ETR_P_A,ENTERGY CORP EQ UT (ETRpA)
ETR_P_A_,(ETRpA_)
ETR_P_A_1,(ETRpA)
ETSY,Etsy Inc (ETSY)
ETTX,Entasis Therapeutics Holdings Inc (ETTX)
ETV,Eaton Vance Tax-Managed Buy-Write Opportunities Fund (ETV)
ETW,Eaton Vance Tax-Managed Global Buy-Write Opportunities Fund (ETW)
ETX,Eaton Vance Municipal Income 2028 Term Trust (ETX)
ETX_1,ALPS Fund Services (ETX)
ETY,Eaton Vance Tax-Managed Diversified Equity Income Fund (ETY)
EUDG,WisdomTree Trust (EUDG)
EUDV,ProShares Trust (EUDV)
EUFL,Direxion Shares ETF Trust (EUFL)
EUFN,BlackRock Institutional Trust Company N.A. (EUFN)
EUFX,ProShares Trust (EUFX)
EUM,ProShares Trust (EUM)
EUMF,WisdomTree Trust (EUMF)
EUMV,BlackRock Institutional Trust Company N.A. (EUMV)
EUO,ProShares Trust (EUO)
EURL,Direxion Shares ETF Trust (EURL)
EURN,Euronav NV (EURN)
EURZ,DBX ETF Trust (EURZ)
EUSA,BlackRock Institutional Trust Company N.A. (EUSA)
EUSB,iShares Trust (EUSB)
EUSC,WisdomTree Trust (EUSC)
EUXL,Direxion Shares ETF Trust (EUXL)
EV,Eaton Vance Corp. (EV)
EVA,Enviva Partners LP (EVA)
EVBG,Everbridge Inc (EVBG)
EVBN,Evans Bancorp Inc (EVBN)
EVC,Entravision Communications Corp. (EVC)
EVDY,Everyday Health Inc (EVDY)
EVEP,EV Energy Partners LP (EVEP)
EVER,EverQuote Inc (EVER)
EVER_P_A,EverBank Financial Corp (EVERpA)
EVF,Eaton Vance Senior Income Trust (EVF)
EVFM,Evofem Biosciences Inc (EVFM)
EVG,Eaton Vance Short Duration Diversified Income Fund (EVG)
EVG_1,"Evergreen Resources, Inc. (EVG)"
EVGN,Evogene Ltd (EVGN)
EVH,Evolent Health Inc (EVH)
EVHC_1,Envision Healthcare Corp (EVHC)
EVHC_2,Envision Healthcare Holdings Inc (EVHC)
EVHC_P,Envision Healthcare Corp (EVHCp)
EVI,EVI Industries Inc (EVI)
EVIX,VelocityShares 1x Long VSTOXX Futures ETN (EVIX)
EVIX_1,UBS AG London Branch (EVIX)
EVJ,Eaton Vance New Jersey Municipal Income Trust (EVJ)
EVK,"Ever-Glory International Group, Inc. (EVK)"
EVLO,Evelo Biosciences Inc (EVLO)
EVM,Eaton Vance California Municipal Bond Fund (EVM)
EVN,Eaton Vance Municipal Income Trust (EVN)
EVO_1,Eaton Vance Ohio Municipal Income Trust (EVO)
EVOK,Evoke Pharma Inc (EVOK)
EVOL,"Evolving Systems, Inc. (EVOL)"
EVOP,EVO Payments Inc (EVOP)
EVP_1,Eaton Vance Pennsylvania Municipal Income Trust (EVP)
EVR,Evercore Inc (EVR)
EVRG,Evergy Inc (EVRG)
EVRI,Everi Holdings Inc (EVRI)
