ticker,issuer_name
PNK,Pinnacle Entertainment Inc. (PNK)
PNM,PNM Resources Inc (PNM)
PNM_P_A,PNM RES INC UNITS (PNMpA)
PNM_P_A_,(PNMpA_)
PNM_P_A_1,(PNMpA)
PNNT,PennantPark Investment Corporation (PNNT)
PNNTG,PennantPark Investment Corporation (PNNTG)
PNOV,Innovator ETFs Trust (PNOV)
PNQI,Invesco Capital Management LLC (PNQI)
PNR,Pentair plc (PNR)
PNR_1,Pentair plc (PNR)
PNRG,PrimeEnergy Resources Corp (PNRG)
PNRL,Paringa Resources Limited (PNRL)
PNRW,Pentair plc (PNRw)
PNRW_,Pentair Ltd (New) (PNRw_)
PNTA,PennantPark Investment Corporation (PNTA)
PNTA_CL,PennantPark Investment Corporation (PNTA.CL)
PNTG,Pennant Group Inc (PNTG)
PNTR,Pointer Telocation Ltd (PNTR)
PNU,PNC Capital Trust D (PNU)
PNU_CL,PNC Cap Tst D 6.125% Capital Sec (PNU.CL)
PNU_CL_1,Pnc Cap Tst D (PNU.CL)
PNU_CL_2,PNC Capital Trust D 6.125% Capital Sec (PNU.CL)
PNW,Pinnacle West Capital Corp. (PNW)
PNX,"Phoenix Companies, Inc. (PNX)"
PNY,"Piedmont Natural Gas Co., Inc. (PNY)"
POAI,Predictive Oncology Inc (POAI)
POCT,Innovator ETFs Trust (POCT)
PODD,Insulet Corporation (PODD)
POH,PUBLIC SERVICE CO. OF OKLAHOMA 6% NOTES (POH)
POH_1,PUBLIC SERVICE COMPANY OF OKLAHOMA (POH)
POH_2,PUBLIC SERVICE COMPANY OF OKALAHOMA 6% (POH)
POH_3,PUBLIC SERVICE COMPANY OF OK (POH)
POH_4,(POH)
POLA,Polar Power Inc (POLA)
POM,Pepco Holdings Inc (POM)
POOL,Pool Corporation (POOL)
POP,Pope & Talbot Inc. (POP)
POPE,Pope Resources (POPE)
POR,Portland General Electric Co (POR)
POS,Catalina Marketing Corp. (POS)
POST,Post Holdings Inc (POST)
POSTW_,Post Holdings (POSTw_)
POT,Potash Corp. Of Saskatchewan Inc. (POT)
POTW_,(POTw_)
POTX,Global X Funds (POTX)
POWI,Power Integrations Inc. (POWI)
POWL,"Powell Industries, Inc. (POWL)"
POWR,PowerSecure International Inc (POWR)
PPA,Invesco Capital Management LLC (PPA)
PPB,(PPB)
PPB_1,"Pan Pacific Retail Properties, Inc. (PPB)"
PPBI,"Pacific Premier Bancorp, Inc. (PPBI)"
PPC,Pilgrim`s Pride Corp. (PPC)
PPC_1,Pilgrim`s Pride Corp. (PPC)
PPD,PPD Inc (PPD)
PPD_1,"Pre-Paid Legal Services, Inc. (PPD)"
PPDM,Direxion Shares ETF Trust (PPDM)
PPEM,Direxion Shares ETF Trust (PPEM)
PPF,(PPF)
PPF_1,(PPF)
PPF_2,Pilgrim`s Pride Corp. (PPF)
PPG,"PPG Industries, Inc. (PPG)"
PPG_WD,PPG Industries Inc (PPG.WD)
PPH,VanEck Vectors ETF Trust (PPH)
PPIH,Perma-Pipe International Holdings Inc (PPIH)
PPL,PPL Corp (PPL)
PPLC,Direxion Shares ETF Trust (PPLC)
PPLN,J P Morgan Chase & Co. (PPLN)
PPL_P_A_CL,PPL Electric Utils Corp (PPLpA.CL)
PPL_P_B_CL,PPL Electric Utils Corp (PPLpB.CL)
PPL_P_RU_,PPL Corp (PPLpRU_)
PPL_P_RU__1,PPL Corp (PPLpRU_)
PPL_P_RW,PPL Corp (PPLpRW)
PPL_P_U_,PPL Corp (PPLpU_)
PPLT,Aberdeen Standard Investments ETF (PPLT)
PPM,Investment Grade Municipal Income Fund. (PPM)
PPMC,Direxion Shares ETF Trust (PPMC)
PPO,Polypore International Inc. (PPO)
PPP,Primero Mining Corp (PPP)
PPP_1,Pogo Producing Co. (PPP)
PPR,Voya Prime Rate Trust (PPR)
PPS,"Post Properties, Inc. (PPS)"
PPSC,Direxion Shares ETF Trust (PPSC)
PPSI,Pioneer Power Solutions Inc (PPSI)
PPS_P_A,"Post Properties, Inc. (PPSpA)"
PPS_P_B_CL,"Post Properties, Inc. (PPSpB.CL)"
PPS_PR_A,Post Properties Inc (PPS.pR.A)
PPT,Putnam Premier Income Trust (PPT)
PPTB,Direxion Shares ETF Trust (PPTB)
PPTY,ETF Series Solutions Trust (PPTY)
PPX,"PPL Capital Funding, Inc. (PPX)"
PQ,Petroquest Energy Inc (PQ)
PQDI,Principal Exchange-Traded Funds (PQDI)
PQE,Voyager Learning Co (PQE)
PQG,PQ Group Holdings Inc (PQG)
PRA,Proassurance Corporation (PRA)
PRAA,PRA Group Inc (PRAA)
PRAH,PRA Health Sciences Inc (PRAH)
PRAX,Praxis Precision Medicines Inc (PRAX)
PRB,VanEck Vectors ETF Trust (PRB)
PRCP,"Perceptron, Inc. (PRCP)"
PRD,Polaroid Corp. (PRD)
PRDO,Perdoceo Education Corporation (PRDO)
PRE,Partnerre Ltd. (PRE)
PREF,Principal Exchange-Traded Funds (PREF)
PRE_P_D_CL,Partnerre Ltd. (PREpD.CL)
PRE_P_E_CL,Partnerre Ltd. (PREpE.CL)
PRE_P_F,Partnerre Ltd. (PREpF)
PRE_P_G,Partnerre Ltd. (PREpG)
PRE_P_H,Partnerre Ltd. (PREpH)
PRE_P_I,Partnerre Ltd. (PREpI)
PRE_P_RC_CL,Partnerre Ltd. (PREpRC.CL)
PRE_P_RF,Partnerre Ltd. (PREpRF)
PRE_P_RG,Partnerre Ltd. (PREpRG)
PRE_P_RH,Partnerre Ltd. (PREpRH)
PRE_P_RI,Partnerre Ltd. (PREpRI)
PRE_P_T_CL,(PREpT.CL)
PRF,Invesco Capital Management LLC (PRF)
PRFT,Perficient Inc. (PRFT)
PRFX,PainReform Ltd (PRFX)
PRFZ,Invesco Capital Management LLC (PRFZ)
PRGN,Paragon Shipping Inc (PRGN)
PRGO,Perrigo Company plc (PRGO)
PRGS,Progress Software Corp. (PRGS)
PRGX,PRGX Global Inc (PRGX)
PRH,Prudential Financial Inc. (PRH)
PRI,Primerica Inc (PRI)
PRID,Exchange Traded Concepts Trust (PRID)
PRIF_P_A,Priority Income Fund Inc (PRIFpA)
PRIF_P_B,Priority Income Fund Inc (PRIFpB)
PRIF_P_C,Priority Income Fund Inc (PRIFpC)
PRIF_P_D,Priority Income Fund Inc (PRIFpD)
PRIF_P_E,Priority Income Fund Inc (PRIFpE)
PRIF_P_F,Priority Income Fund Inc (PRIFpF)
PRIM,Primoris Services Corp (PRIM)
PRIS,Promotora de Informaciones (PRIS)
PRIS_B,Promotora de Informaciones (PRIS.B)
PRIS_BW,(PRIS.Bw)
PRISW_,(PRISw_)
PRK,Park National Corp. (PRK)
PRKR,Parkervision Inc. (PRKR)
PRLB,Proto Labs Inc (PRLB)
PRLD,Prelude Therapeutics Inc (PRLD)
PRM,"Primedia, Inc. (PRM)"
PRME,First Trust Exchange-Traded Fund IV (PRME)
PRMW,Primo Water Corporation (PRMW)
PRMW_1,Primo Water Corp. (PRMW)
PRN,Invesco Capital Management LLC (PRN)
PRNB,Principia Biopharma Inc (PRNB)
PRNT,ARK Investment Management LLC (PRNT)
PRO,Pros Holdings Inc (PRO)
PROF,Profound Medical Corp (PROF)
PROG,Progenity Inc (PROG)
PROS,Prosight Global Inc (PROS)
PROV,"Provident Financial Holdings, Inc. (PROV)"
PRPB,CC Neuberger Principal Holdings II (PRPB)
PRPB_U,CC Neuberger Principal Holdings II (PRPB.U)
PRPB_WS,CC Neuberger Principal Holdings II (PRPB.WS)
PRPH,ProPhase Labs Inc (PRPH)
PRPL,Purple Innovation Inc (PRPL)
PRPLW,Purple Innovation Inc (PRPLW)
PRPO,Precipio Inc (PRPO)
PRQR,ProQR Therapeutics N.V (PRQR)
PRS,Prudential Financial Inc. (PRS)
PRS_2,Primus Guaranty Ltd (PRS)
PRSC,Providence Service Corp (PRSC)
PRSP,Perspecta Inc (PRSP)
PRSS,CafePress Inc (PRSS)
PRT,PermRock Royalty Trust (PRT)
PRTA,Prothena Corporation plc (PRTA)
PRTH,Priority Technology Holdings Inc (PRTH)
PRTHU,Priority Technology Holdings Inc (PRTHU)
PRTHW,Priority Technology Holdings Inc (PRTHW)
PRTK,Paratek Pharmaceuticals Inc. (PRTK)
PRTS,CarParts.com Inc (PRTS)
PRTY,Party City Holdco Inc (PRTY)
PRU,Prudential Financial Inc. (PRU)
PRVB,Provention Bio Inc (PRVB)
PRVL,Prevail Therapeutics Inc (PRVL)
PRX,Par Pharmaceutical Companies Inc. (PRX)
PRY_CL,Prospect Capital Corp (PRY.CL)
PS,Pluralsight Inc (PS)
PSA,Public Storage (PSA)
PSA_A_CL,Public Storage (PSA.A.CL)
PSAC,Property Solutions Acquisition Corp (PSAC)
PSACU,Property Solutions Acquisition Corp (PSACU)
PSACW,Property Solutions Acquisition Corp (PSACW)
PSA_P_A_CL,Public Storage (PSApA.CL)
PSA_P_B,Public Storage (PSApB)
PSA_P_B_CL,Public Storage (PSApB.CL)
PSA_P_C,Public Storage (PSApC)
PSA_P_D,Public Storage (PSApD)
PSA_P_E,Public Storage (PSApE)
PSA_P_F,Public Storage (PSApF)
PSA_P_G,Public Storage (PSApG)
PSA_P_H,Public Storage (PSApH)
PSA_P_I,Public Storage (PSApI)
PSA_P_I_CL,Public Storage (PSApI.CL)
PSA_P_J,Public Storage (PSApJ)
PSA_P_K,Public Storage (PSApK)
PSA_P_L,Public Storage (PSApL)
PSA_P_M,Public Storage (PSApM)
PSA_P_N,Public Storage (PSApN)
PSA_P_O_CL,Public Storage (PSApO.CL)
PSA_P_P_CL,Public Storage (PSApP.CL)
PSA_P_Q_CL,Public Storage (PSApQ.CL)
PSA_P_RA,Public Storage (PSApRA)
PSA_P_RB,Public Storage (PSApRB)
PSA_P_RC,Public Storage (PSApRC)
PSA_P_RC_CL,Public Storage (PSApRC.CL)
PSA_P_R_CL,Public Storage (PSApR.CL)
PSA_P_RD,Public Storage (PSApRD)
PSA_P_RD_CL,Public Storage (PSApRD.CL)
PSA_P_RE,Public Storage (PSApRE)
PSA_P_RE_CL,Public Storage (PSApRE.CL)
PSA_P_RF,Public Storage (PSApRF)
PSA_P_RF_CL,Public Storage (PSApRF.CL)
PSA_P_RG,Public Storage (PSApRG)
PSA_P_RG_CL,Public Storage (PSApRG.CL)
PSA_P_RH_CL,Public Storage (PSApRH.CL)
PSA_P_RK_CL,Public Storage (PSApRK.CL)
PSA_P_RL_CL,Public Storage (PSApRL.CL)
PSA_P_RM_CL,Public Storage (PSApRM.CL)
PSA_P_RN_CL,Public Storage (PSApRN.CL)
PSA_P_RTCL,Public Storage (PSApRTCL)
PSA_P_RU,Public Storage (PSApRU)
PSA_P_RV,Public Storage (PSApRV)
PSA_P_RW,Public Storage (PSApRW)
PSA_P_RX,Public Storage (PSApRX)
PSA_P_RY,Public Storage (PSApRY)
PSA_P_RZ,Public Storage (PSApRZ)
PSA_P_S_CL,Public Storage (PSApS.CL)
PSA_P_T_CL,Public Storage (PSApT.CL)
PSA_P_U_,(PSApU_)
PSA_P_U_CL,Public Storage (PSApU.CL)
PSA_P_V_CL,Public Storage (PSApV.CL)
PSA_P_W,Public Storage (PSApW)
PSA_P_X,Public Storage (PSApX)
PSA_P_X_1,Public Storage (PSApX)
PSA_P_Y_CL,Public Storage (PSApY.CL)
PSA_P_Z_CL,Public Storage (PSApZ.CL)
PSAU,Invesco Capital Management LLC (PSAU)
PSB,"PS Business Parks, Inc. (PSB)"
PSB_P_K_CL,"PS Business Parks, Inc. (PSBpK.CL)"
PSB_P_L_CL,"PS Business Parks, Inc. (PSBpL.CL)"
PSB_PR,PS Business Parks Inc (PSB.pR)
PSB_P_R_CL,"PS Business Parks, Inc. (PSBpR.CL)"
PSB_P_RH_CL,"PS Business Parks, Inc. (PSBpRH.CL)"
PSB_P_RI_CL,"PS Business Parks, Inc. (PSBpRI.CL)"
PSB_P_RM_CL,"PS Business Parks, Inc. (PSBpRM.CL)"
PSB_P_RO_CL,"PS Business Parks, Inc. (PSBpRO.CL)"
PSB_P_RP_CL,"PS Business Parks, Inc. (PSBpRP.CL)"
PSB_P_RTCL,"PS Business Parks, Inc. (PSBpRTCL)"
PSB_P_RU,"PS Business Parks, Inc. (PSBpRU)"
PSB_P_RV,"PS Business Parks, Inc. (PSBpRV)"
PSB_P_RW,"PS Business Parks, Inc. (PSBpRW)"
PSB_P_RX,"PS Business Parks, Inc. (PSBpRX)"
PSB_P_RY,"PS Business Parks, Inc. (PSBpRY)"
PSB_P_S_CL,"PS Business Parks, Inc. (PSBpS.CL)"
PSB_P_T,"PS Business Parks, Inc. (PSBpT)"
PSB_P_T_CL,"PS Business Parks, Inc. (PSBpT.CL)"
PSB_P_U,PS Business Parks Inc (PSBpU)
PSB_P_U_CL,"PS Business Parks, Inc. (PSBpU.CL)"
PSB_P_V,PS Business Parks Inc (PSBpV)
PSB_P_V_CL,"PS Business Parks, Inc. (PSBpV.CL)"
PSB_P_W,"PS Business Parks, Inc. (PSBpW)"
PSB_P_X,"PS Business Parks, Inc. (PSBpX)"
PSB_P_Y,"PS Business Parks, Inc. (PSBpY)"
PSB_P_Z,"PS Business Parks, Inc. (PSBpZ)"
PSC,Principal Exchange-Traded Funds (PSC)
PSCC,Invesco Capital Management LLC (PSCC)
PSCD,Invesco Capital Management LLC (PSCD)
PSCE,Invesco Capital Management LLC (PSCE)
PSCF,Invesco Capital Management LLC (PSCF)
PSCH,Invesco Capital Management LLC (PSCH)
PSCI,Invesco Capital Management LLC (PSCI)
PSCM,Invesco Capital Management LLC (PSCM)
PSCT,Invesco Capital Management LLC (PSCT)
PSCU,Invesco Capital Management LLC (PSCU)
PSD,"Puget Energy, Inc. (PSD)"
PSDO,Presidio Inc (PSDO)
PSE,Pioneer Southwest Energy Partners LP (PSE)
PSEC,Prospect Capital Corp (PSEC)
PSEP,Innovator ETFs Trust (PSEP)
PSET,Principal Exchange-Traded Funds (PSET)
PSF,Cohen & Steers Select Preferred and Income Fund Inc (PSF)
PSG,Performance Sports Group Ltd (PSG)
PSHG,Performance Shipping Inc (PSHG)
PSI,Invesco Capital Management LLC (PSI)
PSJ,Invesco Capital Management LLC (PSJ)
PSK,SPDR Series Trust (PSK)
PSL,Invesco Capital Management LLC (PSL)
PSLV,Sprott Physical Silver Trust (PSLV)
PSMB,Invesco Capital Management LLC (PSMB)
PSMC,Invesco Capital Management LLC (PSMC)
PSMG,Invesco Capital Management LLC (PSMG)
PSMM,Invesco Capital Management LLC (PSMM)
PSMT,Pricesmart Inc. (PSMT)
PSN,Parsons Corp (PSN)
PSNL,Personalis Inc (PSNL)
PSO,Pearson plc (PSO)
PSP,Invesco Capital Management LLC (PSP)
PSQ,ProShares Trust (PSQ)
PSR,Invesco Capital Management LLC (PSR)
PSS,Collective Brands Inc (PSS)
PST,Invesco Capital Management LLC (PST)
PSTG,Pure Storage Inc (PSTG)
PSTH,Pershing Square Tontine Holdings Ltd (PSTH)
PSTH_U,Pershing Square Tontine Holdings Ltd (PSTH.U)
PSTH_WS,Pershing Square Tontine Holdings Ltd (PSTH.WS)
PSTI,Pluristem Therapeutics Inc (PSTI)
PSTL,Postal Realty Trust Inc (PSTL)
PSTV,Plus Therapeutics Inc (PSTV)
PSTVZ,Plus Therapeutics Inc (PSTVZ)
PSTX,Poseida Therapeutics Inc (PSTX)
PSV,Hermitage Offshore Services Ltd (PSV)
PSW,BlackRock Credit Allocation Income Trust I Inc (PSW)
PSX,Phillips 66 (PSX)
PSXP,Phillips 66 Partners LP (PSXP)
PSXW_,Phillips 66 (PSXw_)
PSXW__1,Phillips 66 When Issued (PSXw_)
PSY,BlackRock Credit Allocation Income Trust II Inc (PSY)
PT,Pintec Technology Holdings Ltd (PT)
PT_1,PHarol SGPS SA (PT)
PTA,Penn Treaty American Corp. (PTA)
PTAC,PropTech Acquisition Corp (PTAC)
PTACU,PropTech Acquisition Corp (PTACU)
PTACW,PropTech Acquisition Corp (PTACW)
PTBD,Pacer Funds Trust (PTBD)
PTC,PTC Inc (PTC)
PTCT,PTC Therapeutics Inc (PTCT)
PTE,PolarityTE Inc (PTE)
PTEN,Patterson-UTI Energy Inc (PTEN)
PTEST,(PTEST)
PTEU,Pacer Funds Trust (PTEU)
PTF,Invesco Capital Management LLC (PTF)
PTGX,Protagonist Therapeutics Inc (PTGX)
PTH,Invesco Capital Management LLC (PTH)
PTHN,Patheon NV (PTHN)
PTHN_1,Patheon N.V. (PTHN)
PTI,Proteostasis Therapeutics Inc (PTI)
PTI_1,Patni Computer Systems (PTI)
PTIN,Pacer Funds Trust (PTIN)
PTK,PTK Acquisition Corp (PTK)
PTK_U,PTK Acquisition Corp (PTK.U)
PTK_WS,PTK Acquisition Corp (PTK.WS)
PTLA,Portola Pharmaceuticals Inc (PTLA)
PTLC,Pacer Funds Trust (PTLC)
PTM,E TRACS UBS Long Platinum (PTM)
PTM_1,UBS AG Jersey (PTM)
PTMC,Pacer Funds Trust (PTMC)
PTMN,Portman Ridge Finance Corp (PTMN)
PTN,Palatin Technologies Inc. (PTN)
PTNQ,Pacer Funds Trust (PTNQ)
PTNR,Partner Communications Co. (PTNR)
PTON,Peloton Interactive Inc (PTON)
PTP,Platinum Underwriters Holdings Ltd (PTP)
PTP_P_A_,Platinum Underwriters Holdings Ltd (PTPpA_)
PTR,PetroChina Co. Ltd. (PTR)
PTRS,Partners Bancorp (PTRS)
PTSI,"P.A.M. Transportation Services, Inc. (PTSI)"
PTV,Pactiv Corp. (PTV)
PTVCA,Protective Insurance Corp. (PTVCA)
PTVCB,Protective Insurance Corp. (PTVCB)
PTVE,Pactiv Evergreen Inc (PTVE)
PTX,Pernix Therapeutics Holdings Inc (PTX)
PTY,PIMCO Corporate & Income Opportunity Fund (PTY)
PUI,Invesco Capital Management LLC (PUI)
PUK,Prudential plc (PUK)
PUK_P,Prudential plc (PUKp)
PUK_P__,Prudential plc (PUKp_)
PUK_P_A,Prudential plc (PUKpA)
PUK_P_R,Prudential plc (PUKpR)
PUK_P_RA,Prudential plc (PUKpRA)
PULM,Pulmatrix Inc (PULM)
PULS,PGIM ETF Trust (PULS)
PUMP,ProPetro Holding Corp (PUMP)
PUTW,WisdomTree Trust (PUTW)
PUW,Invesco Capital Management LLC (PUW)
PUYI,Puyi Inc (PUYI)
PV,Pfeiffer Vacuum Technology AG (PV)
PVA,Penn Virginia Corp. (PVA)
PVAC,Penn Virginia Corp. (PVAC)
PVAL,Principal Exchange-Traded Funds (PVAL)
PVBC,Provident Bancorp Inc (PVBC)
PVBC_1,Provident Bancorp Inc. (PVBC)
PVD,Provida A.F.P. (PVD)
PVG,Pretium Resources Inc (PVG)
PVG_1,Penn Virginia GP Holdings LP (PVG)
PVH,PVH Corp (PVH)
PVI,Invesco Capital Management LLC (PVI)
PVL,Permianville Royalty Trust (PVL)
PVR,PVR Partners L.P. (PVR)
PVT,Pivotal Acquisition Corp (PVT)
PVTD,"Privatebancorp, Inc. (PVTD)"
PVTL_1,Pivotal Software Inc (PVTL)
PVT_U,Pivotal Acquisition Corp (PVT.U)
PVT_WS,Pivotal Acquisition Corp (PVT.WS)
PVX,Provident Energy Ltd (PVX)
PVX_1,Provident Energy Trust (PVX)
PW,Power REIT (PW)
PWB,Invesco Capital Management LLC (PWB)
PWC,Invesco Capital Management LLC (PWC)
PWE,Penn West Energy Trust (PWE)
PWFL,PowerFleet Inc (PWFL)
PWI,Primewest Energy Trust. (PWI)
PWOD,"Penns Woods Bancorp, Inc. (PWOD)"
PW_P_A,Power REIT (PWpA)
PWR,"Quanta Services, Inc. (PWR)"
PWS,Pacer Funds Trust (PWS)
PWV,Invesco Capital Management LLC (PWV)
PWZ,Invesco Capital Management LLC (PWZ)
PX,"Praxair, Inc. (PX)"
PXD,Pioneer Natural Resources Co. (PXD)
PXE,Invesco Capital Management LLC (PXE)
PXF,Invesco Capital Management LLC (PXF)
PXH,Invesco Capital Management LLC (PXH)
PXI,Invesco Capital Management LLC (PXI)
PXJ,Invesco Capital Management LLC (PXJ)
PXLG_1,Invesco Capital Management LLC (PXLG)
PXLV,Invesco S&P 500 Value with Momentum ETF (PXLV)
PXLW,Pixelworks Inc (PXLW)
PXMV,Invesco S&P MidCap Value with Momentum ETF (PXMV)
PXP,Plains Exploration & Production Co (PXP)
PXQ,Invesco Capital Management LLC (PXQ)
PXR,Invesco Capital Management LLC (PXR)
PXS,Pyxis Tankers Inc (PXS)
PXSAP,Pyxis Tankers Inc (PXSAP)
PXT,Argo Group International Holdings Ltd (PXT)
PXUS,Principal Exchange-Traded Funds (PXUS)
PY,Principal Exchange-Traded Funds (PY)
PYA,"Merrill Lynch Depositor, Inc. (PYA)"
PYB_CL,"Merrill Lynch Depositor, Inc. (PYB.CL)"
PYC,"Merrill Lynch Depositor, Inc. (PYC)"
PYC_CL,MERRILL LYNCH Depositor INC (PYC.CL)
PYD,(PYD)
PYD_1,"Pre-Paid Legal Services, Inc. (PYD)"
PYE_CL,"Merrill Lynch Depositor, Inc. (PYE.CL)"
PYG,"Merrill Lynch Depositor, Inc. (PYG)"
PYI,"Merrill Lynch Depositor, Inc. (PYI)"
PYJ,"Merrill Lynch Depositor, Inc. (PYJ)"
PYJ_CL,ML Deposit PPLUS Cl A 6.25% TRUCs CMT-1 Comcast (PYJ.CL)
PYK,"Merrill Lynch Depositor, Inc. (PYK)"
PYK_CL,MERRILL LYNCH Depositor INC (PYK.CL)
PYL,"Merrill Lynch Depositor, Inc. (PYL)"
PYM,(PYM)
PYM_1,(PYM)
PYM_2,Polymedica Corp. (PYM)
PYN,Pimco New York Municipal Income Fund III (PYN)
PYO_CL,"Merrill Lynch Depositor, Inc. (PYO.CL)"
PYPD,Polypid Ltd (PYPD)
PYPL,PayPal Holdings Inc (PYPL)
PYS,Pplus Trust Series RRD-1 (PYS)
PYT,PPLUS Trust Series GSC-2 (PYT)
PYV,"Merrill Lynch Depositor, Inc. (PYV)"
PYX,Pyxus International Inc (PYX)
PYX_1,Pyxus International Inc (PYX)
PYX_2,"Playtex Products, Inc. (PYX)"
PYY,"Merrill Lynch Depositor, Inc. (PYY)"
PYY_CL,MERRILL LYNCH Depositor (PYY.CL)
PYZ,Invesco Capital Management LLC (PYZ)
PZA,Invesco Capital Management LLC (PZA)
PZB_CL,"Merrill Lynch Depositor, Inc. (PZB.CL)"
PZC,Pimco California Municipal Income Fund III (PZC)
PZD,Invesco Capital Management LLC (PZD)
PZE,Petrobras Argentina S.A (PZE)
PZE_1,Petrobras Energia Participaciones S.A. (PZE)
PZG,Paramount Gold Nevada Corp (PZG)
PZI,Invesco Capital Management LLC (PZI)
PZN,Pzena Investment Management Inc (PZN)
PZT,Invesco Capital Management LLC (PZT)
PZZA,"Papa John`s International, Inc. (PZZA)"
Q,"Qwest Communications International, Inc. (Q)"
Q_1,IQVIA Holdings Inc (Q)
QABA,First Trust Exchange-Traded Fund III (QABA)
QADA,"QAD, Inc. (QADA)"
QADB,"QAD, Inc. (QADB)"
QAI,IndexIQ ETF Trust (QAI)
QARP,DBX ETF Trust (QARP)
QAT,BlackRock Institutional Trust Company N.A. (QAT)
QBAK,Qualstar Corp (QBAK)
QCAN,SPDR Solactive Canada ETF (QCAN)
QCLN,First Trust Exchange-Traded Fund III (QCLN)
QCOM,"Qualcomm, Inc. (QCOM)"
QCP,Quality Care Properties Inc (QCP)
QCRH,"QCR Holding, Inc. (QCRH)"
QD,Qudian Inc (QD)
QD_1,Quadramed Corp. (QD)
QDEF,FlexShares Trust (QDEF)
QDEL,Quidel Corp. (QDEL)
QDEU,SPDR Solactive Germany ETF (QDEU)
QDF,FlexShares Trust (QDF)
QDIV,Global X Funds (QDIV)
QDYN,FlexShares Trust (QDYN)
QED,IndexIQ ETF Trust (QED)
QEFA,SSgA Active Trust (QEFA)
QELLU,Qell Acquisition Corp (QELLU)
QEMM,SSgA Active Trust (QEMM)
QEP,QEP Resources Inc (QEP)
QEPM,QEP Midstream Partners LP (QEPM)
QEPW_,0 (QEPw_)
QES,Quintana Energy Services Inc (QES)
QFIN,360 DigiTech Inc (QFIN)
QGBR,SPDR Solactive United Kingdom ETF (QGBR)
QGEN,Qiagen NV (QGEN)
QGRO,American Century ETF Trust (QGRO)
QGTA,IndexIQ ETF Trust (QGTA)
QH,Quhuo Ltd (QH)
QHC,Quorum Health Corp (QHC)
QHCW,Quorum Health Corporation (QHCw)
QI,Qimonda AG (QI)
QID,ProShares Trust (QID)
QIHU,Qihoo 360 Technology Co Ltd (QIHU)
QINC,First Trust VI First Trust Dorsey Wright Momentum and Div ETF (QINC)
QINT,American Century ETF Trust (QINT)
QIWI,QIWI plc (QIWI)
QJPN,SPDR Solactive Japan ETF (QJPN)
QK,Q&K International Group Ltd (QK)
QLC,FlexShares Trust (QLC)
QLD,ProShares Trust (QLD)
QLGN,Qualigen Therapeutics Inc (QLGN)
QLS,IndexIQ ETF Trust (QLS)
QLTA,BlackRock Institutional Trust Company N.A. (QLTA)
QLV,FlexShares Trust (QLV)
QLVD,FlexShares Trust (QLVD)
QLVE,FlexShares Trust (QLVE)
QLYS,Qualys Inc (QLYS)
QMCO,Quantum Corp (QMCO)
QMN,IndexIQ ETF Trust (QMN)
QMOM,Alpha Architect Etf Trust (QMOM)
QNST,QuinStreet Inc (QNST)
QQEW,First Trust Exchange-Traded Fund III (QQEW)
QQH,Northern Lights Fund Trust III (QQH)
QQQ,Invesco Capital Management LLC (QQQ)
QQQE,Direxion Shares ETF Trust (QQQE)
QQQJ,Invesco Exchange-Traded Fund Trust II (QQQJ)
QQQM,Invesco Exchange-Traded Fund Trust II (QQQM)
QQQN,Victory Portfolios II (QQQN)
QQQX,Nuveen NASDAQ 100 Dynamic Overwrite Fund (QQQX)
QQXT,First Trust Exchange-Traded Fund III (QQXT)
QRE,QR Energy LP (QRE)
QRFT,Exchange Listed Funds Trust (QRFT)
QRHC,Quest Resource Holding Corp (QRHC)
QRR,Quadra Realty Trust Inc. (QRR)
QRTEA,Qurate Retail Inc (QRTEA)
QRTEB,Qurate Retail Inc (QRTEB)
QRTEP,Qurate Retail Inc (QRTEP)
QRTEV,Qurate Retail Inc (QRTEV)
QRVO,Qorvo Inc (QRVO)
QSR,Restaurant Brands International Inc (QSR)
QSRW,Restaurant Brands International Inc (QSRw)
QSY,WisdomTree Trust (QSY)
QTEC,First Trust Exchange-Traded Fund III (QTEC)
QTM,Quantum Corp (QTM)
QTM_1,Quantum Dlt & Storage Systems Group (QTM)
QTNA,Quantenna Communications Inc (QTNA)
QTNT,Quotient Ltd (QTNT)
QTRH,Quarterhill Inc (QTRH)
QTRX,Quanterix Corp (QTRX)
QTS,Qts Realty Trust Inc (QTS)
QTS_P_A,Qts Realty Trust Inc (QTSpA)
QTS_P_B,Qts Realty Trust Inc (QTSpB)
QTT,Qutoutiao Inc (QTT)
QTUM,ETF Series Solutions Trust (QTUM)
QTWO,Q2 Holdings Inc (QTWO)
QUAD,Quad/Graphics Inc (QUAD)
QUAD_1,Quadrex Corp (QUAD)
QUAL,BlackRock Institutional Trust Company N.A. (QUAL)
QUIK,Quicklogic Corp (QUIK)
QUMU,Qumu Corp (QUMU)
QUOT,Quotient Technology Inc (QUOT)
QUOT_1,Life Quotes Inc (QUOT)
QURE,uniQure N.V. (QURE)
QUS,SPDR Series Trust (QUS)
QVAL,Alpha Architect Etf Trust (QVAL)
QVCC,QVC Inc (QVCC)
QVCD,QVC Inc (QVCD)
QVM,Arrow Investments Trust (QVM)
QWLD,SSgA Active Trust (QWLD)
QXGG,Blue Sky Asset Management LLC (QXGG)
QXM,Qiao Xing Mobile Communication Co Ltd (QXM)
QXMI,Blue Sky Asset Management LLC (QXMI)
QXRR,Blue Sky Asset Management LLC (QXRR)
QXTR,Blue Sky Asset Management LLC (QXTR)
QYLD,Global X Funds (QYLD)
QYLD_2,Horizons ETF Trust I (QYLD)
R,"Ryder System, Inc. (R)"
RA,Brookfield Real Assets Income Fund Inc (RA)
RA_1,Reckson Associates Realty Corp. (RA)
RA_2,Reckson Associates Realty Corp. (RA)
RAAX,VanEck Vectors ETF Trust (RAAX)
RACA,Therapeutics Acquisition Corp (RACA)
RACE,Ferrari N.V. (RACE)
RACE_1,"Data Race, Inc. (RACE)"
RACEW,Ferrari NV (RACEw)
RAD,Rite Aid Corp. (RAD)
RADA,Rada Electronic Industries (RADA)
RADI,Radius Global Infrastructure Inc (RADI)
RAFE,Pimco Equity Series (RAFE)
RAH,"Ralcorp Holdings, Inc. (RAH)"
RAHW_,Ralcorp Holdings Inc When Issued (RAHw_)
RAHW__2,(RAHw_)
RAI_1,Reynolds American Inc. (RAI)
RAIL,FreightCar America Inc (RAIL)
RALS,ProShares Trust (RALS)
RALY,Rally Software Development Corp (RALY)
RAMP,LiveRamp Holdings Inc (RAMP)
RAND,Rand Capital Corp. (RAND)
RAPT,RAPT Therapeutics Inc (RAPT)
RARE,Ultragenyx Pharmaceutical Inc. (RARE)
RARX,Ra Pharmaceuticals Inc (RARX)
RAS,RAIT Financial Trust (RAS)
RAS_1,Resource Asset Investment Trust (RAS)
RAS_P_A,RAIT Financial Trust (RASpA)
RAS_P_B,RAIT Financial Trust (RASpB)
RAS_P_C,RAIT Financial Trust (RASpC)
RAS_P_RA,RAIT Financial Trust (RASpRA)
RAS_P_RB,RAIT Financial Trust (RASpRB)
RAS_P_RC,RAIT Financial Trust (RASpRC)
RATE,Bankrate Inc. (RATE)
RAVE,Rave Restaurant Group Inc (RAVE)
RAVI,FlexShares Trust (RAVI)
RAVN,"Raven Industries, Inc. (RAVN)"
RAX,Rackspace Hosting Inc (RAX)
RBA,Ritchie Bros Auctioneers Inc (RBA)
RBAC,RedBall Acquisition Corp (RBAC)
RBAC_U,RedBall Acquisition Corp (RBAC.U)
RBAC_WS,RedBall Acquisition Corp (RBAC.WS)
RBB,RBB Bancorp (RBB)
RBBN,Ribbon Communications Inc (RBBN)
RBC,Regal Beloit Corp (RBC)
RBCAA,"Republic Bancorp, Inc. (KY) (RBCAA)"
RBCN,Rubicon Technology Inc (RBCN)
RBIN,ETF Series Solutions Trust (RBIN)
RBKB,Rhinebeck Bancorp Inc (RBKB)
RBN,"Robbins & Myers, Inc. (RBN)"
RBNC,Reliant Bancorp Inc (RBNC)
RBS,NatWest Group Plc (RBS)
RBS_P_E_CL,RBS Capital Funding Trust V (RBSpE.CL)
RBS_P_F_CL,Royal Bank of Scotland Group plc (RBSpF.CL)
RBS_P_G_CL,RBS Capital Funding Trust VII (RBSpG.CL)
RBS_P_H_CL,Royal Bank of Scotland Group plc (RBSpH.CL)
RBS_P_I_CL,RBS Capital Funding Trust VI (RBSpI.CL)
RBS_P_K_CL,(RBSpK.CL)
RBS_P_L_CL,Royal Bank of Scotland Group plc (RBSpL.CL)
RBS_P_M_CL,Royal Bank of Scotland Group plc (RBSpM.CL)
RBS_P_N_CL,Royal Bank of Scotland Group plc (RBSpN.CL)
RBS_P_P_CL,Royal Bank of Scotland Group plc (RBSpP.CL)
RBS_P_Q_CL,Royal Bank of Scotland Group plc (RBSpQ.CL)
RBS_P_R_CL,Royal Bank of Scotland Group plc (RBSpR.CL)
RBS_P_S,Royal Bank of Scotland Group plc (RBSpS)
RBS_P_S_CL,Royal Bank of Scotland Group plc (RBSpS.CL)
RBS_P_T_CL,Royal Bank of Scotland Group plc (RBSpT.CL)
RBSW,(RBSw)
RBUS,ETF Series Solutions Trust (RBUS)
RBV,CBS Corp. (RBV)
RBV_CL,CBS Corp. (RBV.CL)
RBZ,Reebonz Holding Limited (RBZ)
RBZAW,Reebonz Holding Limited (RBZAW)
RC,Ready Capital Corp (RC)
RCA,Ready Capital Corp (RCA)
RCAP,RCS Capital Corporation (RCAP)
RCB,Ready Capital Corp (RCB)
RCC,"Small Cap Premium & Dividend Income Fund, Inc. (RCC)"
RCD,Invesco Capital Management LLC (RCD)
RCEL,Avita Therapeutics Inc (RCEL)
RCEL_1,Avita Medical Limited (RCEL)
RCG,RENN Fund Inc (RCG)
RCHGU,Recharge Acquisition Corp (RCHGU)
RCI,Rogers Communications Inc. (RCI)
RCII,Rent-a-Center Inc. (RCII)
RCKT,Rocket Pharmaceuticals Inc (RCKT)
RCKY,"Rocky Brands, Inc (RCKY)"
RCL,Royal Caribbean Group (RCL)
RCM,R1 RCM Inc (RCM)
RCMT,"RCM Technologies, Inc. (RCMT)"
RCON,Recon Technology Ltd (RCON)
RCP,Ready Capital Corp (RCP)
RCS,PIMCO Strategic Income Fund Inc (RCS)
RCUS,Arcus Biosciences Inc (RCUS)
RDA,"Reader`s Digest Association, Inc. (RDA)"
RDC_1,Rowan Companies plc (RDC)
RDC_2,Rowan Companies plc (RDC)
RDCM,Radcom (RDCM)
RDFN,Redfin Corp (RDFN)
RDHL,Redhill Biopharma (RDHL)
RDI,Reading International Inc (RDI)
RDIB,Reading International Inc (RDIB)
RDIV,Invesco Exchange-Traded Fund Trust II (RDIV)
RDIV_1,Oppenheimer Revenue Weighted ETF Trust (RDIV)
RDN,"Radian Group, Inc. (RDN)"
RDNT,Radnet Inc (RDNT)
RDOG,ALPS Fund Services (RDOG)
RDSA,Royal Dutch Shell Plc (RDSA)
RDS_A,Royal Dutch Shell Plc (RDS.A)
RDSB,Royal Dutch Shell Plc (RDSB)
RDS_B,Royal Dutch Shell Plc (RDS.B)
RDUS,Radius Health Inc. (RDUS)
RDVT,Red Violet Inc (RDVT)
RDVY,First Trust Exchange-Traded Fund III (RDVY)
RDWR,Radware (RDWR)
RDY,Dr. Reddy`s Laboratories Ltd. (RDY)
RE,Everest Re Group Ltd (RE)
REAL,Therealreal Inc (REAL)
REDU,RISE Education Cayman Ltd (REDU)
REDV,Invesco Exchange-Traded Fund Trust II (REDV)
REDV_1,Oppenheimer Revenue Weighted ETF Trust (REDV)
REED,Reeds Inc (REED)
REEM,Invesco Exchange-Traded Fund Trust II (REEM)
REEM_1,Oppenheimer Revenue Weighted ETF Trust (REEM)
REET,BlackRock Institutional Trust Company N.A. (REET)
REFA,Invesco Exchange-Traded Fund Trust II (REFA)
REFA_1,Oppenheimer Revenue Weighted ETF Trust (REFA)
REFR,Research Frontiers Inc. (REFR)
REG,Regency Centers Corporation (REG)
REGI,Renewable Energy Group Inc (REGI)
