ticker,issuer_name
A,Agilent Technologies Inc. (A)
AA,Alcoa Corp (AA)
AA_1,Arconic Inc (AA)
AAA,Listed Funds Trust (AAA)
AAA_1,Altana AG (AAA)
AAAU,Perth Mint Physical Gold ETF (AAAU)
AABA,Altaba Inc (AABA)
AAC,AAC Holdings Inc (AAC)
AAC_1,Hongli Clean Energy Technologies Corp (AAC)
AAC_2,Australia Acquisition Corp (AAC)
AACG,ATA Creativity Global (AACG)
AACQ,Artius Acquisition Inc (AACQ)
AACQU,Artius Acquisition Inc (AACQU)
AACQW,Artius Acquisition Inc (AACQW)
AADR,Advisorshares Trust (AADR)
AAI,Airtran Holdings Inc. (AAI)
AAL,American Airlines Group Inc (AAL)
AAMC,Altisource Asset Management Corp (AAMC)
AAME,Atlantic American Corp. (AAME)
AAN,Aarons Holdings Company Inc (AAN)
AAN_1,Aaron`s Inc (AAN)
AAN_2,Aaron`s Inc (AAN)
AAOI,Applied Optoelectronics Inc (AAOI)
AAON,AAON Inc. (AAON)
AAP,Advance Auto Parts Inc (AAP)
AA_P,Arconic Inc (AAp)
AAPL,Apple Inc (AAPL)
AAR,AMR Corp. (AAR)
AAT,American Assets Trust Inc (AAT)
AAU,Almaden Minerals Ltd (AAU)
AAV,Advantage Oil & Gas Ltd. (AAV)
AAV_1,Advantage Energy Income Fund (AAV)
AAWW,Atlas Air Worldwide Holdings Inc. (AAWW)
AAXJ,BlackRock Institutional Trust Company N.A. (AAXJ)
AAXN,Axon Enterprise Inc (AAXN)
AB,AllianceBernstein Holding Lp (AB)
ABA,ALABAMA POWER CO. SERIES JJ 6.375% SR N (ABA)
ABA_1,ALABAMA POWER COMPANY SR NOTES 6.375 SE (ABA)
ABA_2,ALABAMA POWER COMPANY (ABA)
ABA_3,ALABAMA POWER COERIES JJ 6.375% SR NOTE (ABA)
ABA_5,ALABAMA POWER CO. SERIES JJ 6.375% SR. (ABA)
ABA_6,ALABAMA POWER CO (ABA)
ABA_7,(ABA)
ABA_8,(ABA)
ABA_9,Alba SE (ABA)
ABA_CL,ALABAMA POWER CO. SERIES JJ 6.375% SR N (ABA.CL)
ABA_CL_1,ALABAMA POWER CO (ABA.CL)
ABAX,Abaxis Inc. (ABAX)
ABB,ABB Ltd. (ABB)
ABBV,Abbvie Inc (ABBV)
ABBVW_,AbbVie Inc (ABBVw_)
ABBVW__1,Abbvie Inc (ABBVw_)
ABC,Amerisource Bergen Corp. (ABC)
ABCB,Ameris Bancorp (ABCB)
ABCD,Cambium Learning Group Inc (ABCD)
ABCW,Anchor Bancorp Wisconsin Inc. (ABCw)
ABDC,Alcentra Capital Corp (ABDC)
ABE,Aberdeen Emerging Markets Smaller Company Opportunities Fund Inc (ABE)
ABEO,Abeona Therapeutics Inc (ABEO)
ABEOW,Abeona Therapeutics Inc (ABEOW)
ABEQ,Unified Series Trust (ABEQ)
ABEV,Ambev S.A. (ABEV)
ABG,Asbury Automotive Group Inc (ABG)
ABH,Resolute Forest Products Inc (ABH)
ABHW_,(ABHw_)
ABI,Applied Biosystems Inc (ABI)
ABIL,Ability Inc (ABIL)
ABIO,ARCA biopharma Inc (ABIO)
ABK,AMBAC Financial Group Inc. (ABK)
ABK_P_Z_,AMBAC Financial Group Inc. (ABKpZ_)
ABLX,Ablynx (ABLX)
ABM,ABM Industries Inc. (ABM)
ABMD,Abiomed Inc. (ABMD)
ABN,RBS Holdings NV (ABN)
ABN_P_E_,RBS Capital Funding Trust V (ABNpE_)
ABN_P_F_,RBS Capital Funding Trust VI (ABNpF_)
ABN_P_G_,RBS Capital Funding Trust VII (ABNpG_)
ABR,Arbor Realty Trust Inc. (ABR)
ABR_1,Atlantic Premium Brands Ltd. (ABR)
ABRN,Arbor Realty Trust Inc. (ABRN)
ABRN_CL,Arbor Realty Trust Inc (ABRN.CL)
ABR_P_A,Arbor Realty Trust Inc. (ABRpA)
ABR_P_B,Arbor Realty Trust Inc. (ABRpB)
ABR_P_C,Arbor Realty Trust Inc. (ABRpC)
ABR_P_RA,Arbor Realty Trust Inc. (ABRpRA)
ABR_P_RB,Arbor Realty Trust Inc. (ABRpRB)
ABR_P_RC,Arbor Realty Trust Inc. (ABRpRC)
ABS_P,(ABSp)
ABS_P__,(ABSp_)
ABT,Abbott Laboratories (ABT)
ABTW_,Abbott Laboratories (ABTw_)
ABTX,Allegiance Bancshares Inc (ABTX)
ABUS,Arbutus Biopharma Corp (ABUS)
ABV,Companhia De Bebidas Das Americas (ABV)
ABV_C,Companhia De Bebidas Das Americas (ABV.C)
ABVT,Abovenet Inc (ABVT)
ABW_P_RA_,ASBC Capital I (ABWpRA_)
ABY,Abitibi Consolidated Inc. (ABY)
AC,Associated Capital Group Inc (AC)
ACA,Arcosa Inc (ACA)
ACA_1,Manifold Capital Corp (ACA)
ACAD,Acadia Pharmaceuticals Inc (ACAD)
ACAM,Acamar Partners Acquisition Corp (ACAM)
ACAMU,Acamar Partners Acquisition Corp (ACAMU)
ACAMW,Acamar Partners Acquisition Corp (ACAMW)
ACB,Aurora Cannabis Inc (ACB)
ACBI,Atlantic Capital Bancshares Inc (ACBI)
ACC,American Campus Communities Inc. (ACC)
ACCD,Accolade Inc (ACCD)
ACCO,Acco Brands Corporation (ACCO)
ACCO_1,800 America.com Inc (ACCO)
ACCOW_,ACCO Brands (ACCOw_)
ACEL,Accel Entertainment Inc (ACEL)
ACEL_WS,Accel Entertainment Inc (ACEL.WS)
ACE_P_C,ACE LTD DEP SH PFD C (ACEpC)
ACE_P_C_,(ACEpC_)
ACE_P_C_1,(ACEpC)
ACE_P_C_CL,(ACEpC.CL)
ACER,Acer Therapeutics Inc (ACER)
ACES,ALPS Fund Services (ACES)
ACET,Adicet Bio Inc (ACET)
ACET_1,Aceto Corp. (ACET)
ACEV,ACE Convergence Acquisition Corp (ACEV)
ACEVU,ACE Convergence Acquisition Corp (ACEVU)
ACEVW,ACE Convergence Acquisition Corp (ACEVW)
ACF,Americredit Corp. (ACF)
ACFC,Atlantic Coast Financial Corp (ACFC)
ACG,AllianceBernstein Income Fund Inc (ACG)
ACGL,Arch Capital Group Ltd (ACGL)
ACGLO,Arch Capital Group Ltd (ACGLO)
ACGLP,Arch Capital Group Ltd (ACGLP)
ACH,Aluminum Corporation Of China Limited. (ACH)
ACHC,Acadia Healthcare Company Inc (ACHC)
ACHN,Achillion Pharmaceuticals (ACHN)
ACHV,Achieve Life Sciences Inc. (ACHV)
ACI,Albertsons Companies Inc (ACI)
ACIA,Acacia Communications Inc (ACIA)
ACIO,ETF Series Solutions Trust (ACIO)
ACIU,AC Immune SA (ACIU)
ACIW,ACI Worldwide Inc (ACIW)
ACL,Alcon Inc (ACL)
ACLS,Axcelis Technologies Inc (ACLS)
ACM,AECOM (ACM)
ACMR,ACM Research Inc (ACMR)
ACMW_R,Aecom Technology Corporation (ACMw_r)
ACN,Accenture plc (ACN)
ACNB,ACNB Corp. (ACNB)
ACND,Ascendant Digital Acquisition Corp (ACND)
ACND_U,Ascendant Digital Acquisition Corp (ACND.U)
ACND_WS,Ascendant Digital Acquisition Corp (ACND.WS)
ACO,Amcol International Corp. (ACO)
ACOR,Acorda Therapeutics Inc (ACOR)
ACP,Aberdeen Income Credit Strategies Fund (ACP)
ACP_P__,(ACPp_)
ACPR,Aberdeen Income Credit Strategies Fund (ACPr)
ACPR_,Avenue Income Credit Strategies Fund (ACPr_)
ACPR__1,Icahn Enterprises L P (ACPr_)
ACRE,Ares Commercial Real Estate Corp (ACRE)
ACRS,Aclaris Therapeutics Inc (ACRS)
ACRX,Acelrx Pharmaceuticals Inc (ACRX)
ACS,Affiliated Computer Services Inc. (ACS)
ACSF,American Capital Senior Floating Ltd (ACSF)
ACSG,DBX ETF Trust (ACSG)
ACSI,ETF Series Solutions Trust (ACSI)
ACST,Acasti Pharma Inc (ACST)
ACT,Advisorshares Trust (ACT)
ACTCU,ArcLight Clean Transition Corp (ACTCU)
ACTG,Acacia Research Corp (ACTG)
ACTTU,Act II Global Acquisition Corp (ACTTU)
ACTV,Active Network Inc (ACTV)
ACTW,ACTAVIS PLC (NEW) (ACTw)
ACU,Acme United Corp. (ACU)
ACV,AllianzGI Diversified Income & Convertible Fund (ACV)
ACV_1,Alberto-Culver Co. (ACV)
ACV_2,Alberto-Culver Co. (ACV)
ACW,Accuride Corp (ACW)
ACW_1,Accuride Corp (ACW)
AC_WD,Associated Capital Group Inc (AC.WD)
ACWF,BlackRock Institutional Trust Company N.A. (ACWF)
ACWI,BlackRock Institutional Trust Company N.A. (ACWI)
ACWV,BlackRock Institutional Trust Company N.A. (ACWV)
ACWX,BlackRock Institutional Trust Company N.A. (ACWX)
ACXM,Acxiom Corp. (ACXM)
ACXM_1,Acxiom Corp. (ACXM)
ACY,Aerocentury Corp. (ACY)
AD,ADVO Inc. (AD)
ADAP,Adaptimmune Therapeutics Plc (ADAP)
ADBE,Adobe Inc (ADBE)
ADC,Agree Realty Corp. (ADC)
ADCT,Adc Therapeutics SA (ADCT)
ADES,Advanced Emissions Solutions Inc (ADES)
ADF,ACM Managed Dollar Income Fund Inc (ADF)
ADI,Analog Devices Inc. (ADI)
ADIL,Adial Pharmaceuticals Inc (ADIL)
ADILW,Adial Pharmaceuticals Inc (ADILW)
ADM,Archer Daniels Midland Co. (ADM)
ADMA,Adma Biologics Inc (ADMA)
ADME,ETF Series Solutions Trust (ADME)
ADMP,Adamis Pharmaceuticals Corp (ADMP)
ADM_P_A_,Archer Daniels Midland Co. (ADMpA_)
ADMS,Adamas Pharmaceuticals Inc (ADMS)
ADNT,Adient plc (ADNT)
ADO,Adecco SA (ADO)
ADOM,ADOMANI Inc. (ADOM)
ADP,Automatic Data Processing Inc. (ADP)
ADPT,Adaptive Biotechnologies Corp (ADPT)
ADPT_1,Adeptus Health Inc (ADPT)
ADPW,(ADPw)
ADRA,Invesco Capital Management LLC (ADRA)
ADRD,Invesco Capital Management LLC (ADRD)
ADRE,Invesco Capital Management LLC (ADRE)
ADRO,Aduro Biotech Inc (ADRO)
ADRU,Invesco Capital Management LLC (ADRU)
ADS,Alliance Data System (ADS)
ADSK,Autodesk Inc. (ADSK)
ADSW,Advanced Disposal Services Inc (ADSW)
ADT,ADT Inc (ADT)
ADT_1,ADT Corporation (ADT)
ADTN,Adtran Inc. (ADTN)
ADTW_,ADT Corporation (ADTw_)
ADTX,Aditx Therapeutics Inc (ADTX)
ADUS,Addus HomeCare Corporation (ADUS)
ADVM,Adverum Biotechnologies Inc (ADVM)
ADX,Adams Diversified Equity Fund (ADX)
ADXN,Addex Therapeutics Ltd (ADXN)
ADXS,"Advaxis, Inc. (ADXS)"
ADXSW,"Advaxis, Inc. (ADXSW)"
ADY,Feihe International Inc (ADY)
ADYX,Adynxx Inc (ADYX)
ADZ,Deutsche Bank AG London (ADZ)
AE,Adams Resources & Energy Inc. (AE)
AEA,Advance Amer Cash Advance Ctrs Inc (AEA)
AEB,Aegon N. V. (AEB)
AEC,Associated Estates Realty Corp. (AEC)
AEC_P_B_CL,Associated Estates Realty Corp. (AECpB.CL)
AED,Aegon N. V. (AED)
AED_CL,Aegon NV (AED.CL)
AEE,Ameren Corp. (AEE)
AEF,Aberdeen Emerging Markets Equity Income Fund Inc (AEF)
AEFC,Aegon Funding Company LLC (AEFC)
AEF_CL,AEGON N.V. (AEF.CL)
AEG,Aegon N. V. (AEG)
AEGN,Aegion Corp (AEGN)
AEH,Aegon N. V. (AEH)
AEH_CL,Aegon NV (AEH.CL)
AEHL,Antelope Enterprise Holdings Ltd (AEHL)
AEHR,Aehr Test Systems (AEHR)
AEIS,Advanced Energy Industries Inc. (AEIS)
AEK,Aegon N. V. (AEK)
AEK_CL,AEGON NV (AEK.CL)
AEL,American Equity Investment Life Holding Co (AEL)
AEL_P_A,American Equity Investment Life Holding Co (AELpA)
AEL_P_B,American Equity Investment Life Holding Co (AELpB)
AEM,Agnico Eagle Mines Ltd (AEM)
AEMD,Aethlon Medical Inc (AEMD)
AEO,American Eagle Outfitters Inc. (AEO)
AEP,American Electric Power Company Inc. (AEP)
AEP_P_A_,AMERICAN ELECTRIC POWER CO. 8.75% JR SU (AEPpA_)
AEP_P_A__10,AMERICAN ELECTRIC POWER COMPANY INC 8. (AEPpA_)
AEP_P_A__12,(AEPpA_)
AEP_P_A__2,AMERICAN ELECTRIC POWER CO. 8.75% JR SU (AEPpA_)
AEP_P_A__3,AMERICAN ELECTRIC POWER COMPANY INC8.75 (AEPpA_)
AEP_P_A__5,AMERICAN ELECTRIC POWER CO.75% JR SUB D (AEPpA_)
AEP_P_A__7,AMERICAN ELECTRIC POWER COMPANY INC 8.7 (AEPpA_)
AEP_P_A__8,AMERICAN ELECTRIC POWER COMPANY INC. (AEPpA_)
AEP_P_A__9,AMERICAN ELECTRIC POWER CO INC (AEPpA_)
AEP_P_B_1,American Electric Power Company Inc. (AEPpB)
AEP_P_C,American Electric Power Company Inc. (AEPpC)
AEPPL,American Electric Power Company Inc. (AEPPL)
AEP_P_RA_,American Electric Power Co 8.75% Jr Sub Deb 2063 (AEPpRA_)
AEP_P_RA__1,American Electric Power Company Inc 8.75% Junior Sub Deb Due (AEPpRA_)
AEP_P_RA__2,American Electric Power Co 8.75% Jr Sub (AEPpRA_)
AEP_P_RA__3,American Electric Power Company Inc 8.7 (AEPpRA_)
AEP_P_RA__4,AMERICAN ELECTRIC POWER CO 8.75% JR SUB (AEPpRA_)
AEP_P_RA__5,AMERICAN ELECTRIC POWER CO. 8.75% JR SU (AEPpRA_)
AEP_P_RA__6,AMERICAN ELECTRIC POWER COMPANY INC8.75 (AEPpRA_)
AEP_P_RA__7,AMERICAN ELECTRIC POWER COMPANY (AEPpRA_)
AEPPZ,American Electric Power Company Inc. (AEPPZ)
AER,Aercap Holdings N.V. (AER)
AER_1,Aegis Realty Inc. (AER)
AERI,Aerie Pharmaceuticals Inc (AERI)
AES,AES Corp. (AES)
AESE,Allied Esports Entertainment Inc (AESE)
AESEW,Allied Esports Entertainment Inc (AESEW)
AES_P_C_,AES Trust III (AESpC_)
AES_P_C_CL,AES Trust III (AESpC.CL)
AES_P_RC_,AES Trust III (AESpRC_)
AESR,Two Roads Shared Trust (AESR)
AET,Aetna Inc. (AET)
AEUA,Anadarko Petroleum Corp. (AEUA)
AEV,Aegon N. V. (AEV)
AEV_CL,AEGON N.V. (AEV.CL)
AEV_CL_1,Aegon NV (AEV.CL)
AEY,Addvantage Technologies Group (AEY)
AEYE,AudioEye Inc (AEYE)
AEZS,Aeterna Zentaris Inc. (AEZS)
AF,Astoria Financial Corp. (AF)
AFA,American Financial Group Inc (AFA)
AFA_CL,American Financial Group Inc (AFA.CL)
AFB,AllianceBernstein National Municipal Income Fund Inc (AFB)
AFC,Allied Capital Corp. (AFC)
AFC_1,Allied Capital Corp. (AFC)
AFE,American Financial Group Inc (AFE)
AFE_CL,American Financial Group Inc 7.125% Sr Deb 2034 (AFE.CL)
AFE_CL_1,American Financial Group (AFE.CL)
AFF,American International Group Inc (AFF)
AFF_CL,American International Group Inc 6.45% Series A-4 Junior Sub. Debt (AFF.CL)
AFG,American Financial Group Inc (AFG)
AFGB,American Financial Group Inc (AFGB)
AFGC,American Financial Group Inc (AFGC)
AFGD,American Financial Group Inc (AFGD)
AFGE,American Financial Group Inc (AFGE)
AFGE_1,American Financial Group Inc (AFGE)
AFGE_CL,American Financial Group Inc (AFGE.CL)
AFGH,American Financial Group Inc (AFGH)
AFGH_1,American Financial Group Inc (AFGH)
AFH,Atlas Financial Holdings Inc (AFH)
AFHBL,Atlas Financial Holdings Inc (AFHBL)
AFI,Armstrong Flooring Inc (AFI)
AFIB,Acutus Medical Inc (AFIB)
AFIF,Two Roads Shared Trust (AFIF)
AFIN,American Fin Tr Inc (AFIN)
AFINP,American Fin Tr Inc (AFINP)
AFIW,Armstrong Flooring Inc (AFIw)
AFK,VanEck Vectors ETF Trust (AFK)
AFL,Aflac Inc. (AFL)
AFM,Affiliated Managers Group Inc. (AFM)
AFM_CL,Affiliated Managers Group Inc (AFM.CL)
AFMD,Affimed N.V. (AFMD)
AFN,Institutional Financial Markets Inc (AFN)
AF_P_C,Astoria Financial Corp. (AFpC)
AFQ,American Financial Group Inc (AFQ)
AFQ_CL,American Financial Group Inc (AFQ.CL)
AFR,American Financial Realty Trust (AFR)
AFSD,Aflac Inc. (AFSD)
AFSI,AmTrust Financial Services Inc (AFSI)
AFSI_P_A,AmTrust Financial Services Inc (AFSIpA)
AFSI_P_B,AmTrust Financial Services Inc (AFSIpB)
AFSI_P_C,AmTrust Financial Services Inc (AFSIpC)
AFSI_P_D,AmTrust Financial Services Inc (AFSIpD)
AFSI_P_E,AmTrust Financial Services Inc (AFSIpE)
AFSI_P_F,AmTrust Financial Services Inc (AFSIpF)
AFSI_P_RA,Amtrust Financial Service (AFSIpRA)
AFSI_P_RC,Amtrust Financial Service (AFSIpRC)
AFSI_P_RE,Amtrust Financial Service (AFSIpRE)
AFSI_P_RF,Amtrust Financial Service (AFSIpRF)
AFSS,AmTrust Financial Services Inc (AFSS)
AFST,AmTrust Financial Services Inc (AFST)
AFT,Apollo Senior Floating Rate Fund Inc (AFT)
AFT_1,"Axesstel, Inc. (AFT)"
AFTY,CSOP Asset Management Limited (AFTY)
AFW,American Financial Group Inc (AFW)
AFW_CL,American Financial Group Inc (AFW.CL)
AFYA,Afya Ltd (AFYA)
AG,First Majestic Silver Corporation (AG)
AGBA,Agba Acquisition Ltd (AGBA)
AGBAR,Agba Acquisition Ltd (AGBAR)
AGBAU,Agba Acquisition Ltd (AGBAU)
AGBAW,Agba Acquisition Ltd (AGBAW)
AGC,Advent Claymore Convertible Securities & Income Fund II (AGC)
AGC_1,American General Corp. (AGC)
AGCO,AGCO Corp. (AGCO)
AGCUU,Altimeter Growth Corp (AGCUU)
AGD,Aberdeen Global Dynamic Dividend Fund (AGD)
AGD_1,Applied Graphics Technologies Inc. (AGD)
AGE,AgeX Therapeutics Inc (AGE)
AGEN,Agenus Inc (AGEN)
AGF_1,Deutsche Bank AG London (AGF)
AGFS,AgroFresh Solutions Inc (AGFS)
AGFSW,AgroFresh Solutions Inc (AGFSW)
AGG,BlackRock Institutional Trust Company N.A. (AGG)
AGGE,IndexIQ ETF Trust (AGGE)
AGGP,IndexIQ ETF Trust (AGGP)
AGGY,WisdomTree Trust (AGGY)
AGI,Alamos Gold Inc. (AGI)
AGI_2,Alamos Gold Inc. (AGI)
AGII,Argo Group International Holdings Ltd (AGII)
AGIIL,Argo Group US Inc (AGIIL)
AGIO,Agios Pharmaceuticals Inc (AGIO)
AGL,Angelica Corp. (AGL)
AGLE,Aeglea BioTherapeutics Inc (AGLE)
AGM,Federal Agricultural Mortgage Corp. (AGM)
AGMA,Federal Agricultural Mortgage Corp. (AGMA)
AGM_A,Federal Agricultural Mortgage Corp. (AGM.A)
AGMH,AGM Group Holdings Inc (AGMH)
AGM_P_A,Federal Agricultural Mortgage Corp. (AGMpA)
AGM_P_B,Federal Agricultural Mortgage Corp. (AGMpB)
AGM_P_B_CL,Federal Agricultural Mortgage Corp. (AGMpB.CL)
AGM_P_C,Federal Agricultural Mortgage Corp. (AGMpC)
AGM_P_D,Federal Agricultural Mortgage Corp. (AGMpD)
AGM_P_E,Federal Agricultural Mortgage Corp. (AGMpE)
AGM_P_F,Federal Agricultural Mortgage Corp. (AGMpF)
AGM_P_RB,Federal Agricultural Mortgage Corp. (AGMpRB)
AGM_P_RC,Federal Agricultural Mortgage Corp. (AGMpRC)
AGN,Allergan plc (AGN)
AGN_1,Allergan Inc. (AGN)
AGNC,AGNC Investment Corp (AGNC)
AGNCB,AGNC Investment Corp (AGNCB)
AGNCM,AGNC Investment Corp (AGNCM)
AGNCN,AGNC Investment Corp (AGNCN)
AGNCO,AGNC Investment Corp (AGNCO)
AGNCP,AGNC Investment Corp (AGNCP)
AGND,WisdomTree Trust (AGND)
AGN_P_A,Allergan plc (AGNpA)
AGN_P_RA,Allergan plc (AGNpRA)
AGNW,(AGNw)
AGO,Assured Guaranty Ltd (AGO)
AGO_P_B,Assured Guaranty Municipal Holdings Inc (AGOpB)
AGO_P_B_1,Assured Guaranty Municipal Holdings Inc (AGOpB)
AGO_P_E,Assured Guaranty Municipal Holdings Inc (AGOpE)
AGO_P_F,Assured Guaranty Municipal Holdings Inc (AGOpF)
AGO_P_RB,Assured Guaranty Municipal Holdings Inc (AGOpRB)
AGP,Amerigroup Corp (AGP)
AGQ,ProShares Trust (AGQ)
AGR,Avangrid Inc (AGR)
AGR_1,AB Svensk Exportkredit (AGR)
AGRO,Adecoagro S.A. (AGRO)
AGRO_1,America`s Growth Fund Inc (AGRO)
AGRX,Agile Therapeutics Inc (AGRX)
AGS,PlayAGS Inc (AGS)
AGT,iShares Trust (AGT)
AGTC,Applied Genetic Technologies Corp (AGTC)
AGU,Agrium Inc. (AGU)
AGX,"Argan, Inc. (AGX)"
AGYS,"Agilysys, Inc (AGYS)"
AGZ,BlackRock Institutional Trust Company N.A. (AGZ)
AGZD,WisdomTree Trust (AGZD)
AH,Accretive Health Inc. (AH)
AH_1,Armor Holdings Inc. (AH)
AHACU,Alpha Healthcare Acquisition Corp (AHACU)
AHC,A.H. Belo Corp (AHC)
AHC_1,Hess Corporation (AHC)
AHCO,AdaptHealth Corp (AHCO)
AHCOW,AdaptHealth Corp (AHCOW)
AHCW,(AHCw)
AHG,Apria Healthcare Group Inc. (AHG)
AHGP,Alliance Holdings GP L.P. (AHGP)
AHH,Armada Hoffler Properties Inc (AHH)
AHH_P_A,Armada Hoffler Properties Inc (AHHpA)
AHH_P_A_,(AHHpA_)
AHH_P_A_1,Accredited Mortgage Loan Reit Trust (AHHpA)
AHL,Aspen Insurance Hldgs (AHL)
AHL_1,Aspen Insurance Holdings Limited (AHL)
AHL_P_A_CL,Aspen Insurance Hldgs (AHLpA.CL)
AHL_P_B_CL,Aspen Insurance Hldgs (AHLpB.CL)
AHL_P_C,Aspen Insurance Hldgs (AHLpC)
AHL_P_D,Aspen Insurance Hldgs (AHLpD)
AHL_P_E,Aspen Insurance Hldgs (AHLpE)
AHL_P_RC,Aspen Insurance Hldgs (AHLpRC)
AHL_P_R_CL,Aspen Insurance Hldgs (AHLpR.CL)
AHL_P_RD,Aspen Insurance Hldgs (AHLpRD)
AHM,American Home Mortgage Investment Corp (AHM)
AHM_P_A,American Home Mortgage Investment Corp (AHMpA)
AHM_P_A_,(AHMpA_)
AHM_P_B,American Home Mortgage Investment Corp (AHMpB)
AHM_P_B_,(AHMpB_)
AHO,Koninklijke Ahold NV (AHO)
AHOW,Koninklijke Ahold NV (AHOw)
AHOW_1,(AHOw)
AHP,Wyeth (WYE)
AHP_1,Wyeth (AHP)
AHPA,Organogenesis Holdings Inc (AHPA)
AHPA_1,Organogenesis Holdings Inc (AHPA)
AHPAU,Organogenesis Holdings Inc (AHPAU)
AHPAW,Organogenesis Holdings Inc (AHPAW)
AHPAW_1,Organogenesis Holdings Inc (AHPAW)
AHPI,Allied Healthcare Product Inc. (AHPI)
AHP_P_B,Ashford Hospitality Prime Inc (AHPpB)
AHP_P_RB,Ashford Hospitality Prime Inc (AHPpRB)
AHPW_,Ashford Hospitality Prime (AHPw_)
AHPW__1,Ashford Hospitality Prime Inc (AHPw_)
AHR,Anthracite Capital Inc. (AHR)
AHR_P_C_,Anthracite Capital Inc. (AHRpC_)
AHR_P_D_,Anthracite Capital Inc. (AHRpD_)
AHT,Ashford Hospitality Trust Inc (AHT)
AHT_P_A_CL,Ashford Hospitality Trust Inc (AHTpA.CL)
AHT_P_D,Ashford Hospitality Trust Inc (AHTpD)
AHT_P_E_CL,Ashford Hospitality Trust Inc (AHTpE.CL)
AHT_P_F,Ashford Hospitality Trust Inc (AHTpF)
AHT_P_G,Ashford Hospitality Trust Inc (AHTpG)
AHT_P_H,Ashford Hospitality Trust Inc (AHTpH)
AHT_P_I,Ashford Hospitality Trust Inc (AHTpI)
AHT_PR_A,Ashford Hospitality Trust Inc (AHT.pR.A)
AHT_P_RD,Ashford Hospitality Trust Inc (AHTpRD)
AHT_P_RF,Ashford Hospitality Trust Inc (AHTpRF)
AHT_P_RG,Ashford Hospitality Trust Inc (AHTpRG)
AHT_P_RH,Ashford Hospitality Trust Inc (AHTpRH)
AHT_P_RI,Ashford Hospitality Trust Inc (AHTpRI)
AHTW_,Ashford Hospitality Trust Inc (AHTw_)
AI,Arlington Asset Investment Corp (AI)
AI_1,Digerati Technologies Inc (AI)
AIA,BlackRock Institutional Trust Company N.A. (AIA)
AIB,Apollo Investment Corporation (AIB)
AIB_1,Allied Irish Banks Plc (AIB)
AIB_CL,Apollo Investment Corporation (AIB.CL)
AIC,Arlington Asset Investment Corp (AIC)
AIC_1,Arlington Asset Investment Corp (AIC)
AIC_2,Aames Investment Corp (AIC)
AIEQ,ETF Managers Group LLC (AIEQ)
AIF,Apollo Tactical Income Fund Inc (AIF)
AIG,American International Group Inc (AIG)
AIG_P_A,American International Group Inc (AIGpA)
AIG_P_RA_,American International Group Inc (AIGpRA_)
AIG_WS,American International Group Inc (AIG.WS)
AIH,Aesthetic Medical International Holdings Group Ltd (AIH)
AIHS,Senmiao Technology Ltd (AIHS)
AIIQ,ETF Series Solutions Trust (AIIQ)
AIKI,AIkido Pharma Inc (AIKI)
AIM,AIM ImmunoTech Inc (AIM)
AIMC,Altra Industrial Motion Corp (AIMC)
AIMC_1,Altra Industrial Motion Corporation (AIMC)
AIMCV,Altra Industrial Motion Corporation (AIMCV)
AIMT,Aimmune Therapeutics Inc (AIMT)
AIN,Albany International Corp. (AIN)
AINC,Ashford Inc (AINC)
AINV,Apollo Investment Corporation (AINV)
AIO,AllianzGI Artificial Intelligence & Technology Opportunities Fund (AIO)
AI_P_B,Arlington Asset Investment Corp (AIpB)
AI_P_C,Arlington Asset Investment Corp (AIpC)
AI_P_RB,Arlington Asset Investment Corp (AIpRB)
AIQ,Global X Funds (AIQ)
AIQ_1,Alliance Healthcare Services Inc (AIQ)
AIR,AAR Corp. (AIR)
AIRG,Airgain Inc (AIRG)
AIRI,Air Industries Group (AIRI)
AIRR,First Trust Exchange-Traded Fund III (AIRR)
AIRT,Air T Inc (AIRT)
AIRTP,Air T Inc (AIRTP)
AIRTW,Air T Inc (AIRTW)
AIT,Applied Industrial Technologies Inc. (AIT)
AIV,Apartment Investment & Management Co. (AIV)
AIV_P_A,Apartment Investment and Management Company (AIVpA)
AIV_P_A_1,Apartment Investment & Management Co. (AIVpA)
AIV_P_G_CL,Apartment Investment & Management Co. (AIVpG.CL)
AIV_P_RA,Apartment Investment & Management Co. (AIVpRA)
AIV_P_RT_CL,Apartment Investment & Management Co. (AIVpRT.CL)
AIV_P_RU_CL,Apartment Investment & Management Co. (AIVpRU.CL)
AIV_P_RV_CL,Apartment Investment & Management Co. (AIVpRV.CL)
AIV_P_RY_CL,Apartment Investment & Management Co. (AIVpRY.CL)
AIV_P_Z_CL,Apartment Investment & Management Co. (AIVpZ.CL)
AIW,Arlington Asset Investment Corp (AIW)
AIY,Apollo Investment Corporation (AIY)
AIZ,Assurant Inc (AIZ)
AIZP,Assurant Inc (AIZP)
AJG,Arthur J. Gallagher & Co. (AJG)
AJRD,Aerojet Rocketdyne Holdings Inc (AJRD)
AJX,Great Ajax Corp (AJX)
AJX_1,Standard Automotive Corp. (AJX)
AJXA,Great Ajax Corp (AJXA)
AKAM,Akamai Technologies Inc (AKAM)
AKAO,Achaogen Inc (AKAO)
AKBA,Akebia Therapeutics Inc. (AKBA)
AKCA,Akcea Therapeutics Inc (AKCA)
AKER,Akers Biosciences Inc (AKER)
AKF,AMBAC Financial Group Inc. (AKF)
AKH,Air France-KLM (AKH)
AKH_WS,Air France-KLM (AKH.WS)
AKO_A,Embotelladora Andina S.A. (AKO.A)
AKOB,Embotelladora Andina S.A. (AKOB)
AKO_B,Embotelladora Andina S.A. (AKO.B)
AKP,Alliance California Municipal Income Fund Inc (AKP)
AKR,Acadia Realty Trust (AKR)
AKRO,Akero Therapeutics Inc (AKRO)
AKRX,Akorn Inc. (AKRX)
AKS,AK Steel Holding Corp (AKS)
AKS_1,AK Steel Holding Corp. (AKS)
AKT,AMBAC Financial Group Inc. (AKT)
AKTS,Akoustis Technologies Inc (AKTS)
AKTX,Akari Therapeutics Plc (AKTX)
AKU,Akumin Inc (AKU)
AKUS,Akouos Inc (AKUS)
AL,Air Lease Corp (AL)
AL_1,Alcan Inc (AL)
ALAC,Alberton Acquisition Corp (ALAC)
ALACR,Alberton Acquisition Corp (ALACR)
ALACU,Alberton Acquisition Corp (ALACU)
ALACW,Alberton Acquisition Corp (ALACW)
ALB,Albemarle Corp. (ALB)
ALBO,Albireo Pharma Inc (ALBO)
ALC,Alcon Inc. (ALC)
ALC_1,Assisted Living Concepts Inc (ALC)
ALCO,Alico Inc. (ALCO)
ALD,WisdomTree Trust (ALD)
ALD_1,Allied Capital Corp. (ALD)
ALDR,Alder BioPharmaceuticals Inc (ALDR)
ALDW,Alon USA Partners LP (ALDW)
ALDW_1,Alon USA Partners LP (ALDW)
ALDX,Aldeyra Therapeutics Inc (ALDX)
ALE,"Allete, Inc. (ALE)"
ALEC,Alector Inc (ALEC)
ALEX,Alexander & Baldwin Inc. (ALEX)
ALEX_1,Alexander & Baldwin Inc (ALEX)
ALEXW_,Alexander & Baldwin Inc (ALEXw_)
ALEXW__1,Alexander & Baldwin Inc (New) (ALEXw_)
ALFA,ETF Series Solutions Trust (ALFA)
ALFA_1,AlphaClone Alternative Alpha ETF (ALFA)
ALF_CL,Alabama Power Co (ALF.CL)
ALFI,ETF Series Solutions Trust (ALFI)
ALG,Alamo Group Inc. (ALG)
ALGN,"Align Technology, Inc. (ALGN)"
ALGR,Allegro Merger Corp (ALGR)
ALGRR,Allegro Merger Corp (ALGRR)
ALGRU,Allegro Merger Corp (ALGRU)
ALGRW,Allegro Merger Corp (ALGRW)
ALGS,Aligos Therapeutics Inc (ALGS)
ALGT,Allegiant Travel (ALGT)
ALIM,Alimera Sciences Inc. (ALIM)
ALIN_P_A,Altera Infrastructure L.P (ALINpA)
ALIN_P_B,Altera Infrastructure L.P (ALINpB)
ALIN_P_E,Altera Infrastructure L.P (ALINpE)
ALJ,Alon Usa Energy Inc (ALJ)
ALJJ,Alj Regional Holdings Inc (ALJJ)
ALK,Alaska Air Group Inc. (ALK)
ALKS,Alkermes plc (ALKS)
ALL,Allstate Corp (The) (ALL)
ALLE,Allegion plc (ALLE)
ALLE_1,Allegiant Bancorp Inc. (ALLE)
ALLEW_,Allegion PLC (ALLEw_)
ALLEW__1,Allegion Public Limited Company (ALLEw_)
ALLK,Allakos Inc (ALLK)
ALLO,Allogene Therapeutics Inc (ALLO)
ALL_P_A_CL,Allstate Corp (The) (ALLpA.CL)
ALL_P_B,Allstate Corp (The) (ALLpB)
ALL_P_C,Allstate Corp (The) (ALLpC)
ALL_P_C_CL,Allstate Corp (The) (ALLpC.CL)
ALL_P_D,Allstate Corp (The) (ALLpD)
ALL_P_D_CL,Allstate Corporation (ALLpD.CL)
ALL_P_E,Allstate Corp (The) (ALLpE)
ALL_P_E_CL,Allstate Corporation (ALLpE.CL)
ALL_P_F,Allstate Corp (The) (ALLpF)
ALL_P_F_CL,Allstate Corporation (ALLpF.CL)
ALL_P_G,Allstate Corp (The) (ALLpG)
ALL_P_H,Allstate Corp (The) (ALLpH)
ALL_P_I,Allstate Corp (The) (ALLpI)
ALL_P_RA,Allstate Corp (The) (ALLpRA)
ALL_P_RB,Allstate Corp (The) (ALLpRB)
ALL_P_RC,Allstate Corp (The) (ALLpRC)
ALL_P_RD,Allstate Corp (The) (ALLpRD)
ALL_P_RF,Allstate Corp (The) (ALLpRF)
ALLT,Allot Ltd (ALLT)
ALLY,Ally Financial Inc (ALLY)
ALLY_1,Bally Technologies Inc (ALLY)
ALLY_P_A,GMAC Capital Trust I (ALLYpA)
ALLY_P_B_CL,Ally Financial Inc (ALLYpB.CL)
ALLY_P_B_CL_1,Ally Financial Inc (ALLYpB.CL)
ALM,Alabama Power Co (ALM)
ALM_CL,Alabama Power Co 5.875% Sr Notes Series (ALM.CL)
ALM_CL_1,Alabama Power Company (ALM.CL)
ALN,American Lorain Corp (ALN)
ALNA,Allena Pharmaceuticals Inc (ALNA)
ALNY,Alnylam Pharmaceuticals Inc (ALNY)
ALO,Alio Gold Inc (ALO)
ALOG,Analogic Corp. (ALOG)
ALOT,AstroNova Inc (ALOT)
AL_P_A,Air Lease Corp (ALpA)
ALPN,Alpine Immune Sciences Inc (ALPN)
ALP_P_N_CL,Alabama Power Co (ALPpN.CL)
ALP_P_O_CL,Alabama Power Co (ALPpO.CL)
ALP_P_P_CL,Alabama Power Co (ALPpP.CL)
ALP_P_Q,Alabama Power Co (ALPpQ)
ALP_PR_P,Alabama Power Co (ALP.pR.P)
ALQ,Alabama Power Co (ALQ)
ALQ_CL,Alabama Power Co (ALQ.CL)
ALR_1,Alere Inc (ALR)
ALRM,Alarm.com Holdings Inc (ALRM)
ALRN,Aileron Therapeutics Inc (ALRN)
ALR_P_B,Alere Inc (ALRpB)
ALRS,Alerus Financial Corp (ALRS)
ALSK,Alaska Communications Systems Group Inc (ALSK)
ALSN,Allison Transmission Holdings Inc (ALSN)
ALT,Altimmune Inc (ALT)
ALTA,Altabancorp (ALTA)
ALTG,Alta Equipment Group Inc (ALTG)
ALTG_WS,Alta Equipment Group Inc (ALTG.WS)
ALTL,Pacer Funds Trust (ALTL)
ALTM,Altus Midstream Co (ALTM)
ALTMW,Altus Midstream Co (ALTMW)
ALTR,Altair Engineering Inc (ALTR)
ALTS,ProShares Trust (ALTS)
ALTY,Global X Funds (ALTY)
ALU,Alcatel Lucent (ALU)
ALU_1,Alcatel Lucent (ALU)
ALUS,Alussa Energy Acquisition Corp (ALUS)
ALUS_U,Alussa Energy Acquisition Corp (ALUS.U)
ALUS_WS,Alussa Energy Acquisition Corp (ALUS.WS)
ALV,Autoliv Inc. (ALV)
ALV_P_RZ_,Autoliv Inc. (ALVpRZ_)
ALVR,AlloVir Inc (ALVR)
ALVW,Autoliv Inc. (ALVw)
ALX,Alexander`s Inc. (ALX)
ALXN,Alexion Pharmaceuticals Inc. (ALXN)
ALXO,Alx Oncology Holdings Inc (ALXO)
ALY,Allis Chalmers Energy Inc (ALY)
ALYA,Alithya Group inc (ALYA)
