ticker,issuer_name
JPM_P_H,JPMorgan Chase & Co. (JPMpH)
JPM_P_J,JPMorgan Chase & Co. (JPMpJ)
JPM_P_J_,JP Morgan Chase Capital X (JPMpJ_)
JPM_P_K_,JP Morgan Chase Capital XI (JPMpK_)
JPM_P_RA,JPMorgan Chase & Co. (JPMpRA)
JPM_P_RB,JPMorgan Chase & Co. (JPMpRB)
JPM_P_RB_CL,JPMorgan Chase Capital XXVIII (JPMpRB.CL)
JPM_P_RDCL,JPMorgan Chase & Co. (JPMpRDCL)
JPM_P_RE,JPMorgan Chase & Co. (JPMpRE)
JPM_P_RF,JPMorgan Chase & Co. (JPMpRF)
JPM_P_RG,JPMorgan Chase & Co. (JPMpRG)
JPM_P_RH,JPMorgan Chase & Co. (JPMpRH)
JPM_P_RI_CL,JPMorgan Chase & Co. (JPMpRI.CL)
JPM_P_RJ_,JP Morgan Chase Capital X (JPMpRJ_)
JPM_P_RJ_CL,JP Morgan Chase Capital X (JPMpRJ.CL)
JPM_P_RK_,JP Morgan Chase Capital XI (JPMpRK_)
JPM_P_RK_CL,JP Morgan Chase Capital XI (JPMpRK.CL)
JPM_P_RO_CL,Bank One Capital VI (JPMpRO.CL)
JPM_P_RP_CL,JPMorgan Chase Capital XVI (JPMpRP.CL)
JPM_P_RS_CL,JPMorgan Chase Capital XIX (JPMpRS.CL)
JPM_P_RW_CL,JPMorgan Chase Capital XXIV (JPMpRW.CL)
JPM_P_RX_CL,JP Morgan Chase Capital XII (JPMpRX.CL)
JPM_P_RY_CL,JPMorgan Chase Capital XIV (JPMpRY.CL)
JPM_P_RZ_CL,JPMorgan Chase Capital XXVI (JPMpRZ.CL)
JPMV,BlackRock Institutional Trust Company N.A. (JPMV)
JPMWS,JPMorgan Chase & Co. (JPMWS)
JPM_WS,JPMorgan Chase & Co. (JPM.WS)
JPN,DBX ETF Trust (JPN)
JPNL,Direxion Daily Japan Bull 3x Shares (JPNL)
JPNL_1,Direxion Shares ETF Trust (JPNL)
JPS,Nuveen Preferred & Income Securities Fund (JPS)
JPSE,J.P.Morgan Investment Management Inc. (JPSE)
JPST,J.P.Morgan Investment Management Inc. (JPST)
JPT,Nuveen Preferred and Income 2022 Term Fund (JPT)
JPUS,J.P.Morgan Investment Management Inc. (JPUS)
JPW,Nuveen Flexible Investment Income Fund (JPW)
JPXN,BlackRock Institutional Trust Company N.A. (JPXN)
JQC,Nuveen Credit Strategies Income Fund (JQC)
JQUA,J.P. Morgan Exchange-Traded Fund Trust (JQUA)
JRC,Journal Register Co. (JRC)
JRI,Nuveen Real Asset Income and Growth Fund (JRI)
JRJC,China Finance Online Co. Ltd. (JRJC)
JRN,Journal Communications Inc (JRN)
JRO,Nuveen Floating Rate Income Opportunity Fund (JRO)
JRS,Nuveen Real Estate Income Fund. (JRS)
JRSH,Jerash holdings (US) Inc (JRSH)
JRT,Jer Investors Trust Inc (JRT)
JRVR,James River Group Holdings Ltd (JRVR)
JSD,Nuveen Short Duration Credit Opportunities Fund (JSD)
JSM,Navient Corp (JSM)
JSMD,Janus Capital Management LLC (JSMD)
JSML,Janus Capital Management LLC (JSML)
JSN,Nuveen Equity Premium Opportunity Fund (JSN)
JSYN,Jensyn Acquisition Corp (JSYN)
JSYNR,Jensyn Acquisition Corp (JSYNR)
JSYNU,Jensyn Acquisition Corp (JSYNU)
JSYNW,Jensyn Acquisition Corp (JSYNW)
JT,Jianpu Technology Inc (JT)
JTA,Nuveen Tax-Advantaged Total Return Strategy Fund (JTA)
JTD,Nuveen Tax-Advantaged Dividend Growth Fund (JTD)
JTP,Nuveen Quality Preferred Income Fund (JTP)
JTPY,JetPay Corp (JTPY)
JTX,Jackson Hewitt Tax Services Inc (JTX)
JUST,Goldman Sachs ETF Trust (JUST)
JVA,Coffee Holding Co Inc (JVA)
JVAL,J.P. Morgan Exchange-Traded Fund Trust (JVAL)
JWA,John Wiley & Sons Inc. (JWA)
JW_A,John Wiley & Sons Inc. (JW.A)
JWB,John Wiley & Sons Inc. (JWB)
JW_B,John Wiley & Sons Inc. (JW.B)
JWF,Wells Fargo Capital IX (JWF)
JWF_CL,Wells Fargo Capital IX 5.625% TOPrS (JWF.CL)
JWF_CL_1,Wells Fargo Capital Ix (JWF.CL)
JWN,"Nordstrom, Inc. (JWN)"
JWS,Jaws Acquisition Corp (JWS)
JWS_U,Jaws Acquisition Corp (JWS.U)
JWS_WS,Jaws Acquisition Corp (JWS.WS)
JXI,BlackRock Institutional Trust Company N.A. (JXI)
JXSB,"Jacksonville Bancorp, Inc (JXSB)"
JYN,(JYN)
JYNT,Joint Corp (JYNT)
JZC,Lehman ABS Corp (JZC)
JZC_CL,Lehman ABS Corporation (JZC.CL)
JZD,(JZD)
JZD_CL,(JZD.CL)
JZE_CL,Lehman ABS Corp (JZE.CL)
JZH,Lehman ABS Corp (JZH)
JZH_CL,Lehman ABS Corp 6.00% CorTS Prudential Bkd 2003-20 Cl A-1 (JZH.CL)
JZJCL,Lehman ABS Corp (JZJCL)
JZK,Lehman ABS Corp (JZK)
JZL,Lehman ABS Corp (JZL)
JZO,(JZO)
JZO_CL,(JZO.CL)
JZR,(JZR)
JZS,Lehman ABS Corp (JZS)
JZT,Lehman ABS Corp (JZT)
JZV,Lehman ABS Corp (JZV)
JZY,(JZY)
JZY_CL,(JZY.CL)
JZZ,(JZZ)
JZZ_CL,(JZZ.CL)
K,Kellogg Co (K)
KAACU,Kayne Anderson Acquisition Corp (KAACU)
KAI,"Kadant, Inc. (KAI)"
KALA,Kala Pharmaceuticals Inc (KALA)
KALL,Krane Shares Trust (KALL)
KALU,Kaiser Aluminum Corp (KALU)
KALV,KalVista Pharmaceuticals Inc (KALV)
KAMN,Kaman Corp. (KAMN)
KANG,iKang Healthcare Group Inc (KANG)
KAP,KCAP Financial Inc (KAP)
KAP_1,"Star Struck, Ltd. (KAP)"
KAP_CL,KCAP Financial Inc (KAP.CL)
KAPR,Innovator ETFs Trust (KAPR)
KAR,KAR Auction Services Inc (KAR)
KAR_1,Adesa Inc (KAR)
KARS,Krane Shares Trust (KARS)
KARW,KAR Auction Services Inc (KARw)
KATE,Kate Spade & Co (KATE)
KB,KB Financial Group Inc (KB)
KB_1,Kook Min Bank (KB)
KBA,Krane Shares Trust (KBA)
KBAL,"Kimball International, Inc. (KBAL)"
KBE,SPDR Series Trust (KBE)
KBH,KB Home (KBH)
KBLM,KBL Merger Corp. IV (KBLM)
KBLMR,KBL Merger Corp. IV (KBLMR)
KBLMU,KBL Merger Corp. IV (KBLMU)
KBLMW,KBL Merger Corp. IV (KBLMW)
KBNT,Kubient Inc (KBNT)
KBNTW,Kubient Inc (KBNTW)
KBR,KBR Inc (KBR)
KBR_,KB Financial Group Inc (KBr_)
KBRW,(KBRw)
KBSF,KBS Fashion Group Limited (KBSF)
KBW,KBW Inc. (KBW)
KBWB,Invesco Capital Management LLC (KBWB)
KBWD,Invesco Capital Management LLC (KBWD)
KBWP,Invesco Capital Management LLC (KBWP)
KBWR,Invesco Capital Management LLC (KBWR)
KBWY,Invesco Capital Management LLC (KBWY)
KC,Kingsoft Cloud Holdings Ltd (KC)
KCAC,Kensington Capital Acquisition Corp (KCAC)
KCAC_U,Kensington Capital Acquisition Corp (KCAC.U)
KCAC_WS,Kensington Capital Acquisition Corp (KCAC.WS)
KCAPL,Portman Ridge Finance Corp (KCAPL)
KCCB,Krane Shares Trust (KCCB)
KCC_CL,Structured Products Corp. (KCC.CL)
KCE,SPDR Series Trust (KCE)
KCG_1,KCG Holdings Inc (KCG)
KCG_2,Knight Capital Group Inc. (KCG)
KCGW_,KCG Holdings Inc (KCGw_)
KCH,(KCH)
KCH_1,Kali-Chemie AG (KCH)
KCI,Kinetic Concepts Inc (KCI)
KCN,(KCN)
KCN_1,Kingsgate Consolidated Ltd. (KCN)
KCN_CL,(KCN.CL)
KCNY,Krane Shares Trust (KCNY)
KCO,(KCO)
KCO_1,Kloekner & Co (KCO)
KCP,"Kenneth Cole Productions, Inc. (KCP)"
KCT_CL,Structured Products Corp. (KCT.CL)
KCV,(KCV)
KCV_CL,(KCV.CL)
KCW,Structured Products Corp. (KCW)
KCW_CL,Structured Products Corp 7.5% CorTS for US West Comms Deb (KCW.CL)
KDE,4Licensing Corp (KDE)
KDFI,Krane Shares Trust (KDFI)
KDMN,Kadmon Holdings Inc (KDMN)
KDN,Kaydon Corp. (KDN)
KDNY,Chinook Therapeutics Inc (KDNY)
KDP,Keurig Dr Pepper Inc (KDP)
KE,Kimball Electronics Inc (KE)
KEA,"Keane, Inc. (KEA)"
KED,Kayne Anderson Energy Development Company (KED)
KEF,Korea Equity Fund Inc (KEF)
KEFR,"Korea Equity Fund, Inc. (KEFr)"
KEG,"Key Energy Services, Inc. (KEG)"
KEG_1,"Key Energy Services, Inc. (KEG)"
KEI,"Keithley Instruments, Inc. (KEI)"
KELYA,"Kelly Services, Inc. (KELYA)"
KELYB,"Kelly Services, Inc. (KELYB)"
KEM_1,Kemet Corp. (KEM)
KEMQ,Krane Shares Trust (KEMQ)
KEMX,Krane Shares Trust (KEMX)
KEN,Kenon Holdings Ltd (KEN)
KENW,Kenon Holdings Ltd (KENw)
KEP,Korea Electric Power (KEP)
KEQU,Kewaunee Scientific Corporation (KEQU)
KERN,Akerna Corp (KERN)
KERNW,Akerna Corp (KERNW)
KERX,Keryx Biopharmaceuticals Inc (KERX)
KEX,Kirby Corp. (KEX)
KEY,Keycorp (KEY)
KEY_P_A_,KeyCorp Capital V Trust (KEYpA_)
KEY_P_G,Keycorp (KEYpG)
KEY_P_H_CL,Keycorp (KEYpH.CL)
KEY_P_I,Keycorp (KEYpI)
KEY_P_J,Keycorp (KEYpJ)
KEY_P_K,Keycorp (KEYpK)
KEY_P_RA_CL,KeyCorp Capital V Trust (KEYpRA.CL)
KEY_P_RB_CL,KeyCorp Capital VI (KEYpRB.CL)
KEY_P_RD_CL,KeyCorp Capital VIII (KEYpRD.CL)
KEY_P_RE_CL,KeyCorp Capital IX (KEYpRE.CL)
KEY_P_RF_CL,KeyCorp Capital X (KEYpRF.CL)
KEY_P_RI,Keycorp (KEYpRI)
KEYS,Keysight Technologies Inc (KEYS)
KEYS_1,"Keystone Automotive Industries, Inc. (KEYS)"
KEYSW_R,Keysight Technologies Inc (KEYSw_r)
KEYW,KEYW Holding Corp (KEYW)
KF,Korea Fund Inc (KF)
KFFB,Kentucky First Federal Bancorp (KFFB)
KFH,KKR Financial Holdings LLC (KFH)
KFH_CL,KKR Financial Holdings LLC (KFH.CL)
KFI,KKR Financial Holdings LLC (KFI)
KFI_1,K&F Industries Holdings Inc (KFI)
KFI_CL,KKR Financial Holdings LLC (KFI.CL)
KFN,KKR Financial Holdings LLC (KFN)
KFN_1,KKR Financial Corp. (KFN)
KFN_P,KKR Financial Holdings LLC (KFNp)
KFN_P_CL,KKR Financial Holdings LLC (KFNp.CL)
KFN_P_CL_1,KKR Financial Holdings LLC (KFNp.CL)
KFN_P_R,KKR Financial Holdings LLC (KFNpR)
KFN_P_RCL,KKR Financial Holdings LLC (KFNpRCL)
KFRC,Kforce Inc. (KFRC)
KFS,Kingsway Financial Services Inc. (KFS)
KFTW,(KFTw)
KFT_WD,(KFT.WD)
KFY,Korn Ferry (KFY)
KFYP,Krane Shares Trust (KFYP)
KG,"King Pharmaceuticals, Inc. (KG)"
KGC,Kinross Gold Corp. (KGC)
KGJI,Kingold Jewelry Inc (KGJI)
KGRN,Krane Shares Trust (KGRN)
KH,China Kanghui Holdings (KH)
KHC,Kraft Heinz Co (KHC)
KHI,Deutsche High Income Trust (KHI)
KID,Kid Brands Inc (KID)
KIDS,OrthoPediatrics corp (KIDS)
KIE,SPDR Series Trust (KIE)
KIM,Kimco Realty Corp. (KIM)
KIM_P_H_CL,Kimco Realty Corp. (KIMpH.CL)
KIM_P_I_CL,Kimco Realty Corp. (KIMpI.CL)
KIM_P_J_CL,Kimco Realty Corp. (KIMpJ.CL)
KIM_P_K_CL,Kimco Realty Corp. (KIMpK.CL)
KIM_P_L,Kimco Realty Corp. (KIMpL)
KIM_P_M,Kimco Realty Corp. (KIMpM)
KIM_P_RF_CL,Kimco Realty Corp. (KIMpRF.CL)
KIM_P_RG_CL,Kimco Realty Corp. (KIMpRG.CL)
KIM_P_RI,Kimco Realty Corp. (KIMpRI)
KIM_P_RJ,Kimco Realty Corp. (KIMpRJ)
KIM_P_RK,Kimco Realty Corp. (KIMpRK)
KIM_P_RL,Kimco Realty Corp. (KIMpRL)
KIM_P_RM,Kimco Realty Corp. (KIMpRM)
KIN,Kindred Biosciences Inc (KIN)
KING,King Digital Entertainment plc (KING)
KINS,Kingstone Cos. Inc (KINS)
KIO,KKR Income Opportunities Fund (KIO)
KIOR,KiOR Inc (KIOr)
KIOR_1,KiOR Inc (KIOr)
KIOR_2,KKR Income Opportunities Fund (KIOr)
KIORW,KKR Income Opportunities Fund (KIOrw)
KIQ,Kelso Technologies Inc. (KIQ)
KIRK,Kirkland`s Inc (KIRK)
KJAN,Innovator ETFs Trust (KJAN)
KJUL,Innovator ETFs Trust (KJUL)
KKD,Krispy Kreme Doughnuts Inc (KKD)
KKR,KKR & Co. Inc. (KKR)
KKR_1,KKR & Co. L.P. (KKR)
KKR_P_A,KKR & Co. Inc. (KKRpA)
KKR_P_A_1,KKR & Co. L.P. (KKRpA)
KKR_P_B,KKR & Co. Inc. (KKRpB)
KKR_P_B_1,KKR & Co. L.P. (KKRpB)
KKR_P_C,KKR & Co. Inc. (KKRpC)
KKR_P_RA,KKR & Co. L.P. (KKRpRA)
KKR_P_RB,KKR & Co. L.P. (KKRpRB)
KL,Kirkland Lake Gold Ltd (KL)
KLAC,KLA Corp. (KLAC)
KLCD,Krane Shares Trust (KLCD)
KLD,BlackRock Institutional Trust Company N.A. (KLD)
KLDO,Kaleido Biosciences Inc (KLDO)
KLDW,Exchange Listed Funds Trust (KLDW)
KLDX,Klondex Mines Ltd. (KLDX)
KLIC,"Kulicke & Soffa Industries, Inc. (KLIC)"
KLR,Kaleyra Inc (KLR)
KLR_WS,Kaleyra Inc (KLR.WS)
KLXE,KLX Energy Services Holdings Inc (KLXE)
KLXEV,KLX Energy Services Holdings Inc (KLXEV)
KLXI,KLX Inc (KLXI)
KLXIV,KLX Inc (KLXIV)
KMA,Kmg America Corp (KMA)
KMB,Kimberly-Clark Corp. (KMB)
KMBW_R,Kimberly Clark Corp (KMBw_r)
KMDA,Kamada Ltd (KMDA)
KMED,Krane Shares Trust (KMED)
KMF,Kayne Anderson NextGen Energy & Infrastructure Inc (KMF)
KMG_1,"KMG Chemicals, Inc. (KMG)"
KMG_2,"KMG Chemicals, Inc. (KMG)"
KMI,Kinder Morgan Inc (KMI)
KMI_1,"Kinder Morgan, Inc. (KS) (KMI)"
KMI_P_A,Kinder Morgan Inc (KMIpA)
KMI_P_RA,Kinder Morgan Inc (KMIpRA)
KMIW_R,Kinder Morgan Inc (KMIw_r)
KMI_WS,Kinder Morgan Inc (KMI.WS)
KMI_WSW,Kinder Morgan Inc. (KMI.WSw)
KMM,Deutsche Multi-Market Income Trust (KMM)
KMP,Kinder Morgan Energy Partners L.P. (KMP)
KMPA,Kemper Corporation (KMPA)
KMPH,KemPharm Inc (KMPH)
KMPR,Kemper Corporation (KMPR)
KMR,"Kinder Morgan Management, LLC (KMR)"
KMT,Kennametal Inc. (KMT)
KMTW,(KMTw)
KMX,Carmax Inc (KMX)
KN,Knowles Corp (KN)
KNAB,Bank of Montreal (KNAB)
KND_1,Kindred Healthcare Inc (KND)
KNDI,Kandi Technologies Group Inc (KNDI)
KNDW,(KNDw)
KNG,ETF Series Solutions Trust (KNG)
KNH,(KNH)
KNH_CL,(KNH.CL)
KNL,Knoll Inc (KNL)
KNM,Konami Corporation (KNM)
KNO,Structured Products Corp. (KNO)
KNO_CL,Structured Products Corp 6.70% CorTS Cl A for SunAmerica Deb (KNO.CL)
KNOP,KNOT Offshore Partners LP (KNOP)
KNOW,Direxion Shares ETF Trust (KNOW)
KNR,Structured Products Corp. (KNR)
KNR_CL,Structured Products Corp 6.80% CorTS Cl A Cert Issued by Trust for Bri (KNR.CL)
KNSA,Kiniksa Pharmaceuticals Ltd (KNSA)
KNSL,Kinsale Capital Group Inc (KNSL)
KNW,KNOWLES CORPORATION (KNw)
KNW_1,0 (KNw)
KNX,Knight-Swift Transportation Holdings Inc (KNX)
KNX_1,Knight Transportation Inc. (KNX)
KNXA,Kenexa Corp (KNXA)
KO,Coca-Cola Co (KO)
KOB_CL,Structured Products Corp. (KOB.CL)
KOCT,Innovator ETFs Trust (KOCT)
KOD,Kodiak Sciences Inc (KOD)
KODK,Eastman Kodak Co. (KODK)
KODKWS,Eastman Kodak Co. (KODKWS)
KODK_WS,Eastman Kodak Co. (KODK.WS)
KODKWSA,Eastman Kodak Co. (KODKWSA)
KODK_WS_A,Eastman Kodak Co. (KODK.WS.A)
KOF,Coca-Cola Femsa S.A.B. DE C.V. (KOF)
KOG,Kodiak Oil & Gas Corporation (KOG)
KOIN,Exchange Traded Concepts Trust (KOIN)
KOK,(KOK)
KOK_1,Mitsubishi UFJ Securities Co. Ltd. (KOK)
KOK_CL,(KOK.CL)
KOKU,DBX ETF Trust (KOKU)
KOL,VanEck Vectors ETF Trust (KOL)
KOLD,ProShares Trust (KOLD)
KOMP,SPDR Series Trust (KOMP)
KONA,Kona Grill Inc (KONA)
KOOL,Cesca Therapeutics (KOOL)
KOP,Koppers Holdings Inc (KOP)
KOPN,Kopin Corp. (KOPN)
KOR,Corvus Gold Inc (KOR)
KOR_1,Advisorshares Trust (KOR)
KOR_2,Koor Industries Ltd. (KOR)
KORP,American Century ETF Trust (KORP)
KORS,Capri Holdings Ltd (KORS)
KORU,Direxion Shares ETF Trust (KORU)
KOS,Kosmos Energy Ltd (KOS)
KOS_CL,Structured Products Corp. (KOS.CL)
KOSS,Koss Corp. (KOSS)
KOW_,Coca-Cola Co (KOw_)
KPA,Innkeepers USA Trust (KPA)
KPA_P_C,Innkeepers USA Trust (KPApC)
KPFS,"Pepper Food Service Co., Ltd. (KPFS)"
KPN,Koninklijke KPN NV (KPN)
KPTI,Karyopharm Therapeutics Inc (KPTI)
KR,Kroger Co. (KR)
KRA,Kraton Corp (KRA)
KRBN,KraneShares ICAV (KRBN)
KRBP,Kiromic BioPharma Inc (KRBP)
KRB_P_D_,MBNA Capital D (KRBpD_)
KRB_P_RD_CL,MBNA Capital D (KRBpRD.CL)
KRB_P_RE_CL,MBNA Capital E (KRBpRE.CL)
KRC,Kilroy Realty Corp. (KRC)
KRC_P_G_CL,Kilroy Realty Corp. (KRCpG.CL)
KRC_P_H_CL,Kilroy Realty Corp. (KRCpH.CL)
KRC_P_RE_CL,Kilroy Realty Corp. (KRCpRE.CL)
KRC_P_RF_CL,Kilroy Realty Corp. (KRCpRF.CL)
KRE,SPDR Series Trust (KRE)
KREF,KKR Real Estate Finance Trust Inc (KREF)
KRG,Kite Realty Group Trust (KRG)
KRG_P_A_CL,Kite Realty Group Trust (KRGpA.CL)
KRH_CL,Structured Products Corp. (KRH.CL)
KRJ,Structured Products Corp. (KRJ)
KRJ_CL,Structured Products Corp 8.10% CorTS for Provident Financing Trust I (KRJ.CL)
KRKR,36Kr Holdings Inc (KRKR)
KRMA,Global X Funds (KRMA)
KRMD,"Repro-Med Systems, Inc. (KRMD)"
KRNT,Kornit Digital Ltd (KRNT)
KRNY,Kearny Financial Corp. (KRNY)
KRO,"Kronos Worldwide, Inc. (KRO)"
KRON,Kronos Bio Inc (KRON)
KROS,Keros Therapeutics Inc (KROS)
KRP,Kimbell Royalty Partners LP (KRP)
KRTX,Karuna Therapeutics Inc (KRTX)
KRUS,Kura Sushi USA Inc (KRUS)
KRV,(KRV)
KRV_CL,(KRV.CL)
KRYS,Krystal Biotech Inc (KRYS)
KS_1,Kapstone Paper and Packaging Corporation (KS)
KSA,BlackRock Institutional Trust Company N.A. (KSA)
KSA_1,Structured Products Corp. (KSA)
KSA_CL,Structured Products Corp 8.50% CorTS Ctfs. (KSA.CL)
KSCD,Krane Shares Trust (KSCD)
KSE,"Keyspan, Corp. (KSE)"
KSK,Structured Products Corp. (KSK)
KSK_CL,Structured Products Corp 7.40% CorTS for Ford Deb (KSK.CL)
KSM,DWS Strategic Municipal Income Trust (KSM)
KSMT,Kismet Acquisition One Corp (KSMT)
KSMTU,Kismet Acquisition One Corp (KSMTU)
KSMTW,Kismet Acquisition One Corp (KSMTW)
KSP,K-Sea Transportation Partners LP (KSP)
KSPN,Kaspien Holdings Inc (KSPN)
KSS,Kohl`s Corp. (KSS)
KST,Deutsche Strategic Income Trust (KST)
KSU,Kansas City Southern (KSU)
KSU_P,Kansas City Southern (KSUp)
KSU_PR,Kansas City Southern (KSU.pR)
KSU_P_R,Kansas City Southern (KSUpR)
KT,KT Corporation (KT)
KT_1,"Katy Industries, Inc. (KT)"
KTB,Kontoor Brands Inc (KTB)
KTBW,Kontoor Brands Inc (KTBw)
KTCC,Key Tronic Corp. (KTCC)
KTF,DWS Municipal Income Trust (KTF)
KTH,Structured Products Corp. (KTH)
KTJ,(KTJ)
KTJ_CL,(KTJ.CL)
KTN,Structured Products Corp. (KTN)
KTO,K2 Inc. (KTO)
KTOS,Kratos Defense & Security Solutions Inc (KTOS)
KTOV,Kitov Pharma Ltd (KTOV)
KTOVW,Kitov Pharma Ltd (KTOVW)
KTP,Structured Products Corp. (KTP)
KTRA,Kintara Therapeutics Inc (KTRA)
KTS,(KTS)
KTS_1,Arcontech Group Plc (KTS)
KTS_CL,(KTS.CL)
KTV,Structured Products Corp. (KTV)
KTWO,K2M Group Holdings Inc (KTWO)
KTX,Structured Products Corp. (KTX)
KUB,Kubota Corporation (KUB)
KURA,Kura Oncology Inc (KURA)
KURE,Krane Shares Trust (KURE)
KV_A,KV Pharmaceutical Co. (KV.A)
KV_B,KV Pharmaceutical Co. (KV.B)
KVF,Structured Products Corp. (KVF)
KVHI,"KVH Industries, Inc. (KVHI)"
KVJ_CL,Structured Products Corp. (KVJ.CL)
KVL,(KVL)
KVL_CL,(KVL.CL)
KVM,Structured Products Corp. (KVM)
KVM_CL,(KVM.CL)
KVN_CL,Structured Products Corp. (KVN.CL)
KVO,(KVO)
KVO_CL,(KVO.CL)
KVR_CL,Structured Products Corp. (KVR.CL)
KVT_CL,Structured Products Corp. (KVT.CL)
KVU_CL,Structured Products Corp. (KVU.CL)
KVW_CL,Structured Products Corp. (KVW.CL)
KVZ,(KVZ)
KVZ_CL,(KVZ.CL)
KW,Kennedy-Wilson Holdings Inc (KW)
KWD,Kellwood Co. (KWD)
KWEB,Krane Shares Trust (KWEB)
KWK,"Quicksilver Resources, Inc. (KWK)"
KWKW,(KWKw)
KWN,"Kennedy-Wilson, Inc. (KWN)"
KWN_CL,Kennedy Wilson Holdings Inc (KWN.CL)
KWR,Quaker Chemical Corp. (KWR)
KWT,iShares Trust (KWT)
KXI,BlackRock Institutional Trust Company N.A. (KXI)
KXIN,Kaixin Auto Holdings (KXIN)
KXINW,Kaixin Auto Holdings (KXINW)
KYE,Kayne Anderson Energy Total Return Fund Inc (KYE)
KYE_1,"Kayne Anderson Capital Advisors, L.P. (KYE)"
KYMR,Kymera Therapeutics Inc (KYMR)
KYN,Kayne Anderson Energy Infrastructure Fund Inc (KYN)
KYN_P_E_CL,Kayne Anderson Mlp Investment Company (KYNpE.CL)
KYN_P_F_CL,Kayne Anderson MLP/Midstream Investment Co (KYNpF.CL)
KYN_P_G_CL,Kayne Anderson Mlp Investment Company (KYNpG.CL)
KYN_P_RD_CL,Kayne Anderson Mlp Investment Company (KYNpRD.CL)
KYN_P_RF,Kayne Anderson MLP Investment Co. (KYNpRF)
KYO,Kyocera Corporation (KYO)
KZIA,Kazia Therapeutics Limited (KZIA)
KZR,Kezar Life Sciences Inc (KZR)
L,Loews Corp. (L)
LAB,"Labranche & Co., Inc. (LAB)"
LABD,Direxion Shares ETF Trust (LABD)
LABL,Multi-Color Corp. (LABL)
LABU,Direxion Shares ETF Trust (LABU)
LAC,Lithium Americas Corp (LAC)
LACK,Direxion Shares ETF Trust (LACK)
LACQ,Leisure Acquisition Corp (LACQ)
LACQU,Leisure Acquisition Corp (LACQU)
LACQW,Leisure Acquisition Corp (LACQW)
LAD,"Lithia Motors, Inc. (LAD)"
LADR,Ladder Capital Corp (LADR)
LAIX,LAIX Inc (LAIX)
LAKE,"Lakeland Industries, Inc. (LAKE)"
LALT,Invesco Capital Management LLC (LALT)
LAMR,Lamar Advertising Co (LAMR)
LANC,Lancaster Colony Corp. (LANC)
LAND,Gladstone Land Corp (LAND)
LANDO,Gladstone Land Corp (LANDO)
LANDP,Gladstone Land Corp (LANDP)
LAQ,Aberdeen Latin America Equity Fund Inc (LAQ)
LARK,Landmark Bancorp Inc (LARK)
LAS,Lentuo International Inc (LAS)
LASR,nLIGHT Inc (LASR)
LATN,Union Acquisition Corp II (LATN)
LATNU,Union Acquisition Corp II (LATNU)
LATNW,Union Acquisition Corp II (LATNW)
LAUR,Laureate Education Inc (LAUR)
LAWS,"Lawson Products, Inc. (LAWS)"
LAYN,Layne Christensen Co. (LAYN)
LAZ,Lazard Ltd. (LAZ)
LAZY,Lazydays Holdings Inc (LAZY)
LB,L Brands Inc (LB)
LB_1,"Labarge, Inc. (LB)"
LBAI,"Lakeland Bancorp, Inc. (LBAI)"
LBC,Luther Burbank Corp (LBC)
LBDC,UBS AG London Branch (LBDC)
LBF,Deutsche Global High Income Fund Inc (LBF)
LBJ,Direxion Shares ETF Trust (LBJ)
LBRDA,Liberty Broadband Corp (LBRDA)
LBRDK,Liberty Broadband Corp (LBRDK)
LBRT,Liberty Oilfield Services Inc (LBRT)
LBTYA,Liberty Global plc (LBTYA)
LBTYA_1,Liberty Global Plc (LBTYA)
LBTYB,Liberty Global plc (LBTYB)
LBTYK,Liberty Global plc (LBTYK)
LBTYK_1,Liberty Global Plc (LBTYK)
LBY,Libbey Inc. (LBY)
LC,LendingClub Corp (LC)
LCA,Landcadia Holdings II Inc (LCA)
LCAHU,Landcadia Holdings II Inc (LCAHU)
LCAHU_1,Landcadia Holdings Inc (LCAHU)
LCAHW,Landcadia Holdings II Inc (LCAHW)
LCAPU,Lionheart Acquisition Corp II (LCAPU)
LCC,"US Airways Group, Inc. (LCC)"
LCI,"Lannett Co., Inc. (LCI)"
LCII,LCI Industries (LCII)
LCM,Advent-Claymore Enhanced Growth & Income Fund (LCM)
LCNB,LCNB Corp (LCNB)
LCR,Leuthold Funds Inc (LCR)
LCTX,Lineage Cell Therapeutics Inc (LCTX)
LCUT,"Lifetime Brands, Inc. (LCUT)"
LCYAU,Landcadia Holdings III Inc (LCYAU)
LD,Barclays Bank PLC (LD)
LDEM,iShares Trust (LDEM)
LDF,Latin American Discovery Fund Inc (LDF)
LDF_1,"Latin American Discovery Fund, Inc. (LDF)"
LDG,Longs Drug Stores Corp. (LDG)
LDK,LDK Solar Co. Ltd. (LDK)
LDL,"Lydall, Inc. (LDL)"
LDOS,Leidos Holdings Inc (LDOS)
LDOSW,Leidos Holdings Inc (LDOSw)
LDOSW_,Leidos Holdings Inc (LDOSw_)
LDP,Cohen & Steers Limited Duration Preferred and Income Fund Inc (LDP)
LDR,"Landauer, Inc. (LDR)"
LDRI,Invesco Capital Management LLC (LDRI)
LDRS,Innovator ETFs Trust (LDRS)
LDSF,First Trust Exchange-Traded Fund VIII (LDSF)
LDUR,Pimco Exchange Traded Fund (LDUR)
LDZ,(LDZ)
LE,"Lands` End, Inc. (LE)"
LEA,Lear Corp. (LEA)
LEA_1,Lear Corp. (LEA)
LEAD,Reality Shares Advisors LLC (LEAD)
LEAF,Leaf Group Ltd (LEAF)
LEAP_U,Ribbit LEAP Ltd (LEAP.U)
LEAW_,(LEAw_)
LECO,"Lincoln Electric Holdings, Inc. (LECO)"
LEDS,Semileds Corp (LEDS)
LEE,"Lee Enterprises, Inc. (LEE)"
LEG,"Leggett & Platt, Inc. (LEG)"
LEGH,Legacy Housing Corp (LEGH)
LEGN,Legend Biotech Corp (LEGN)
LEGR,First Trust Exchange-Traded Fund VI (LEGR)
LEH,Lehman Brothers Holdings Inc. (LEH)
LEH_P_C_,Lehman Brothers Holdings Inc. (LEHpC_)
LEH_P_D_,Lehman Brothers Holdings Inc. (LEHpD_)
LEH_P_F_,Lehman Brothers Holdings Inc. (LEHpF_)
LEH_P_G_,Lehman Brothers Holdings Inc. (LEHpG_)
LEH_P_J_,Lehman Brothers Holdings Inc. (LEHpJ_)
LEH_P_K,LEHMAN BROS HLDGS CAP TR III (LEHpK)
LEH_P_K_,(LEHpK_)
LEH_P_K_1,(LEHpK)
LEH_P_L,LEHMAN BROS HLDGS CAP TR IV (LEHpL)
LEH_P_L_,(LEHpL_)
LEH_P_L_1,(LEHpL)
LEH_P_M_,Lehman Brothers Holdings Capital Trust V (LEHpM_)
LEH_P_N_,Lehman Brothers Holdings Inc. (LEHpN_)
LEH_P_P_,Lehman Brothers Holdings Inc. (LEHpP_)
LEJU,Leju Holdings Ltd (LEJU)
LEMB,BlackRock Institutional Trust Company N.A. (LEMB)
LEN,Lennar Corp. (LEN)
LEN_1,Lennar Corp. (LEN)
LENB,Lennar Corp. (LENB)
LEN_B,Lennar Corp. (LEN.B)
LENS,Presbia PLC (LENS)
LEO,BNY Mellon Strategic Municipals Inc (LEO)
LEU,Centrus Energy Corp (LEU)
LEVI,Levi Strauss & Co. (LEVI)
LEVL,Level One Bancorp Inc (LEVL)
LEVLP,Level One Bancorp Inc (LEVLP)
LEXEA,Liberty Expedia Holdings Inc (LEXEA)
LEXEB,Liberty Expedia Holdings Inc (LEXEB)
LF,Leapfrog Enterprises Inc. (LF)
LFAC,LF Capital Acquisition Corp (LFAC)
LFACU,LF Capital Acquisition Corp (LFACU)
LFACW,LF Capital Acquisition Corp (LFACW)
LFB,Longview Fibre Co. (LFB)
LFC,China Life Insurance Co (LFC)
LFEQ,VanEck Vectors ETF Trust (LFEQ)
LFG,Libra Capital SA (LFG)
LFT,Longtop Financial Technologies Ltd (LFT)
LFUS,"Littelfuse, Inc. (LFUS)"
LFVN,Lifevantage Corporation (LFVN)
LGC,Legacy Acquisition Corp (LGC)
LGCU,Legacy Acquisition Corp (LGCU)
LGC_U,Legacy Acquisition Corp (LGC.U)
LGCWS,Legacy Acquisition Corp (LGCWS)
LGC_WS,Legacy Acquisition Corp (LGC.WS)
LGCY,Legacy Reserves Inc (LGCY)
LGCY_1,Legacy Reserves LP (LGCY)
LGCYO,Legacy Reserves LP (LGCYO)
LGCYP,Legacy Reserves LP (LGCYP)
LGF,Lions Gate Entertainment Corp. (LGF)
LGFA,Lions Gate Entertainment Corp. (LGFA)
LGF_A,Lions Gate Entertainment Corp. (LGF.A)
LGFB,Lions Gate Entertainment Corp. (LGFB)
LGF_B,Lions Gate Entertainment Corp. (LGF.B)
LGH,Northern Lights Fund Trust III (LGH)
LGHL,Lion Group Holding Ltd (LGHL)
LGHLW,Lion Group Holding Ltd (LGHLW)
LGI,Lazard Global Total Return and Income Fund Inc (LGI)
LGIH,LGI Homes Inc (LGIH)
LGL,LGL Group Inc (LGL)
LGLV,SPDR Series Trust (LGLV)
LGND,"Ligand Pharmaceuticals, Inc. (LGND)"
LGOV,First Trust Exchange-Traded Fund IV (LGOV)
LG_P_A,LACLEDE CP TR I 7.70 (LGpA)
LG_P_A_,(LGpA_)
LG_P_A_1,(LGpA)
LGVW,Longview Acquisition Corp (LGVW)
LGVW_U,Longview Acquisition Corp (LGVW.U)
LGVW_WS,Longview Acquisition Corp (LGVW.WS)
LH,Laboratory Corp. Of America Holdings (LH)
LHC,Leo Holdings Corp (LHC)
LHCG,LHC Group Inc (LHCG)
LHCU,Leo Holdings Corp (LHCU)
LHC_U,Leo Holdings Corp (LHC.U)
LHC_WS_1,Leo Holdings Corp (LHC.WS)
LHO,LaSalle Hotel Properties (LHO)
LHO_P_A_,(LHOpA_)
LHO_P_A_CL,LaSalle Hotel Properties (LHOpA.CL)
LHO_P_B_CL,LaSalle Hotel Properties (LHOpB.CL)
LHO_P_H_CL,LaSalle Hotel Properties (LHOpH.CL)
LHO_P_I,LaSalle Hotel Properties (LHOpI)
LHO_P_J,LaSalle Hotel Properties (LHOpJ)
LHO_P_RD_CL,LaSalle Hotel Properties (LHOpRD.CL)
LHO_P_RE_CL,LaSalle Hotel Properties (LHOpRE.CL)
LHO_P_RG_CL,LaSalle Hotel Properties (LHOpRG.CL)
LHO_P_RI,LaSalle Hotel Properties (LHOpRI)
LHO_P_RJ,LaSalle Hotel Properties (LHOpRJ)
LHX,L3Harris Technologies Inc (LHX)
LI,Li Auto Inc (LI)
LI_1,Laidlaw International (LI)
LIFE,Atyr Pharma Inc (LIFE)
LII,Lennox International Inc (LII)
LILA,Liberty Latin America Ltd (LILA)
LILAK,Liberty Latin America Ltd (LILAK)
LILAR,Liberty Latin America Ltd (LILAR)
LIN,Linde Plc (LIN)
LINC,Lincoln Educational Services Corp (LINC)
LIND,Lindblad Expeditions Holdings Inc (LIND)
LINDW,Lindblad Expeditions Holdings Inc (LINDW)
LINK,Interlink Electronics (LINK)
LINU,LiNiu Technology Group (LINU)
LINX,Linx S.A. (LINX)
LION,Fidelity Southern Corp. (LION)
LIQT,LiqTech International Inc (LIQT)
LIT,Global X Funds (LIT)
LITB,LightInTheBox Holding Co Ltd (LITB)
LITE,Lumentum Holdings Inc (LITE)
LIVE,Live Ventures Inc (LIVE)
LIVK,LIV Capital Acquisition Corp (LIVK)
LIVKU,LIV Capital Acquisition Corp (LIVKU)
LIVKW,LIV Capital Acquisition Corp (LIVKW)
LIVN,LivaNova PLC (LIVN)
LIVX,LiveXLive Media Inc (LIVX)
LIZI,Lizhi Inc (LIZI)
LJPC,La Jolla Pharmaceutical Co. (LJPC)
LK,Luckin Coffee Inc (LK)
LKCO,Luokung Technology Corp (LKCO)
LKCO_1,Luokung Technology Corp (LKCO)
LKFN,Lakeland Financial Corp. (LKFN)
LKM,Link Motion Inc (LKM)
LKOR,FlexShares Trust (LKOR)
LKQ,LKQ Corp (LKQ)
LKSD,LSC Communications Inc (LKSD)
LL,Lumber Liquidators Holdings Inc (LL)
LLEX,Lilis Energy Inc (LLEX)
LLIT,Lianluo Smart Ltd (LLIT)
LLL,L3 Technologies Inc (LLL)
LLLW_,L-3 Communications Holdings Inc (LLLw_)
LLNW,Limelight Networks Inc (LLNW)
LLQD,BlackRock Institutional Trust Company N.A. (LLQD)
LLY,Lilly(Eli) & Co (LLY)
LLY_WD,Eli Lilly and Co (LLY.WD)
LM,"Legg Mason, Inc. (LM)"
LMAT,Lemaitre Vascular Inc (LMAT)
LMB,Limbach Holdings Inc (LMB)
LMBS,First Trust Exchange-Traded Fund III (LMBS)
LMC,Lundin Mining Corp. (LMC)
LMFA,LM Funding America Inc (LMFA)
LMFAW,LM Funding America Inc (LMFAW)
LMHA,"Legg Mason, Inc. (LMHA)"
LMHA_1,Legg Mason Inc (LMHA)
LMHB,"Legg Mason, Inc. (LMHB)"
LMI,"Legg Mason, Inc. (LMI)"
LMI_1,"Legg Mason, Inc. (LMI)"
LMLB,UBS AG London Branch (LMLB)
LMLP,UBS AG London Branch (LMLP)
LMND,Lemonade Inc (LMND)
LMNL,Liminal Biosciences Inc (LMNL)
LMNR,Limoneira Co (LMNR)
LMNX,Luminex Corp (LMNX)
LMPX,Lmp Automotive Holdings Inc (LMPX)
LMRK,Landmark Infrastructure Partners LP (LMRK)
